index,origin,title,inputime,summary,link
1,中国新闻网,上海新增本土确诊病例41例、无症状感染者536例,1670284581000,无症状感染者15为台湾居民，在台湾地区探亲，自台湾地区出发，于2022年12月1日抵达上海浦东国际机场，入境后即被集中隔离观察，其间例行核酸检测异常。经排查，区疾控中心新冠病毒核酸检测结果为阳性。无症状感染者23为台湾居民，无症状感染者24为马来西亚籍，无症状感染者23、无症状感染者24在台湾地区生活，自台湾地区出发，乘坐同一航班，于2022年12月2日抵达上海浦东国际机场，入境后即被集中隔离观察,http://health.people.com.cn/n1/2022/1206/c14739-32581250.html
2,人民网,12月4日12时至5日12时厦门新增54例感染者,1670220121000,同安区 12月3日，14:30-14:40官浔社区老年中心核酸采样点，14:50-15:00台湾快剪（官浔店），16:59-17:00向阳坊（官浔店）。,http://fj.people.com.cn/n2/2022/1205/c181466-40220316.html
3,,2022年海峡两岸检察制度研讨会在福建平潭召开,1670212052000,台湾法学界有关人士通过视频连线或提交论文形式参加会议。与会人员围绕两岸金融安全、网络犯罪、涉案企业合规、刑事诉讼制度等四个专题进行深入研讨与交流。,http://fj.people.com.cn/n2/2022/1205/c181466-40220277.html
4,中国新闻网,在皖台湾教师：用心培育两岸“花朵”,1670201224000,今年34岁的袁翔瀚毕业于台湾铭传大学，主修应用语言文学专业，辅修英语专业。对教育充满热情的他，毕业后来到大陆就业工作。截至目前，该区共有500余名台湾青年人才在此工作生活，而在合肥康桥学校的台湾小朋友就超过100名。  同样来自台湾的陈薇如到合肥已经三年了。如今孩子们在康桥生活，既能跟台湾家乡有所联系，也能在合肥生活得很好。未来，安徽将与台湾高校深化“云端”与线下的交流，进一步推动皖台教育和科技合作。据安徽省人民政府台湾事务办公室统计，截至目前，安徽共有海峡两岸青年创业基地、台湾工业园等各类涉台园区19个，在安徽创业就业的台商、台青3000余人。(中新社记者 张俊）,http://edu.people.com.cn/n1/2022/1205/c1006-32580644.html
5,人民网－人民日报,港澳台各界持续深切缅怀江泽民同志,1670199733000,连日来，台湾各界持续对江泽民同志逝世表达哀悼。台湾资深媒体人黄智贤受访时表示，江泽民主席在任期间，坚持“和平统一、一国两制”方针，坚决遏制“台独”。台湾企业家郭亚陶表示，江泽民主席对两岸交流和人民福祉的关切令人感佩。台湾企业家章启正表示，江泽民主席的智慧与远见令人敬佩。台湾企业家李瑞河1993年回大陆寻根、创业。他说，江泽民主席在任期间，积极推动两岸关系发展，坚定了他扎根大陆的信心。近30年来，企业不断成长，自己的梦想一一实现。衷心感谢江泽民主席。,http://cpc.people.com.cn/n1/2022/1205/c448716-32580537.html
6,中国新闻网,上海新增本土确诊病例41例、无症状感染者524例,1670198700000,病例1为台湾居民，在台湾地区探亲，自台湾地区出发，于2022年11月26日抵达上海浦东国际机场，入境后即被集中隔离观察，其间出现症状。无症状感染者27为台湾居民，在台湾地区工作，自台湾地区出发，于2022年12月1日抵达上海浦东国际机场，入境后即被集中隔离观察，其间例行核酸检测异常。经排查，区疾控中心新冠病毒核酸检测结果为阳性。无症状感染者47为台湾居民，在台湾地区探亲，自台湾地区出发，于2022年12月2日抵达上海浦东国际机场，入境后即被集中隔离观察，其间例行核酸检测异常。经排查，区疾控中心新冠病毒核酸检测结果为阳性。,http://health.people.com.cn/n1/2022/1205/c14739-32580446.html
7,人民网－人民日报,港澳台各界持续深切缅怀江泽民同志,1670190409000,连日来，台湾各界持续对江泽民同志逝世表达哀悼。台湾资深媒体人黄智贤受访时表示，江泽民主席在任期间，坚持“和平统一、一国两制”方针，坚决遏制“台独”。台湾企业家郭亚陶表示，江泽民主席对两岸交流和人民福祉的关切令人感佩。台湾企业家章启正表示，江泽民主席的智慧与远见令人敬佩。台湾企业家李瑞河1993年回大陆寻根、创业。他说，江泽民主席在任期间，积极推动两岸关系发展，坚定了他扎根大陆的信心。近30年来，企业不断成长，自己的梦想一一实现。衷心感谢江泽民主席。   　　,http://hm.people.com.cn/n1/2022/1205/c42272-32580268.html
8,新华社,十年海青 同心同行——第十届海峡青年节峰会在福州举办,1670118311000,台湾台南出生、屏东长大的台青邱馨仪在峰会现场分享了自己以音乐同大陆结缘的故事，“我现在是福州海峡交响乐团副团长兼竖琴首席，让我与这里结缘的，正是新中国第一位歌剧交响乐女指挥家郑小瑛老师”。  　　我想对台湾有才华、有理想、有抱负的年轻乐手们说，加入福州海峡交响乐团，让我们一起在福州奏响幸福的交响。”邱馨仪说。  　　台青陈耘嘉在活动现场讲述了自己一家三代人与一杯茶的故事。  　　“1948年，我的爷爷从大陆去往台湾教书，但一直对家乡牵挂不已，总是告诉我的父亲不能忘根。”陈耘嘉说，他的父亲在爷爷的鼓励下回到大陆投资种茶，成了福建漳平台湾农民创业园的耕耘者。  　　“我看过结满厚冰的松花江，体验过四川、云南等地少数民族的风俗、服饰，还把这些见闻通过自媒体展现给台湾的观众。唯有走进大陆，才会知道这里有多迷人。”魏晖倪说。  　　参加峰会的台湾时事评论员邱毅鼓励两岸青年同心同行、携手打拼，凝聚两岸融合发展的思想共识。  　　此次活动由国务院台湾事务办公室、中华全国青年联合会、福建省人民政府共同主办。,http://tw.people.com.cn/n1/2022/1204/c14657-32580121.html
9,上观新闻,上海昨日新增本土确诊病例36例、本土无症状感染者450例,1670116451000,无症状感染者31为台湾居民，在台湾地区生活，自台湾地区出发，于2022年12月1日抵达上海浦东国际机场，入境后即被集中隔离观察，其间例行核酸检测异常。经排查，区疾控中心新冠病毒核酸检测结果为阳性。无症状感染者34为台湾居民，在台湾地区探亲，自台湾地区出发，于2022年12月1日抵达上海浦东国际机场，入境后即被集中隔离观察，其间例行核酸检测异常。经排查，区疾控中心新冠病毒核酸检测结果为阳性。无症状感染者47为台湾居民，在台湾地区探亲，自台湾地区出发，于2022年12月2日抵达上海浦东国际机场，入境后即被集中隔离观察，其间例行核酸检测异常。经排查，区疾控中心新冠病毒核酸检测结果为阳性。,http://sh.people.com.cn/n2/2022/1204/c134768-40219289.html
10,人民网－人民日报,港澳台各界深切缅怀江泽民同志,1670113993000,连日来，台湾各界以不同方式对江泽民同志逝世表达哀悼。台湾商业联合总会理事长张平沼致唁电表示，万分不舍，悲痛之情，溢于言表。江泽民先生对改革开放及推动两岸交流的贡献影响深远，他的离去令人哀恸。  　　台湾《观察》杂志发行人纪欣受访时说，江泽民主席是一位卓越的领导人，带领国家在改革开放和社会主义现代化建设中取得巨大成就，两岸同胞都为此感到骄傲和自豪。,http://cpc.people.com.cn/n1/2022/1204/c448716-32580073.html
11,人民网－《人民日报》,港澳台各界深切缅怀江泽民同志,1670113156000,连日来，台湾各界以不同方式对江泽民同志逝世表达哀悼。台湾商业联合总会理事长张平沼致唁电表示，万分不舍，悲痛之情，溢于言表。江泽民先生对改革开放及推动两岸交流的贡献影响深远，他的离去令人哀恸。　　台湾《观察》杂志发行人纪欣受访时说，江泽民主席是一位卓越的领导人，带领国家在改革开放和社会主义现代化建设中取得巨大成就，两岸同胞都为此感到骄傲和自豪。,http://hb.people.com.cn/n2/2022/1204/c194063-40219157.html
12,中国新闻网,第十届海峡青年节·海峡气象青年汇在福州举行,1670112255000,雪峰茶厂主理人、台湾青年林君盈带着多年潜心积累的种植经验来到现场“茶话气象”。活动中，林君盈向大家介绍了闽侯雪峰天气景观和一颗茶树一生的气象智慧。  　　在气象景观纪实大赛中，福建汤珺琳的作品《雨柱》、台湾蔡其昌的作品《夕阳下》获得一等奖。  　　福建与台湾一水相连，“地缘”相近，“气缘”相通，加强两岸气象交流活动，将更有力推动两岸气象深入合作，为增进两岸同胞共同福祉作出更大贡献。  　　此次活动由中国气象学会、福建省气象局主办，福建省气象学会、福州市气象局承办，台湾气象服务产业发展协会、福州市气象学会协办。(龙敏王晓佳),http://ent.people.com.cn/n1/2022/1204/c1012-32579998.html
13,人民网－人民日报,港澳台各界深切缅怀江泽民同志,1670099977000,连日来，台湾各界以不同方式对江泽民同志逝世表达哀悼。台湾商业联合总会理事长张平沼致唁电表示，万分不舍，悲痛之情，溢于言表。江泽民先生对改革开放及推动两岸交流的贡献影响深远，他的离去令人哀恸。  　　台湾《观察》杂志发行人纪欣受访时说，江泽民主席是一位卓越的领导人，带领国家在改革开放和社会主义现代化建设中取得巨大成就，两岸同胞都为此感到骄傲和自豪。,http://hm.people.com.cn/n1/2022/1204/c42272-32579952.html
14,新华网,港澳台各界深切缅怀江泽民同志,1670094584000,连日来，台湾各界以不同方式对江泽民同志逝世表达哀悼。台湾商业联合总会理事长张平沼致唁电表示，万分不舍，悲痛之情，溢于言表。江泽民先生对改革开放及推动两岸交流的贡献影响深远，他的离去令人哀恸。  　　台湾《观察》杂志发行人纪欣受访时说，江泽民主席是一位卓越的领导人，带领国家在改革开放和社会主义现代化建设中取得巨大成就，两岸同胞都为此感到骄傲和自豪。,http://hm.people.com.cn/n1/2022/1204/c42272-32579947.html
15,外交部网站,新时代的中阿合作报告,1670073641000,阿拉伯国家在中国恢复在联合国合法席位以及台湾等问题上给予中国有力支持。在台湾、新疆、香港、人权等涉及中国核心利益和重大关切的问题上，阿拉伯国家始终给予中方坚定有力的支持。  　　3、携手捍卫国际关系准则。在台湾问题上，阿拉伯国家支持一个中国原则。2022年8月，美国国会众议长佩洛西窜访台湾。全部22个阿拉伯国家重申一个中国原则，其中18国政府公开发声予中方支持。,http://world.people.com.cn/n1/2022/1203/c1002-32579937.html
16,福州日报,林宝金与郁慕明等海青节嘉宾座谈交流,1670045080000,2日，省委常委、市委书记林宝金与前来参加第十届海峡青年节峰会的台湾新党前主席郁慕明、全国台企联会长李政宏、台湾时政评论员王炳忠等两岸嘉宾座谈交流。福州与台湾同根同源、血脉相连，产业、经贸、人文等领域交流合作密切，特别是海峡青年节历经十载，已成为两岸青年的嘉年华，也是台湾青年了解大陆、融入大陆、到大陆发展的重要平台。下一步，将继续牵线搭桥，积极宣传推介，推动更多台湾优秀企业和人才来榕创新创业，促进两地交流合作不断取得新成效。,http://fj.people.com.cn/n2/2022/1203/c181466-40218968.html
17,福州日报,林宝金吴贤德与国台办副主任龙明彪座谈,1670043910000,他说，福建与台湾一衣带水，福州是祖国大陆距离台湾最近的省会城市。,http://fj.people.com.cn/n2/2022/1203/c181466-40218962.html
18,人民网,第十届海峡青年节峰会在福州举办 5位台青分享大陆追梦故事,1670040687000,海青节组委会办公室供图 来自台湾云林的王廷维，年初成为福州首批入住台胞公租房的租客，还成了福建首位台胞公寓“楼长”。当天，王廷维带着几把钥匙来到活动现场，分享他的“楼长”心得。台湾青年陈耘嘉2015年辞去在台湾的高薪工作，跨海回到爷爷的故乡龙岩漳平官田乡，和父亲一起推广生态茶叶种植。  陈耘嘉在现场分享。除了王廷维和陈耘嘉，峰会现场还有福州海峡交响乐团台湾青年演奏家邱馨仪，跨界艺术工作者、杭州公望两岸圆缘园艺术园区馆长魏晖倪，“海南青年五四奖章”获得者、海南自由港投资创业者、颖奕生物科技集团总裁凌楷钧作为台湾青年代表当天峰会还邀请到“中国青年五四奖章”获得者、港珠澳大桥管理局总工程师景强，阅文集团副总裁王睿霆，台湾时事评论员邱毅、王炳忠等四位观察嘉宾与分享嘉宾进行互动对话。他们肯定了大陆在办证服务、台胞公租房政策等引进台湾人才方面的政策优势、贴心服务，并从台青展示的“社区治理”“美丽乡村”等建设延展开，讨论中国式现代化进程中，台湾青年的机遇和作为，鼓励两岸青年携手打拼，共创美好,http://fj.people.com.cn/n2/2022/1203/c181466-40218955.html
19,福建日报,第十届海峡青年节峰会在榕举行 周祖翼致辞并宣布启动 赵龙主持,1670027614000,福建与台湾渊源深厚、往来密切，越来越多的台湾青年融入福建发展大潮。我们将深入学习贯彻中共二十大精神，加快建设海峡两岸融合发展示范区，努力把福建建成台胞台企登陆的第一家园。我们将聚焦台湾青年所愿所忧所盼，有针对性地推出更多政策措施，为台湾青年来闽学习、生活、就业、创业等提供更多机遇和便利条件，让大家与福建青年一道，拼在福建、赢在福建、爱在福建。希望大家多来福建走走看看，让更多台湾青年了解大陆、来到大陆，共同创造祖国完全统一、民族伟大复兴的光荣伟业。新党前主席郁慕明、全国台湾同胞投资企业联谊会会长李政宏出席，合作单位代表通过视频致辞，台湾嘉宾代表现场致辞。第十届海峡青年节以“融合发展、文化传承”为主题，将举办海峡青年节峰会、两岸青年文化交流周、“走进政协·台湾青年说”、海峡气象青年汇、闽台人才协作论坛、海峡乡创生活节等系列活动。（记者 周琳）,http://fj.people.com.cn/n2/2022/1203/c181466-40218697.html
20,人民网－人民日报,港澳台各界深切缅怀江泽民同志,1670026142000,连日来，台湾各界持续对江泽民同志逝世表达哀悼。2日，统一联盟党主席戚嘉林致唁电表示，江泽民同志是两岸同胞公认享有崇高威望的卓越领导人、政治家，在台湾问题上推动两岸交流，发展两岸关系。台湾劳动党主席吴荣元同日致唁电表示，江泽民主席诚心诚意地关怀岛内爱国统一力量团体，致力于推动两岸交流交往，为推进完成祖国统一大业指出光明的前进道路。他的精神永垂不朽。,http://cpc.people.com.cn/n1/2022/1203/c448716-32579704.html
