title,date,summary,link,content
中評委一致通過！鄭寶清被開除黨籍　鄭運鵬競辦：尊重,2022-09-08 19:10:00,【記者張沛森／桃園報導】針對民進黨籍前立委鄭寶清，自行登記參選桃園市長，民進黨中評會今天（8日）下午開會，全體中評委一致通過，依照黨規違紀參選，決議開除黨籍。民進黨桃園市長候選人鄭運鵬競辦表示，尊重民進黨中評會的決議；民眾黨桃園市長候選人賴香伶競辦則表示，不回應；而對手之一國民黨桃園市長候選張善政競辦表示，目前暫無回應。,https://tw.nextapple.com/politics/20220908/01831C7E70FD81B0D4F6CC4E7B7595A0,鄭寶清今天則在中評會開會前召開記者會表示，他這輩子都在為台灣努力，有客家人的硬頸精神，不被摸頭也不怕被砍頭。民進黨中評會依據民進黨公職候選人提名條例第十二條，違紀參選者或不參選者，第三條第一、二、三類，逕由中央評議委員會，同條第四、五類逕由縣市黨部評議委員會於候選登記截止後，10日內從嚴議處。根據紀律評議裁決條例第十二條，本黨黨員未經提名違紀參選者，應予除名處分。對於被開除黨籍，鄭寶清表示，開除他就是「乞丐趕廟公」，把堅持黨的理想、建黨精神的人開除了。他說，社會希望民進黨能改革，但開除他以後，就跟社會價值愈來愈遠。鄭寶清指出，希望民進黨回到建黨精神，一起為台灣未來努力，才能對抗中國對台灣的壓迫。他說，被開除了很輕鬆，他不是抬頭看上面，而是低頭看人民，人民的意志最重要，「我愛民進黨」。壹蘋娛樂粉專：https://www.facebook.com/nextapple.entertainment壹蘋新聞網粉專：https://www.facebook.com/nextapplenews.tw
蔣萬安巨幅廣告出包「競選標語沒人懂」　口譯哥趙怡翔酸：外媒都在轉傳,2022-09-08 20:14:00,【即時中心／綜合報導】台北市長選戰形成三角督態勢，其中國民黨市長參選人蔣萬安以「你+台北就是無限」做為競選標語，卻被民進黨籍口譯哥趙怡翔批評，外媒在傳蔣萬安的一面巨幅廣告，競選標語讓人難不懂。,https://tw.nextapple.com/life/20220908/01831D05A5B1881538BD2D20C572AF5D,口譯哥趙怡翔今在臉書發文，貼出一張蔣萬安的巨幅競選廣告，其中還框出「就無是限」四字。原來是將競選標語「你+台北就是無限」寫成「就無是限」，甚至「外媒朋友都在轉傳」，口譯哥還酸，「蔣萬安你累了嗎？」。壹蘋娛樂粉專壹蘋新聞網粉專
打臉人設多變說？蔣萬安昨安排酒吧行程　陳時中：也是一種進步,2022-09-08 22:43:00,【記者賴昀岫／台北報導】人設問題是2022年台北市長選戰各陣營攻防的焦點之一，其中國民黨參選人蔣萬安日前曾批評民進黨參選人陳時中人設多變，並喊話陳時中，年輕人最在乎的是誠信問題，不過蔣萬安昨（9/7）也造訪酒吧，陳時中今天被問到相關看法，表示多了解是好事，蔣萬安這樣也是一種進步。,https://tw.nextapple.com/life/20220908/01831AF608196C658412A998C97A779A,蔣萬安昨天前往酒吧與青年店家對談、拋振興方案，然陳時中過去前往大安區性別友善酒吧，並學習調酒等可以拉近與年輕人距離的活動，後遭蔣萬安酸說，酒後還是要面對疫苗問題，並強調年輕人最在乎的還是政治人物的誠信問題。陳時中競辦今（9/8）上午舉辦「性別與照顧政見發布記者會」，會後有媒體針對蔣萬安去酒吧的行程提問，蔣萬安過去批評他人設多變，批評陳時中去性別友善酒吧，但自己昨天也去酒吧，會不會覺得蔣萬安嘴巴說不要但身體很誠實？陳時中回應，「倒也不盡然」，畢竟想要做市長的人，對市內發生的事情在多了解，是對的事情，陳時中並指出，自己也在努力了解不同年齡層與面向的需求，「我想蔣委員有這樣做，也是一種進步」。現場媒體接著又詢問，蔣萬安昨天到大安區白蘭市場拜票，當時發生1位阿嬤被撞到，而蔣萬安卻被發現過了1分鐘才去查看對方情況，其團隊甚至被批評，人受傷當下還在進行直播與拜票行為，陳時中今天被問到，會不會覺得蔣萬安這樣應變能力稍嫌不足？陳時中說，「確實啦」，行程中有高齡者尤其需要注意，因為拜票固然重要，但人身安全則更重要，而這也牽涉到經驗與團隊對事情嚴重度的關切程度不同，「如果是我們的話，我們大概以人身安全為最重要的考量」。壹蘋娛樂粉專壹蘋新聞網粉專
中國疫情升溫下單放緩　鈞興8月營收月減8.6％ ,2022-09-09 07:30:00,【記者許麗珍／台北報導】精密齒輪大廠鈞興機電(4571)受今年中國疫情升溫，影響整體供應鏈出貨順暢度，加上全球通膨、升息環境下，短期電動工具、園林工具等主要客戶下單節奏較去年同期放緩，因此今年8月合併營收新台幣1.89億元，月減8.6％；累計今年1至8月合併營收為16.4億元，年減16.78％。,https://tw.nextapple.com/finance/20220909/01831E5117932A1D5511438A882F3DD2,鈞興-KY公布今年8月合併營收新台幣1.89億元，較上月的2.07億元，減少8.60％；累計今年1至8月合併營收為16.4億元，較去年同期減少16.78％。鈞興-KY表示，集團為電動工具、園林工具、縫紉機等領域主要客戶重要合作供應夥伴，且長期保持良好業務合作基礎，目前與各領域主要客戶針對明年新款產品開發案件量，仍較去年同期增加，有望隨著新產品開發進展穩步推進，助力未來整體營運正面挹注。另外看好全球企業深化節能減碳，以及工業4.0發展帶動自動化生產需求增溫，鈞興-KY指出，集團戮力深化機器人應用的高精密齒輪研磨、諧波減速器、中置電機等高利基產品開發，以拓展工業機器人、電動助力車領域業務表現。看好全球智慧製造、工業機器人等長期市場趨勢，鈞興KY除了近年於工業機器人領域業務逐步取得斬獲，已切入全球前四大工業機器人廠商的其中2家供應鏈，並持續增加整體訂單銷售貢獻，鈞興-KY另積極拓展應用於電動助力車領域的中置電機產品送樣。展望今年第3季，鈞興-KY仍謹慎觀察全球通膨、疫情、國際情勢變化等對於整體經濟、消費需求干擾，集團仍持續與電動工具、園林工具等主要客戶進行新款產品研發，拓展新客戶業務合作契機，推動工業機器人應用齒輪、諧波減速器產品銷售，提升對於整體營運貢獻，助力保持集團整體營運銷售表現，鈞興KY表示，集團仍以提升越南廠產能稼動率、精進學習曲線目標不變，以期逐步於未來展現良好綜效。壹蘋娛樂粉專：https://www.facebook.com/nextapple.entertainment壹蘋新聞網粉專：https://www.facebook.com/nextapplenews.tw
反對中國片面改變現狀　日印將加強海洋安保合作,2022-09-09 09:26:00,日本與印度今天（9/9）在東京舉行外交與國防部長級會議（2加2會談）。鑑於中國擴大海洋行動，日印反對以武力片面改變現狀的作法。日印將加強海洋安保合作，擴充聯合演訓。,https://tw.nextapple.com/international/20220909/01831FDAC95D973E385B6F9C5CB26B29,日本經濟新聞報導，第2屆日印2加2會談在東京舉行，日方由外務大臣林芳正、防衛大臣濱田靖一；印方由外交部長蘇杰生（Subrahmanyam Jaishankar）、國防部長辛赫（Rajnath Singh）出席。會談中，林芳正表示，目前世界既有秩序正受到挑戰，因此合作的必要性增高。有關日印關係，蘇杰生強調，有必要進一步加強安全保障及外交。壹蘋娛樂粉專：https://www.facebook.com/nextapple.entertainment壹蘋新聞網粉專：https://www.facebook.com/nextapplenews.tw日方在會談中表達日本將在5年內徹底加強日本國防能力的決心，這包括將研議擁有「反擊能力」。日印2加2會談聯合聲明中明確記載，印度了解到日本將強化國防能力的決心。會談中，日印兩國也針對國防裝備，包括在陸上無人車輛、機器人工學等領域將進行共同研究。聯合聲明中記載，將更進一步鎖定未來要進行合作的具體領域。濱田今天與辛赫在舉行會談時，針對日本航空自衛隊與印度空軍將首度舉行戰鬥機聯合演訓一事進行協商。日本政府27日將在東京舉行前首相安倍晉三國葬，印度總理莫迪（Narendra Modi）預定出席，訪日期間可能與日本首相岸田文雄舉行會談。報導說，日印兩國陸續舉行會談，主要是在意中國的動向，這包括台灣海峽局勢緊張、中國的研究測量船進入斯里蘭卡港口。日印以2008年公布的「安全保障合作聯合宣言」為基礎加強國防合作。對印度而言，日本是僅次於美國，第2個與印度設有外交、國防2加2會談框架的國家。2012年日本海上自衛隊與印度海軍首度實施聯合演訓，包括多國的演訓在內，多次實施聯合演訓。2020年日印締結了「物品勞務相互提供協定」（ACSA）。日印將加強國防合作，主要是日本希望拉攏在安全保障上與俄羅斯關係強的印度。這5年來，印度的國防裝備以金額而言有5成是來自俄羅斯。印度參與俄羅斯9月1至7日在遠東地區主辦的大型軍演「東方-2022」（Vostok-2022），但在日本所稱的「北方領土」的演習，印度事先向日本政府表達不參與，展現某種程度的顧慮，但美日對印度的動向仍存憂慮。中俄在軍事上漸漸接近，如果印度加入俄羅斯陣營，東亞的安全保障難保不會失衡。（中央社）
英國女王駕崩｜伊麗莎白二世逝世　習近平致唁電,2022-09-09 14:23:00,英國女王伊麗莎白二世逝世後，中國國家主席習近平致唁電，表示深切的哀悼。,https://tw.nextapple.com/international/20220909/018320EA7415F741DC8F314AA6905024,白金漢宮當地時間8日宣布，英國女王伊麗莎白二世（Queen Elizabeth II）辭世，享耆壽96歲。據央視新聞，習近平今天（9/9）就英國女王伊麗莎白二世逝世向英國新任國王查爾斯三世致唁電。壹蘋娛樂粉專：https://www.facebook.com/nextapple.entertainment壹蘋新聞網粉專：https://www.facebook.com/nextapplenews.tw報導指出，習近平代表中國政府和中國人民並以個人的名義，對伊麗莎白二世女王逝世表示深切的哀悼，向英國王室、政府和人民致以誠摯的慰問。此前，習近平今年以來二度向伊麗莎白二世致電，一次是祝賀她登基70週年，另一次是對她感染COVID-19（2019冠狀病毒疾病）病毒表示慰問。白金漢宮正式宣布女王逝世後，陸媒相繼作出報導，直至今天上午陸續推出伊麗莎白二世的生平介紹、在位期間的中英關係、王室內部關係，以及相關軼聞。其中一張她與菲利浦親王1986年訪中時共遊長城的舊照最受關注，不少網友予以轉發。（中央社）
金正恩：北韓可能11月起接種COVID-19疫苗,2022-09-09 15:54:00,為了因應冬季COVID-19（2019冠狀病毒疾病）疫情升溫，北韓官方媒體今天（9/9）報導，北韓最高領導人金正恩（Kim Jong Un）表示北韓可能自11月開始接種COVID-19疫苗，並佩帶口罩。,https://tw.nextapple.com/international/20220909/0183212E6A53D32C5C242F5D37ACE607,路透社報導，金正恩昨天在北韓國會演講中，引述世界衛生組織（WHO）提出的警訊，到了冬季COVID-19疫情可能捲土重來，「因此，除了負責任的接種疫苗，我們也應該建議所有居民11月起開始佩帶口罩，以保護他們的健康」，但並未詳述細節。北韓尚未證實有接種任何一款COVID-19疫苗，但根據海關資料顯示，北韓今年已從中國進口一些疫苗，但不清楚是哪些廠牌。壹蘋娛樂粉專：https://www.facebook.com/nextapple.entertainment壹蘋新聞網粉專：https://www.facebook.com/nextapplenews.tw金正恩上個月才宣布戰勝COVID-19疫情，並下令解除5月實施的最大規模抗疫措施，但說明北韓必須維持「固若金湯的防疫屏障。」北韓從未證實國內有多少民眾感染COVID-19，但每天都會公布發燒病人的數量，估計在2500萬名北韓人當中，發燒病例累計有477萬例。不過，北韓自7月29開始就不再通報新增的病例，死亡人數則停留在74人。包含WHO在內的專家都質疑這些數字，因為北韓明顯缺乏檢測量能。（中央社）
免量體溫！港府再放寬出境、過境搭機防疫規定,2022-09-09 21:41:00,【方璇／綜合外電】香港政府今天（9/9）宣布，放寬往來海外或台灣班機值勤的駐港機組人員的新冠肺炎檢疫限制；前往台灣或海外的旅客也無須接受體溫篩檢，新規明（10日）起生效。,https://tw.nextapple.com/international/20220909/0183227B86A9E3EA115C578C0903A62D,香港政府指出，目前大部分海外地區已取消有關新冠的入境限制，港府明天起暫停為從香港出境及經香港過境往海外地區或台灣的乘客進行體溫篩檢。至於抵港入境及從香港出境前往中國或澳門的乘客，港府表示會繼續體溫篩檢。至於往來海外或台灣班機值勤的駐港機組人員，在抵達香港後須在機場接受核酸檢測及等候檢測結果，若檢測結果為陰性即可進出社區，不用檢疫，但須定期檢測。此外，機組人員抵達香港後首3天需接受醫學監察，包括避免在公共場所脫口罩、前往人多的地方和參加大型聚會，並記錄個人行蹤。政策同樣於明天凌晨生效。壹蘋新聞網粉專：https://www.facebook.com/nextapplenews.tw壹蘋娛樂粉專：https://www.facebook.com/nextapple.entertainment
日本帛琉東京高峰會　強調台海和平穩定重要性,2022-09-10 09:32:00,【國際中心】日本首相岸田文雄9日在首相公邸（寓所）與來訪的帛琉總統惠恕仁舉行會談，鑑於中國逐漸擴大霸權，兩人都反對試圖以武力片面改變現狀，且強調台灣海峽和平穩定的重要性。,https://tw.nextapple.com/international/20220910/01832506EB5A2C49C6CAC8F6672436A9,"日本產經新聞報導，岸田與來訪的帛琉總統惠恕仁（Surangel S. Whipps, Jr.）9日舉行會談，兩人都同意要加強合作以實現「自由開放的印度太平洋」。中國在南太平洋地區的影響力增強之際，帛琉與台灣維持邦交，與中國保持距離。帛琉是親日的國家，岸田很重視與帛琉的關係，希望加強兩國合作以阻止中國擴大霸權。鑑於中國的行徑，岸田與惠恕仁都認為，反對在東海、南海有國家試圖以武力片面改變現狀。兩人也都了解到台海和平穩定的重要性。岸田在會談時言及俄羅斯侵略烏克蘭一事。他表示，共享民主、法治等基本價值的國家團結合作是很重要的。此外，針對COVID-19（2019冠狀病毒疾病）疫情影響打擊帛琉觀光業一事，岸田表示將予以支援。惠恕仁對於日本的支援表達謝意。他同時表示，帛琉與日本一樣，會延續法治、和平、穩定性，譴責軍事性的侵略、統治。岸田與惠恕仁舉行會談前，日本與帛琉兩國政府已達成協議，日本將對帛琉輸電網的整備提供最多21億4000萬日圓（約新台幣4億7230萬元）的無償資金合作。報導說，帛琉是人口僅約1萬8000人的小國，但岸田相當禮遇惠恕仁，兩人會談時間長達淤1小時10分，看得出岸田很積極想加強與帛琉的關係。目前在南太平洋地區，中國的影響力逐漸增強。所羅門群島與吉里巴斯2019年與台灣斷交，與中國建交。所羅門群島與中國簽署了安全保障協定。在這種情況下，帛琉政府仍維持與台灣的外交關係。二戰前曾有25年（1/4世紀），帛琉由日本委任統治，是親日的國家。今年5月日本外相林芳正造訪帛琉，與惠恕仁舉行會談，兩人都對於所羅門群島與中國簽署協定一事感到憂慮。（中央社）壹蘋娛樂粉專：https://www.facebook.com/nextapple.entertainment壹蘋新聞網粉專：https://www.facebook.com/nextapplenews.tw"
騰雲簽定量販及日本服飾金流系統建置　海內外訂單已排程到明年,2022-09-10 10:00:00,【記者蕭文康／台北報導】OMO數位轉型商騰雲（6870）騰雲表示，因應疫情成為新常態，OMO線上融合線下的客、商、金流數位轉型解決方案成為產業剛性需求，海內外相關建置訂單已排程到明年，持續墊高一次性與持續性收入，公司十分樂觀看待今年下半年度業績成長。,https://tw.nextapple.com/finance/20220910/01832401912B8FFB7EF742CD77D2C2C0,以收入組成來說，除百貨商場的在手訂單持續穩定增長外，本月也有量販及日本大型服飾連鎖品牌的客商金流系統建置訂單簽訂，持續開展不同業態的商業場域；同時騰雲亦不斷融合新科技精進自身產品，針對既有客戶，如：中國AEON MALL (日本永旺集團旗下的連鎖零售企業)20多個商場，進行全面智慧運營管理系統升級，持續為集團營收創造良性循環。展望下半年，根據2022 iThome CIO調查報告中指出，台灣服務業持續開拓及整合新通路及服務，以實現獲客及提升業績，今年投入數位轉型預算較去年大幅增長近5成。因此，騰雲董事長梁基文表示，目前騰雲的訂單滿載，為因應業務拓展需求，近1年已增員超過20%，持續協助場域業者進行數位轉型解決方案布建，下半年業績表現十分樂觀。梁基文同時提到，下一階段公司的高速成長需要仰賴更多的數位人才加入，本月也與台大系統合作開立實習課程，整合學界資源，培育具有跨域、管理思維的敏捷型數位人才，奠定騰雲集團長期於海內外發展之基石。騰雲集團8月合併營收超過4500萬元，年增51.76%，為單月歷史次高，1-8月累積營收超過2.88億元，年增21.06 %，營運高速成長，法人預估第3季營收有望創歷史新高。壹蘋娛樂粉專：https://www.facebook.com/nextapple.entertainment壹蘋新聞網粉專：https://www.facebook.com/nextapplenews.tw
紐時：習近平力拚共同富裕　中國富豪選擇出走,2022-09-10 13:57:00,中共領導人習近平力拚共同富裕，但中國富豪卻相繼選擇出走，他們落腳海外遠端遙控公司與集團的運作，以致中國越來越多民營企業主擔憂，當前的中國正偏離鄧小平的改革開放路線。,https://tw.nextapple.com/international/20220910/018325DBA318C86EA78077B9D02C2484,紐約時報（The New York Times）9日報導，有錢有勢的企業家在中國曾廣受崇拜與政府青睞和投資者追捧，他們幫助中國成為經濟強國，如今的政府重視政治和國安並打擊企業，他們低調退出，或徹底離開這個國家。最近的一次外流中，潘石屹和張欣本週分別辭去房地產帝國Soho董事長和執行長，兩人在COVID-19（2019冠狀病毒疾病）爆發疫情之初就已經搬到美國，並於深夜遠距管理他們在中國的企業。過去25年間，潘石屹和張欣在中國快速城市化的進程中發大財，這對夫婦打造的建案包括北京銀河Soho和望京Soho、上海凌空Soho等，迎合中國最富有的精英階層，隨即房產業佔中國整個經濟比重達到近1/3。但隨著習近平倡議「共同富裕」，要求企業和商業大亨與民眾分享更多財富以化解貧富差距，中國企業家面有難色，習近平還強調黨要掌控民營企業，企業和商人必須在政治上保持忠誠。哈佛大學費正清中國研究中心主任宋怡明（Michael Szonyi）說：「一般來說，21世紀初期取得巨大成功的企業家要思考的問題是，繼續掌管他們的企業以及留在中國是否符合他們的最佳利益。顯然，對於這些公司創始人來說，答案已經很明確。」他們的辭職凸顯民營企業家越來越擔心，中國正偏離鄧小平和前總理朱鎔基開創的自由放任資本主義，自習近平主政以來，中國更威權並重視國安又加強對民營企業控制，敢於質疑習近平的商界領袖都已被捕入獄。任志強是潘石屹的朋友，他因批評習近平而被判處18年有期徒刑，導致企業家噤若寒蟬，潘石屹和張欣的微博帳號仍活躍，但他們已經很少發內容，並且只關注溫和乏味的話題。曾經帶領阿里巴巴稱霸中國電子商務的聯合創始人馬雲已辭卸公司的高層職位，阿里巴巴競爭對手拼多多的創始人黃崢在卸任CEO不及一年，去年初又辭卸董事長。一年前，TikTok母公司字節跳動創始人張一鳴也說他要辭掉CEO，上海封城期間，另位著名的科技企業家和風險投資家周航毅然選擇出走長居溫哥華，同時在當地痛斥中國現行的政策。新加坡國立大學李光耀公共政策學院的客座研究學者唐安竹（Drew Thompson）表示：「這是中共演變進程的一部分，私人企業家是高調的富裕階層，這群人與『共同富裕』以及習近平所選擇的道路已經愈發不相容了。」（中央社）█壹蘋娛樂粉專：https://www.facebook.com/nextapple.entertainment█壹蘋新聞網粉專：https://www.facebook.com/nextapplenews.tw
今本土35594、境外236+30死　疫情再升高！確診比上周多快1成,2022-09-10 14:01:00,"【記者林芳如／台北報導】中央流行疫情指揮中心今(9/10)下午說明最新疫情，發言人莊人祥宣布，今增35,594例本土個案及236例境外移入，另確診個案中新增30例死亡，而各縣市新增仍以新北最多，已連續5天破7千例。",https://tw.nextapple.com/life/20220910/018325C4EC367C97F6F766E2A9278C29,"莊人祥也說，今本土病例數比昨(9/9)增加1574例，增幅4.6%，也比上周六增3065例，增幅9.4%。針對今增確診，指揮中心表示，今日新增35,594例本土病例，為16,106例男性、19,478例女性、10例調查中；年齡介於未滿5歲至90多歲以上；個案分布為新北市(7,646例)，臺中市(4,545例)，臺北市(4,503例)，桃園市(3,783例)，高雄市(2,726例)，臺南市(2,038例)，彰化縣(1,617例)，新竹縣(1,011例)，宜蘭縣(937例)，屏東縣(887例)，苗栗縣(841例)，新竹市(822例)，雲林縣(779例)，基隆市(721例)，南投縣(666例)，花蓮縣(662例)，嘉義縣(477例)，嘉義市(352例)，臺東縣(257例)，金門縣(179例)，澎湖縣(129例)，連江縣(16例)。對於死亡個案，案指揮中心指出，今日新增30例本土病例死亡個案，為19例男性、11例女性，年齡介於40多歲至90多歲以上，皆屬重度感染、27例具慢性病史、21例未接種3劑以上COVID-19疫苗。確診日介於今年7月6日至9月6日，死亡日期介於7月6日至9月7日。針對境外移入，指揮中心說明，今日新增236例境外移入個案中，為138例男性，98例女性，年齡介於未滿5歲至80多歲，分別自越南(8例)、泰國(7例)、菲律賓(4例)、馬來西亞(3例)、土耳其及日本(各2例)、香港、法國、韓國、美國、印度、澳門、新加坡、澳大利亞及中國(各1例)移入，另201例感染國家調查中。入境日期介於今年8月13日至9月9日。指揮中心統計，昨莫德納幼兒疫苗總接種2904人，包含第一劑接種858人、第二劑2046人；輝瑞BNT幼兒疫苗第一劑接種3347人；昨全台共接種31,748 人，目前疫苗人口涵蓋率第一劑93.19%、第二劑87.04%、基礎加強劑0.8%、追加劑72.61%、第二次追加劑9.94%，65歲以上接種率35.3%。截至目前，國內累計16,709,482例新型冠狀病毒肺炎相關通報(含11,051,306例排除)，其中5,650,028例確診，分別為30,392例境外移入，5,619,582例本土病例，36例敦睦艦隊、3例航空器感染、1例不明及14例調查中。2020年起累計10,255例COVID-19死亡病例，其中10,239例本土，個案居住縣市分布為新北市2,172例、臺北市1,145例、臺中市1,031例、高雄市962例、臺南市788例、桃園市778例、彰化縣600例、屏東縣414例、雲林縣323例、南投縣302例、苗栗縣255例、嘉義縣242例、基隆市223例、宜蘭縣209例、花蓮縣170例、嘉義市165例、新竹縣163例、臺東縣146例、新竹市104例、澎湖縣28例、金門縣19例；另16例為境外移入。壹蘋娛樂粉專壹蘋新聞網粉專"
