title,date,summary,link,content
合體造勢！劉建國批雲林張家「近親繁殖」　蔡其昌要找回台中光榮,2022-09-24 21:47:00,【記者鮮明／台中報導】民進黨今天（9/24）在台中舉辦「民主36挺18」黨慶音樂會，邀請新北市及中部5縣市的縣市長參選人致詞。雲林縣長參選人劉建國火力全開，痛批對手、現任市長張麗善家族「近親繁殖」，阻擋農會改革、濫墾濫伐；台中市長參選人蔡其昌則痛批盧秀燕滿意度排名落後，他有信心贏回台中，找回台中的光榮與驕傲。,https://tw.nextapple.com/politics/20220924/01836F265EFBB53B198E72F078191613,率先致詞的新北市長參選人林佳龍，細數民進黨誕生、民主轉型過程，以及自己就讀台大時參與推動校園自治、教官退出校園、野百合學運等，促成國會全面改選、終止動員勘亂時期臨時條款，也正式啟動台灣民主化，近年來太陽花世代崛起，讓人看到年輕人參與政治的熱情，翻轉台灣的政治，應讓更多年輕人參與改造國家的過程。南投縣長參選人蔡培慧提到自己18歲在台北念書時發生520農運，當時她在報紙上看到農民和警方在「車拚」，後來去翻看黨外雜誌，才發現國民黨政府的不公不義，促使她在大埔事件、太陽花運動站出來，投入政治、扭轉政策。彰化縣長參選人黃秀芳說，自己從助理、議員到立委，27年來可以自在地從事政治活動，是黨內政治前輩打拚的結果，未來我們也要為18歲公民權努力，也提醒民眾年底選舉還有一張18歲公民權修憲複決的選票。苗栗縣長參選人徐定禎說，就讀新竹中學時正是黨外運動風起雲湧的時代，尤其是美麗島公審的畫面最令他震撼，這些民主前輩不憂不懼的精神令人敬佩，民主自由的種子也種在心裡，直到50歲才參與政治；苗栗是艱困選區，但這次有信心「翻轉苗栗、改變成真」。雲林縣長參選人劉建國痛批雲林縣長期被國民黨把持，不只是近親繁殖，哥哥（前縣長張榮味）當完縣長換妹妹（現任縣長張麗善）當，妹妹的丈夫（張永成）當中華民國農會總幹事，農委會陳主委只是為了提高農會賄選的刑度，他們就不高興，準備花 1億元來杯葛抵制，連她的弟弟（張啟盟）為了種咖啡，佔用國土濫墾濫伐，影響居民生命財產安全，他要為雲林、民進黨爭一口氣，更希望台灣更多18歲年輕人加入，共同關心雲林及台灣的未來。最後登場的蔡其昌則說，這場選舉他和民進黨很多候選人一樣，要挑戰現任的縣市長，現任市長以為故意把國民黨藏起來，大家就會忘記她是國民黨提名的，國民黨面對中國威脅，對顧台灣的立場、兩岸定位都不明確，蔡總統帶領台灣守護民主自由，也需要有相同立場的地方縣市長，和蔡總統站在一起守護台灣。蔡其昌說，盧市長以為這場選舉只要靜靜坐在辦公室就會贏，但台中人沒那麼笨，台中人對政治人物的要求很高，蔡其昌每天2、30場的大小說明會講自己的政見，用雙腳走遍全台中625個里，就是為了向鄉親說明未來台中該如何改變。他說，台中不能再拖，不能再原地踏步，林佳龍下台時，台中PM2.5濃度排名第11名，盧秀燕說要「市長換人、空氣換新」，結果現在排12、13名，遠見雜誌、天下雜誌排名在後段班，4年來台中漸漸失去光榮、驕傲，「要選讓台中人走路有風的蔡其昌當市長！」★快點加入《壹蘋》Line，和我們做好友！★按讚追蹤《壹蘋新聞網》各大臉書粉絲團，即時新聞不漏接！！！►壹蘋即時報報 粉絲團►壹蘋娛樂 粉絲團►壹蘋時尚 粉絲團
蔡英文黨慶合體6縣市長參選人　籲「翻轉家鄉、改變地方」,2022-09-24 21:57:00,【記者鮮明／台中報導】民進黨中央力挺台中市長參選人蔡其昌，今天慶祝36周年黨慶，選在台中市烏日區舉辦「民主36挺18黨慶音樂會」，包括總統蔡英文、副總統賴清德、行政院長蘇貞昌及6位縣市長參選人均到場。蔡英文呼籲選民用手中的選票「翻轉家鄉、改變地方」，讓中央、地方連成一線，拼出更好的未來。,https://tw.nextapple.com/politics/20220924/01836EA6D665A73C15C10194E002BC27,9月28日為民進黨的黨慶，黨中央提早於今天在烏日區「台中國際展覽館」，舉辦「民主36挺18黨慶音樂會」，「36」意指民進黨已36歲，「挺18」就是指挺18歲公民權修憲的複決。音樂會下午2時30分正式展開，總統蔡英文、副總統賴清德、行政院長蘇貞昌均全程參與，縣市長參選人新北林佳龍、南投蔡培慧、彰化黃秀芳、苗栗徐定禎、雲林劉建國及台中蔡其昌等人也輪番上台致詞。蔡英文表示，民進黨36年來參與台灣從威權走向民主，歷經在野走向執政，追求民主從來就不是一條輕鬆的路，不論挑戰再怎麼艱辛，台灣人民都一起走過，民進黨也承載人民的期待推動民主，今天能在自由開放的環境中聆聽民主的歌 曲，這些都是前輩犧牲奉獻爭取的成果，從爭取民主到守護民主，正是民進黨黨慶最重要的意義。談到這次推動18歲公民權修憲的複決，蔡英文說，18歲在法律上已須承擔許多責任，我們一起讓修憲案通知，讓年輕人一起承擔國家的未來；現在全世界都在關注台灣的未來，在這個關鍵時刻，更要把民主當作對外定義台灣國際角色、對內強化社會的核心戰略，而全球主要民主國家都已實施18歲公民權，台灣一定要跟上腳步。蔡英文說，民進黨是會做事的團隊，中央有「衝衝衝」行政院長蘇貞昌帶領的執政團隊，為了反映經濟成長動能，明天中央總預算規模史上最高，在少子化、長照、租金補貼的預算也最高，在地方有7個會做事的地方執政團隊，都締造亮眼的成績，為了進一步把中央執政成果落實到地方，政府也加碼地方建設預算，也會推出會做事的縣市長候選人，讓「會做事」成為地方執政的新標準。蔡英文也特別介紹在場縣市長候選人，表示每一位都是戰將，已準備好要翻轉家鄉、改變地方，呼籲大家用手中的選票，讓中央、地方連成一線，一起打拚，「我們有信心，也有決心，為家鄉拚出更好的未來！」★快點加入《壹蘋》Line，和我們做好友！★按讚追蹤《壹蘋新聞網》各大臉書粉絲團，即時新聞不漏接！！！►壹蘋即時報報 粉絲團►壹蘋娛樂 粉絲團►壹蘋時尚 粉絲團
義大利國會選舉中右翼勝算高　可望出現友台總理,2022-09-24 23:00:00,義大利25日將舉行國會大選，兩院席次皆因修憲而大減，在中左翼內部分裂之際，預計中右翼聯盟將勝出，右翼義大利兄弟黨黨魁梅洛尼有望出任新總理，而她的立場反中友台。,https://tw.nextapple.com/international/20220924/01836FEC56273F1D9828C01A92D40439,█義大利本次國會大選如何運作？義大利選民將於9月25日（周日）早上7時起開始投票，於晚間11時結束投票。由於義大利2020年舉行公投，通過修憲案減少國會席次，這次國會大選總席次將不同於以往。義大利國會由權力相當的眾議院（Chamber of Deputies）及參議院（Senate）兩院組成。基於現行選舉法，義大利民眾可投兩票，一票投眾院，一票投參院。在這次國會大選，眾院總席次將從630減少至400，參院總席次則從315降至200。整體而言，兩院總席次中將有37%由「相對多數當選制」（First Past the Post，又稱單一選區多數決制，或領先者當選制）分配，其餘席次則由「比例代表制」（proportional representation）選出。「相對多數當選制」為選民直接投給屬意候選人，「比例代表制」則是以間接方式投給政黨，基於政黨得票率決定國會席次。█2018年國會選舉後政黨席次分布在上屆2018年國會大選中，反體制五星運動（5-Star Movement）拿下各政黨中最多的227席，極右翼北方聯盟（Northern League）獲得次多的125席，中間偏左民主黨（Democratic Party）囊括第3多的112席，中間偏右義大利前進黨（Forza Italia/Go Italy）取得104席。右翼民粹義大利兄弟黨（Brothers of Italy）則拿下32席，左翼自由及平等聯盟（Free and Equal）贏得14席，其他中左翼政黨共10席，其他中右翼政黨4席，其餘2席。█2022年國會大選概況與預估這次國會大選是因義大利總理德拉吉（Mario Draghi）的聯合內閣內鬥而提前舉行。今年7月，聯合內閣中3個主要政黨杯葛對他的信任投票，導致聯合政府垮台，迫使他宣布提前舉行大選。民調顯示，義大利選民這次可能選出二戰結束以來最右翼的政府，並且首次由女性總理領導政府，此名人選是右翼民粹義大利兄弟黨黨魁梅洛尼（Giorgia Meloni）。梅洛尼的義大利兄弟黨隸屬4黨組成中右翼聯盟，目前民調領先，成員包括薩爾維尼（Matteo Salvini）領導的極右派北方聯盟、前義大利總理貝魯斯柯尼（Silvio Berlusconi）的中間偏右義大利前進黨及中間路線基督教小黨Us Moderates。█梅洛尼有望出任總理由於義大利分裂的政治光譜，沒有單一政黨有十足機會贏得足夠席次單獨執政。右翼及右傾中間政黨已制定選舉協議，可能推舉梅洛尼掌權擔任總理。而中間偏左政黨未同意與左傾民粹或中間政黨合作，這在義大利選舉中非常不利。義大利選制對能夠組成廣泛聯盟的政治團體有利。因為中左翼內部分裂，中間偏左民主黨試圖籌組廣泛競選聯盟失敗，讓中右翼聯盟占了便宜，有望勝出。█梅洛尼反中友台梅洛尼曾在受訪時指出，中國正滲透世界各角落，她若當選，將限制中國在義大利與歐洲的擴張，且無意繼續參與「一帶一路」計畫。她也在受訪時表示，她所領導的政黨與台灣「因誠摯友誼互相連結」，她若能領導新一屆政府，將推動更多義台雙邊合作。（中央社）★快點加入《壹蘋》Line，和我們做好友！★壹蘋娛樂粉專壹蘋新聞網粉專
55黃金新聞頻道將易主？藍營揭政治黑影　NCC晚間回應了,2022-09-24 23:08:00,【記者施智齡／台北報導】TVBS新聞台黃金頻位不保，有線電視系統商日前向國家通訊傳播委員會（NCC）申請將之從55台後移至冷門的158台，並規劃由開播僅4個月的鏡電視新聞台補位；國民黨今天質疑頻道移動有政治力介入，並批評該媒體不斷藉報導服務政府、攻擊抹黑在野黨。,https://tw.nextapple.com/politics/20220924/01836E94FED6226223789B10B82782C2,TVBS新聞台跟系統業者協商公開播送及授權費用未果，遭大豐、TBC等業者提出移頻申請，再由鏡電視入主55台。國民黨立法院黨團今天（24日）開記者會，總召曾銘宗說，看看過去案例，NCC撤銷中天執照後，52台由華視接手，但華視自今年4月起，醜態百出、錯誤連連，跑馬燈刊出「中國導彈攻打台北港」、稱蔡英文總統是「蔡EE」，又把蘇貞昌院長誤稱為總統，已經是罄竹難書的地步。曾銘宗表示，現在某些地方系統業者的52台還空著，就算是給了華視52台也沒人要看，收視戶權益受損，要向誰求償？錯誤的決策，NCC必須負責，陳耀祥主委必須負責。鏡電視新聞台今年1月取得執照，5月甫開播。立委費鴻泰近日接到吹哨者提供的爆料信函，揭露鏡電視經營團隊2021年7月申請執照時，要求府院高層給NCC「壓力」，盡快通過執照；果然，院內高層出手，直接要求NCC盡速發給鏡電視執照。副書記長洪孟楷表示，「鏡電視之亂」到目前為止，NCC還沒有給全民一個交代，上個會期在交通委員會中，民進黨挾著多數暴力，否決在野黨在4月29日提案成立「NCC審查鏡電視調閱小組」，民進黨到底是要蒙蔽、遮掩、護航到什麼程度？國民黨團呼籲NCC重啟調查，也願意提供吹哨者的資料和錄音檔。書記長李德維表示，國人都不希望看到包括平面與電子媒體，成為執政黨「一條龍式」為政治服務的打手，他指出鏡週刊從306期開始，有關民進黨政府的報導，都是好棒棒；反觀提到在野黨，都是烏漆抹黑的爛事。他舉例，306期報導「蔡政府聯手美日協同反制」、307期「反制中國駭客猛攻 府院神秘TRUST資安團隊曝光」，都是在幫民進黨宣傳。到了308期變成「林姿妙30人頭帳戶洗錢逾3億元」、309期「張善政研究計畫淪為抄襲大全」、310期「張善政研究案 爆更大抄襲」。李德維說，311期「台美聯手斬斷國際販毒網」，但到312期主角換成民眾黨高虹安立委「高虹安博士論文涉抄襲」，很明顯地，當週刊報導張善政之後，民進黨就做成抹黑文宣，鋪天蓋地的進行攻擊，挨家挨戶塞信箱。李德維最後表示，國民黨團不希望看到鏡電視、鏡周刊成為民進黨政府「一條龍式」打手，濫用媒體應有的公正、自主；再次呼籲NCC，不能輕易地將TVBS從55台移頻至158台，讓鏡電視入主。費鴻泰也強調，新聞台頻道都是屬於社會公器，請鏡電視回到商業機制和相關法律規範，不要淪為府院高層私人財產。針對鏡電視新聞台及TVBS新聞台移頻案件，NCC晚間澄清，兩案無關聯，皆依程序處理中。NCC表示，該會刻正審理鏡電視新聞台包含該公司負責人變更等案件，及啟動相關檢舉案的行政調查。另外，部分有線電視系統經營者申請移頻TVBS新聞台並上架鏡電視新聞台，NCC說明，頻位的調換為業者間的商業行為，該會尊重市場機制，但仍將依市場競爭、消費者權益、頻道內容多樣性及其他公共利益等面向進行審議。NCC重申，兩者未有外界揣測之特殊關聯，而是依法各自處理中，NCC對個案不會有既定立場，也未有政治力介入操作。NCC強調，該會是合議制獨立機關，嚴守客觀、中立及專業立場，掌理專業監理業務，對個案審理皆須經委員會議全盤考量充分討論後，依法作成最終之決議。NCC感謝各界提出之建議及關心，惟仍希望能尊重該會獨立行使職權之空間，後續若有相關決議會再盡速對外完整說明，盼各界勿再任意扭曲或揣測。★快加入《壹蘋》LINE，和我們做好友★★按讚＋追蹤《壹蘋新聞網》各大臉書粉絲團，即時新聞到你手，重要新聞不漏接★►壹蘋新聞網 粉絲團►壹蘋娛樂 粉絲團►壹蘋時尚 粉絲團
聯大總辯論　聖文森倡接納台灣維護台海和平,2022-09-25 09:28:00,聖文森及格瑞那丁總理龔薩福當地時間周六（9/24）在聯大總辯論倡議聯合國體系接納台灣，以利維護台海和平。教廷循往例未聲援台灣，政局不穩的海地則是4年來首度未替台灣發聲。,https://tw.nextapple.com/international/20220925/0183723AF46B2713B7675D1C836728D6,第77屆聯合國大會總辯論第5天，龔薩福（Ralph Gonsalves）發言論及世界困局並替友好國家抱不平時反問：「我們怎能置之不理、沉默不語、志得意滿地冷眼旁觀，無視台灣依其人民意願和意志存在的合法權利？」時值台海局勢緊繃，龔薩福說：「為何我們不以讓台灣參與世界衛生組織（WHO）、國際民航組織（ICAO）等聯合國體系相關專門機構等方式促進台海和平與安全呢？」教廷由國務院長帕洛林（Pietro Parolin）代表發言，觸及俄烏戰爭、氣候變遷、世界糧食危機等面向，循往年做法通篇未提台灣。海地外交部長吉內瑜（Jean Victor Geneus）發言逾半小時，主要傳達社會動盪、政局充滿變數。海地未藉聯大總辯論替台灣發聲，為2018年以來首見。本屆聯大總辯論，美國總統拜登與歐洲理事會主席米歇爾（Charles Michel）都提及台海穩定，為近年首見。中國國務委員兼外長王毅今天發言大篇幅重申一中原則，並說中國將繼續以最大誠意與努力實現兩岸和平統一，「為達到這一目的，就必須以最堅定決心打擊台獨分裂活動，以最有力舉措排除外部勢力干涉」。王毅說：「只有依法堅決制止分裂，兩岸和平統一才有現實基礎。只有國家實現完全統一，台海才能真正迎來持久和平。」北京當局鮮少在聯大總辯論提及台灣議題。過去兩年，中國國家主席習近平以預錄影片在聯大總辯論發言隻字未提台灣。本屆聯大總辯論20日展開以來，巴拉圭、馬紹爾群島、瓜地馬拉、史瓦帝尼、帛琉、聖露西亞、聖克里斯多福及尼維斯、貝里斯、吐瓦魯、聖文森及格瑞那丁共10個友邦聲援台灣參與聯合國體系，宏都拉斯、教廷、海地未替台灣發聲。聯大總辯論明天休會。根據議程，友邦諾魯預定26日總辯論最後一天發言。（中央社）★快點加入《壹蘋》Line，和我們做好友！★壹蘋娛樂粉專壹蘋新聞網粉專
日本免簽不認高端　蔣萬安：陳時中當然要負責,2022-09-25 10:45:00,【記者潘袁詩羽／台北報導】日本在上週宣布開放免簽入境，但日本尚未承認高端疫苗，因此想要赴日的民眾必須多花3500元自費做PCR。國民黨台北市長參選人蔣萬安表示，會造成這樣的狀況，陳時中當然要負責。,https://tw.nextapple.com/politics/20220925/01837257B9B4F90717DD885FCF583E52,日本上週宣布，研擬於10月11日取消入境人數上限，並開放國外旅客自由行、短期入境免簽證，但若是接種高端的民眾，必須多花3500元，自費取得PCR陰性證明才可以入境。民進黨台北市長參選人陳時中昨天表示，日本也沒有接受中國與俄羅斯的疫苗入境，在擔任指揮官時的政策皆根據學理、法理決定。蔣萬安今天出席活動受訪指出，陳時中這樣的說法違背責任政治，對公共政策，事前要廣泛討論溝通，事後要檢討修正。而打高端疫苗可能無法出國已經討論很久，但當時的疫情中心指揮官陳時中堅持要打高端，也鼓勵全民響應，因此造成現在的後果，「陳時中必須要負很大的責任」。★快加入《壹蘋》LINE，和我們做好友★★按讚＋追蹤《壹蘋新聞網》各大臉書粉絲團，即時新聞到你手，重要新聞不漏接★►壹蘋新聞網 粉絲團►壹蘋娛樂 粉絲團►壹蘋時尚 粉絲團
中國疫情透過火車傳播　近日波及3省10病例,2022-09-25 12:04:00,中國24日新增760例本土COVID-19病例，近期疫情透過火車傳播案例增多，一列自青海西寧至山東青島的列車，至少涉及山東、江蘇、湖北3省，關聯已逾10病例。,https://tw.nextapple.com/international/20220925/018372CB9ABAD2FDA2245AD73D722BCE,中國國家衛生健康委員會官網今天（9/25）上午公布，24日零時至24時，31個省（自治區、直轄市）和新疆生產建設兵團報告新增COVID-19（2019冠狀病毒疾病）共936例（含確診與無症狀感染者），其中本土760例、境外移入176例。其中新增本土確診159例，主要包括貴州86例、四川40例、黑龍江11例、西藏8例、廣東6例等。另本土無症狀感染601例，主要為寧夏171例、黑龍江163例、西藏103例、貴州94例等。黑龍江省近日本土疫情升溫，其中佳木斯市24日無症狀感染計89例，近一週以來累計報告本土感染者逾450例。佳木斯市本輪疫情始於9月18日，病毒為Omicron變異株 BA.5.2，疫情已波及多個小區，防控形勢十分嚴峻。除了個別省市外，中國疫情近期透過火車傳播案例增多，其中從青海西寧始發，終點站為山東青島的Z274次火車，近日乘客關聯病例逾10例，涉及山東、江蘇、湖北等，多地已發布緊急提醒，排查乘坐過相關時段Z274次列車人員，要求立即報備。Z274次列車由西寧站始發，終到青島站，運行時間30小時8分，途經青海、甘肅、陜西、河南、江蘇、山東等多省，共17站。此外，中國官方持續高調公布民間疫情防控違規行為，山東東明縣一位民眾，隱瞞行程舉行婚禮，導致逾170人被隔離，隨後還被公安以涉嫌妨害傳染病防治罪刑事拘留。另據河北省石家莊市公安局通報，一家醫學檢驗實驗室檢出混管陽性未上報，造成9月21日出現社區傳播，警方以涉嫌違法犯罪立案偵查。中國衛健委公布，截至目前全國累計報告確診病例24萬9389例，累計追蹤到密切接觸者高達591萬8762人，尚在醫學觀察的密切接觸者13萬1631人。（中央社）★快點加入《壹蘋》Line，和我們做好友！★壹蘋娛樂粉專壹蘋新聞網粉專
王毅聯合國演說扯台灣主權　外交部強烈譴責,2022-09-25 14:15:00,【記者潘袁詩羽／台北報導】中國外交部長王毅24日於聯合國大會演說，強調「台灣自古以來就是中國的領土」。對此，我外交部今發聲明指出，王毅蓄意錯誤解釋聯大第2758號決議，將其與所謂「一個中國原則」掛勾，刻意在聯合國大會上扭曲歷史事實、刻意混淆真實現況、誤導國際視聽的連篇謊言，外交部予以最嚴厲的譴責。 ,https://tw.nextapple.com/politics/20220925/018373320724DD03D0FC6CC6C3E4F151,"王毅在聯合國大會發表題為《為和平發展盡力　為團結進步擔當》的演講，以聯大第2758號決議，論述台灣自古以來就是中國領土。外交部重申，聯合國大會第2758號決議，只處理了中國在聯合國的代表權，決議全文隻字未提台灣，不但未授權中華人民共和國在聯合國體系代表台灣，更未提及台灣是中華人民共和國的一部分。外交部表示，中國持續刻意對聯大歷史文件作出扭曲錯誤的政治性詮釋，將並未獲得國際共識的「一中原則」作荒謬連結，長期施壓聯合國體系，無所不用其極排除台灣及所有台灣人民的參與，阻撓台灣貢獻國際社會的機會。外交部強調，中華民國台灣是自由民主國家，民主台灣與專制中國互不隸屬是國際公認、長期客觀的事實，中華人民共和國從未統治過台灣，台灣也不是中華人民共和國的一部分，只有台灣的民選政府，才有權在聯合國等國際場域代表台灣2,350萬人民，從未統治台灣的中國共產黨政府無權置喙。外交部說，《聯合國憲章》表明，維持國際和平與穩定是聯合國的宗旨與原則，尤其禁止使用武力解決爭端。中國近期不斷升高對台軍事恫嚇，包括台灣周邊海域軍演，及軍機艦越過海峽中線等行為，破壞台海現狀，危及印太區域安全，明顯違反《聯合國憲章》的精神，卻仍大言不慚在聯合國大會上聲稱愛好和平，再度印證中國「作賊喊抓賊」。外交部指出，中國近期以來在台海周邊進行的挑釁行為，已引起全球嚴正關切，友邦及美國等理念相近國家在聯大期間，紛紛公開表達對台海和平的重視，反對單方面改變台海現狀，並呼籲遵守聯合國憲章的重要性。台灣將繼續與民主社群國家共同遏止威權主義的擴張與侵略，維護以規則為基礎的國際秩序，以及自由開放的印太區域。★快加入《壹蘋》LINE，和我們做好友！★按讚＋追蹤《壹蘋新聞網》各大臉書粉絲團，即時新聞到你手，重要新聞不漏接！►壹蘋新聞網 粉絲團►壹蘋娛樂 粉絲團►壹蘋時尚 粉絲團"
