title,date,summary,link,content
房市回歸冷靜期　科達董座佛系開示：不追價專心看房,2022-09-16 15:14:00,【記者楊明峰／新北報導］新北市「新莊科達花園」今（16日）舉行動土，科達建築董事長賴建程表示，今年7月起，受疫情升溫、台海緊張、升息、預售屋禁轉打炒房等因素，來人量與成交量均受影響，但在造價成本上漲，年底前房市「價穩、量微縮」，房市回歸冷靜，「民眾不用被價格追逐，反而可專心看房。」,https://tw.nextapple.com/finance/20220916/018344F686E308194AF4E089C02EF8D1,該案近千坪基地，位於新莊區中環路二段與坡雅路口，今開工將打造地上9、14層，以及地下4層2棟大樓，規劃2房22～24坪、3房31～36坪，共計163戶，預計2025～2026年完工，開賣5個月已售近7成，單坪成交價52～54萬，採不二價銷售。塭仔圳自辦的港泰重劃區，今年上半年有「新莊科達花園」、「新潤潤見築」、「碧瑤菁品」等進場，開價5字頭；下半年有「閱讀台灣」、「華固一莊」、「宏道豐匯」，開價瞄準6字頭。賴建程指出，｢新莊海悅花園」2年前進場時，單坪成交約39萬上下，如今隨著這波房市「烽火連天」，造價、工資上揚等關係，目前指標案開價到6字頭，港泰重劃區成交均價落在52～63萬。賴建程認為，今年下半年受各種因素影響，成交量、來人量確實有減少一些，但造價成本大漲，房價表現穩健，民眾無太多便宜的房子可選，預計今年底前房市價穩、量微縮，但房市回歸冷靜，消費者不用被價格追逐，反而可冷靜看房，建議可到心儀區域，就門牌、地段、建材口碑等方面，從頭到尾比較一輪，應可找到心目中的理想好房。賴建埕跨入建築業3年，投資興建案量達百億元，手頭握有百億以上合建都更危老案正在醞釀，放眼未來2年，可售建案有望再達百億規模。該案開工，邀請到上市櫃協會理事長暨友嘉集團總裁朱志洋、證券商公會名譽理事長賀鳴珩、工商建研會理事長暨金橋科技董事長林麥升、合作金庫票券董事長郭昭良、新光鋼董事長粟明德、新北市開發商公會榮譽理事長劉炳煌、中國開發暨中國建經董事長鄭重、台中銀副總董益源等工商界大咖出席。鄭重致詞時說：「往來700多家建商、總銷一兆個億，所有建築老闆對地主、個案的用心程度，賴建程絕對是首屈一指，第一流」。素有併購大王的朱志祥則誇讚：「科達建築找到日本營造，安全、品質上勝於不少豪宅，更找到北市十大豪宅建築師規劃，讓年輕人住進北市上億豪宅品質的房子，可住得更安心、更安全。」壹蘋娛樂粉專 壹蘋新聞網粉專壹蘋地產王
別封控我！　上海好市多逃難影片曝　男急吼「完了完了！全部都在往外逃」,2022-09-16 15:35:00,【即時中心／綜合報導】中國上海向來採取強力封控管制疫情，常見民眾在逛街時，突收廣播，要封鎖賣場，也因而造成現在每每一傳出又要封控，只見就有民眾瘋狂逃出賣場的畫面曝光！近來則熱傳一段影片，據傳是上海閔行爆發疫情，民眾擔憂被封在賣場裡，丟下購物車奔逃的影片。,https://tw.nextapple.com/international/20220916/0183451868C65731DDF15CAE86D33CE2,有網友在推特曝光一段影片，表示在上海閔行爆發疫情，原本在賣場逛街的民眾收到賣場即將被關閉封控的消息，紛紛丟下推車，拔腿就往門邊衝。影片中還聽得見拍攝影片男子不停唸著「完了完了，開始大家都在往外跑，全部都在往外逃！說不跑，跑不掉了，真的還假的？我們才剛進來．．．」影片中一團混亂，有如災難片現場。推特網友則紛紛留言「簡直是沒完沒了」、「中國經濟這樣早晚完蛋」、「這種逃亡般的生活讓老百姓絕望」。不過也有網友認為應該往好處想「關在好市多裡至少餓不死。」不過也有人質疑，影片沒有時間，質疑影片真實性。★快點加入《壹蘋》Line，和我們做好友！★
習近平受邀英國女王國葬　料出席可能性不高,2022-09-16 15:42:00,【國際中心】英國19日將為已故女王伊麗莎白二世舉行國葬，不少全球政治領袖將出席。美媒報導，中國國家主席習近平也在受邀之列，但預料他出席的可能性不高，國家副主席王岐山出席的機率較大。,https://tw.nextapple.com/international/20220916/0183453FBA631930800202B973D3BAE6,伊麗莎白二世的國葬儀式將於下周一（9/19）舉行，根據各家外電報導的資訊，目前已知美國總統拜登、日本天皇明仁等多國元首及政治領袖，將出席這場國葬儀式。至於中國方面，自由亞洲電台報導，在英國方面發函邀請的500名外國政要中，習近平名列其中。不過，中國官方並未證實這一消息，中國外交部發言人毛寧14日曾就中方是否派員參加伊麗莎白二世的國葬表示，中方正「積極考慮派高級別代表團」出席這場國葬，並將適時發布有關訊息。對於毛寧這一說法，外界認為，習近平可能不會出席，但會指派其他正國級的領導人出席。而南華早報15日報導，據外交管道透露，中國方面將指派國家副主席王岐山擔任中方代表，出席伊麗莎白二世的國葬。然而，中方到目前為止，仍未公布相關訊息。香港時事評論員劉銳紹表示，習近平正出訪哈薩克和烏玆別克，接下來便要返國準備10月中登場的中共20大，時程緊迫，不出席伊麗莎白二世國葬可以理解；另一個原因則是屆時西方國家元首雲集，在目前中國與西方國家關係敏感的情況下，習近平缺席這場國葬，也有避免尷尬的考量。劉銳紹指出，中方派遣王岐山出席國葬，應是考慮到「眼前很多的政治需要」。而王岐山出席雖不是最高規格，但身為中國國家副主席即負責禮儀外交工作，由他來代表習近平出席是合適人選，同時也符合當前的中英關係情況。屆時還可注意王岐山赴英國期間，除了代表中國吊唁外，是否會代表習近平向英方傳話。對於習近平受邀出席女王國葬，多名曾被中國制裁、立場反中的英國保守黨議員感到不滿。前保守黨黨魁史密斯（Iain Duncan Smith）表示，中國有大量侵犯人權的行徑，包括種族滅絕、破壞教堂和迫害基督徒等，但為何英國可以拒絕俄羅斯、緬甸等國派代表出席女王國葬，對中國卻做不到。另一名保守黨議員勞頓（Tim Loughton）則同時向英國上下議院議長發信，要求拒絕中方官員進入國會參加國葬。他表示，難以想像中國官員在女王國葬期間與其他國家人士平起平坐。（中央社）壹蘋娛樂粉專：https://www.facebook.com/nextapple.entertainment壹蘋新聞網粉專：https://www.facebook.com/nextapplenews.tw
綠營甩換堅陰影！拋「宏碁案」緊咬張善政　學者曝「這原因」害藍營失去領先地位,2022-09-16 15:51:00,【記者黃羿馨／桃園報導】桃園市長「四腳督」選情白熱化，民進黨候選人鄭運鵬因林智堅論文案受到衝擊，但影響隨時間逐漸消退，反倒是國民黨候選人張善政自己也身陷「宏碁案」抄襲風波，加上無黨籍候選人鄭寶清的加入，反倒讓認真提出各種勞工、青年政見、勤跑基層的民眾黨候選人賴香伶無端成「受災戶」，從第三勢力變最後1名。,https://tw.nextapple.com/politics/20220916/0183415939434EC9376E9A5DB2496705,根據《菱傳媒》公布最新網路支持度調查，張善政以40.39%微幅領先鄭運鵬的38.18%，而鄭寶清則是「超車」民眾黨以7.88%奪下第三，賴香伶則獲6.37%支持度居於末位，雖張善政在民調上一路領先，不過他的「佛系打法」也讓自己支持度停滯不前，反倒是受到林智堅論文案衝擊的鄭運鵬緊追在後，並拋出「宏碁案」一步步向張善政逼近中，鄭運鵬受訪時還表示自己有些民調「已經領先」。台灣師範大學政治學研究所博士、銘傳大學廣播電視系主任杜聖聰分析，國民黨透過林智堅論文門一案以「鯨吞」方式取得領先位置，接下來又有《數位中介法》，讓其聲勢不墜；只不過張善政「佛系」的打法，並沒有讓藍營與綠營瞬間拉開差距。談到最新民調顯示「堅下鵬上」導致民進黨選情受傷，杜聖聰認為，林智堅的論文案在攻防上已經失去比例原則，8月間新聞聲量甚至超過中國軍演6倍，該論文案在學術上已被2校判定事實，所謂信者恆信、不信者恆不信，論文門民眾已經彈性疲乏，對民進黨影響也逐漸縮小中，而不可忽視的是，鄭運鵬在桃園市長鄭文燦「大手牽小手」下以「蠶食」方式緩步前進、正拉近與張善政的差距。杜聖聰也說，張善政外在條件都很優秀，但他始終不接地氣，現在都是國民黨桃園市議長邱奕勝，以「議長」之尊動員基層揹著他，他對於桃園的熟悉度、選戰操作還有理想、理念都沒辦法貫徹下達基層，對他來說「最大的敵人是自己」，他要想著如何與在地深度溝通、尊重地方，必須找回自己的節奏；而民進黨在選戰打法上，不會任由國民黨領先，各種蠶食會繼續進行，但國民黨的鯨吞還要等時機、運氣，再等下一個論文門。至於鄭寶清與賴香伶，杜聖聰認為鄭寶清有一定實力，不管桃園在地還是對民主奉獻，深度都比人強，因此這次選舉他不服氣，跟隨他的群眾也多，鄭運鵬要花些力氣清理戰場，雖分出去的票本來就不會投給鄭運鵬，但鄭運鵬在處理上要擺出氣度，不能給人「老同事用過即丟」的感覺，否則會讓很多支持民主前輩為之心寒。談及民進黨的「蠶食」，鄭運鵬近日針對「宏碁案」窮追猛打，雖藍營拿出「保密條款」不隨之起舞，但綠營也搬出合約中的甲方農委會表示「不需要保密」，要求張善政說清楚5736萬元的研究案到底有沒有抄襲；而張善政也罕見憤怒回擊，農委會是1450（網軍）發源地，主委陳吉仲更是「睜眼說瞎話」，為了選舉利益不惜說謊，他也點名行政院長蘇貞昌「要怎麼處理這種沒有誠信、捍衛選舉而欺騙國人的部會首長」？鄭運鵬競選辦公室發言人黃韋鈞認為，人民真正在意的是納稅人5736萬元血汗錢，被張善政以抄襲的手段取巧奪走，張善政卻企圖用所謂的合約保密推託說明的責任，轉與農委會針鋒相對，拙劣手法明顯是在轉移焦點，意欲金蟬脱殼。張善政競選辦公室發言人何元楷也反駁，鄭運鵬這段時間確實辛苦，先是毀譽不計的力挺林智堅抄襲，然後「堅下鵬上」自己被趕鴨子上架，一句「走了抄襲的、來了挺抄襲的」，讓鄭運鵬連自己黨內大老都看不下去。現在把宏碁案當作桃園選情的「興奮劑」，除了鄭運鵬緊抓保密條款不放，就連民進黨立院黨團、農委會也跟著配合歹戲拖棚，不斷在這件事上無限迴旋。壹蘋娛樂粉專壹蘋新聞網粉專
歐洲議會高票通過台海決議　總統府、外交部致謝盼推雙邊協定,2022-09-16 16:00:00,【記者施智齡／台北報導】歐洲議會9月15日以壓倒性多數通過今年第8份友台文件「台灣海峽情勢」決議案，該案譴責中國圍台軍演行動，也反對中國對台灣、區域民主國家及歐盟會員國的經濟脅迫。總統府、外交部今天（16日）對歐洲議會以實際行動再次挺台，皆表達誠摯感謝。,https://tw.nextapple.com/politics/20220916/0183455373E48F1C53305C09BA24E0E2,歐洲議會外交事務委員會9月1日臨時更動議程，挪出時間討論台海情勢，15日歐洲議會全會在法國史特拉斯堡表決「台灣海峽情勢」決議案（Resolution on the situation in the Strait of Taiwan），獲424票贊成、14票反對、46票棄權，壓倒性通過。總統府發言人張惇涵今表示，決議案不僅譴責中國不負責任的軍事挑釁行為，展現歐洲議會對台海和平穩定的高度重視，也再次重申促請歐盟儘速啟動台歐盟雙邊投資協定（BIA）談判準備工作。決議案除建議歐盟展開與台灣互惠的供應鏈韌性合作，強化台灣的「矽盾」，以保障台海安全，更強調民主台灣的生活方式，應由台灣人民決定。張惇涵說，作為理念相近的夥伴，台灣會持續推動「強化歐洲鏈結計畫」，與歐盟一起建立更堅實的夥伴關係；台灣也將持續和歐洲的民主夥伴加強合作，期待台灣與歐盟能加速推動「雙邊投資協定」，攜手維護台海及印太區域的和平穩定，共同打造更具韌性的民主陣線。外交部指出，「台灣海峽情勢」決議案是歐洲議會繼2021年10月高票通過史上第一份「台歐盟政治關係暨合作」報告之後，再次針對中國軍事挑釁及台歐盟關係提出建議，同時也是歐洲議會今年通過的第8份友台案。決議案羅列26點建議，涵蓋台歐持續深化經貿、文化及政治等領域合作，包括洽簽供應鏈韌性協議、制度性合作對抗假訊息、鼓勵尚未在台灣設處的歐盟會員國跟進立陶宛腳步。另，除重申歐洲議會強烈支持台灣有意義參與國際組織，也呼籲歐盟執委會變更歐洲經貿辦事處（EETO）名稱，儘速啟動「台歐盟雙邊投資協定談判」準備工作。外交部說，台灣作為印太地區負責任的成員，將持續積極與歐盟、歐盟會員國及理念相近夥伴緊密合作，維護台海及印太區域的和平與穩定，共同對抗威權體制對國際秩序造成的威脅。外交部最後強調，台灣堅定捍衛民主、自由、法治及人權等普世價值，將與世界各國共同維護以規則為基礎的國際秩序，以及自由、開放、繁榮的印太地區。壹蘋即時報報壹蘋娛樂壹蘋時尚
農委會說張善政報告重複性高　宏碁今回應了,2022-09-16 16:10:00,【記者陳俐妏／台北報導】國民黨桃園市長參選人張善政，日前遭爆料任職宏碁期間擔任農委會計畫的主持人，報告多處抄襲，農委會進行比對後，認定6篇有疑慮，重複性高。已正式行文請宏碁公司及本案計畫主持人張善政於9月30日前提供書面說明。,https://tw.nextapple.com/finance/20220916/01834555CD323D365F7916B25F160266,國民黨桃園市長參選人張善政，任職宏碁時主持的「農業電子化發展策略分析與規劃」三年計畫契約涉及侵權或抄襲一事。今天農委會說，其中6篇研究報告重複性高。宏碁發言體系對此表示，待收到公文後，將進行內部研議並回覆農委會。中國國民黨桃園市長參選人張善政的行政院農業委員會研究案爭議，農委會今天說，比對21篇報告有程度不同重複情形，其中6篇重複度高。對此，張善政競辦表示，態度坦然，針對農委會主張，會配合必要的釐清與說明。
上合峰會晚宴獨缺習近平　烏茲別克：中方稱防疫政策,2022-09-16 21:00:00,路透社報導，烏茲別克政府消息人士表示，中國國家主席習近平基於中國防疫政策考量，因此缺席15日晚間舉行的上海合作組織撒馬罕峰會11國領導人晚宴。,https://tw.nextapple.com/international/20220916/01834644F00BDE0EA99896BBFA096DB2,根據報導，在15日晚間公布的峰會晚宴合影中，可見到俄羅斯總統普丁（Vladimir Putin）和土耳其總統艾爾段（Recep Tayyip Erdogan）等多國領導人出席，但習近平並未出席晚宴。烏茲別克政府一名消息人士證實習近平缺席晚宴。他並表示，中國代表團解釋這是因為中國的COVID-19防疫政策所致。針對習近平因防疫缺席這場峰會晚宴，中國外交部面對媒體詢問，並未立即回應。2019冠狀病毒疾病（COVID-19）疫情爆發近3年來，習近平在9月14至16日首度出國，對哈薩克、烏茲別克進行國事訪問，並出席在烏茲別克撒馬罕（Samarkand）舉行的上海合作組織峰會。（中央社）★快點加入《壹蘋》Line，和我們做好友！★█壹蘋娛樂粉專：https://www.facebook.com/nextapple.entertainment█壹蘋新聞網粉專：https://www.facebook.com/nextapplenews.tw
劃時代的女王　她見證過這些歷史大事,2022-09-17 07:00:00,【蔡曉卉／綜合外電】以96歲高齡辭世的英國女王伊麗莎白二世，不只是史上英國最長壽的君王，也是史上在位時間最長的英國君王，總計統治英國70年，期間見證無數塑造人類歷史的重要時刻，從科學突破到戰爭，再到金融危機等。美國廣播公司整理如下：,https://tw.nextapple.com/international/20220917/018345830D509B9466FD2DFF253B3871,"1952年5月2日█世界首發商業航班世界上第一個商業航空班機，由英國國營的英國海外飛機公司 (British Overseas Aircraft Corporation) 將乘客從倫敦送至約翰尼斯堡，開啟新的旅行時代。1955年4月12日█小兒麻痺疫苗被宣布安全有效沙克 (Jonas Salk) 發明的小兒麻痺疫苗被宣佈為安全、有效，是上世紀最重大的生醫發展之一。1957年10月4日█第一顆人造衛星發射蘇聯發射第一顆人造衛星，標誌著太空時代的開始。1960年5月9日█美國批准避孕藥美國食品藥物管理局批准全球第一個商業生產的口服避孕藥Enovid-10，提供生育方面的更大自由。1966年5月16日█中國文化大革命開始中共領導人毛澤東發動文化大革命，持續至他1976年去世，並影響國家數十年。1968年4月4日█美國民權領袖金恩博士遇刺金恩在田納西州孟菲斯的汽車旅館中遭到槍殺，成為美國民權運動中令人震驚和關鍵的時刻。1969年7月20日█人類首度登陸月球美國阿波羅11號太空人阿姆斯特朗和艾德林成為首批登月的人類。1975 年 1 月█微型電腦Altair 8800發行Altair 8800是全球第一台商業成功的個人電腦，當時還未輟學的比爾蓋茲和伙伴保羅艾倫一起設計Altair BASIC編輯器，成為MS-DOS作業系統的基礎。1975年4月30日█越戰結束西貢淪陷標誌近20年衝突的越戰告終。1979年5月4日█柴契爾夫人出任英國首相柴契爾夫人是英國第一個女首相，也是20世紀在位時間最長的英國首相。1980年5月8日█根除天花世界衛生大會宣布全球已根除天花，這是國際公共衛生領域的最大成就之一。1981年6月5日█首度報告愛滋病案例美國疾病防治中心《發病率和死亡率周報》首度報告5起特殊病例情況，後來該疾病被命名為愛滋病。1986年4月26日█車諾比核災烏克蘭的車諾比核電廠發生全球最嚴重的核災。1989年11月9日█柏林圍牆倒塌蘇聯集團開始瓦解，隨後1991年冷戰結束。1994年4月27日█種族隔離被廢除南非種族隔離制度在40多年後結束，曼德拉在南非首次允許所有種族公民參加的選舉中當選總統。1998年4月10日█北愛爾蘭「問題」結束在簽署和平協議後，結束長達30年的北愛致命衝突。2001年9月11日█911恐怖攻擊基地組織對美國發動人類史上最致命的恐怖攻擊，造成2,977人死亡，並導致美國的反恐戰爭。2007-2009年█全球金融危機美國房地產泡沫的破滅，導致自大蕭條以來最嚴重的經濟衰退，以及隨之而來的全球金融危機。2009年1月3日█比特幣發行比特幣是史上第一個加密貨幣，也是最受歡迎的數位貨幣之一。2010年12月17日█阿拉伯之春開始阿拉伯之春是整個中東地區的一系列反政府示威活動，始於突尼西亞的抗議活動，而後往周邊擴散，持續10多年。2016年6月23日█英國脫歐公投英國民眾投票決定在2020年正式退出歐盟。2020年3月11日█COVID-19疫情被宣告為「全球大流行」世界衛生組織宣布COVID-19疫情進入「全球大流行」，世衛已接獲全球640萬人死亡病例。★快點加入《壹蘋》Line，和我們做好友！★"
美國10月擴大晶片輸中國禁令　專家：打擊中國從「點」擴大到「面」,2022-09-17 08:00:00,【記者蕭文康／台北報導】由於美國考慮10月將進一步針對AI等高階晶片禁止輸往中國，對此，微驅科技總經理吳金榮分析，美中關係不好之後，美國就開始一些高科技技術輸往中國，美國原先考慮到美商的利益，打擊的對象是「點」，例如把華為例為實體清單，禁止各種產品輸送給華為，「點」的部份持續許多年，但美國發現這樣還不夠，已擴成「面」。,https://tw.nextapple.com/finance/20220917/01834699796510D8CE61965DE80A80D2,就像中芯國際列為實體清單，也就是禁止14奈米的設備輸往中芯，但中國還有長江存儲、華力微等許多半導體公司，因此美國商務部8月就發函給應材、科林、科磊等半導體設備商，如果要出售14奈米及以下設備給中國公司，必須獲得商務部許可。吳金榮在「年代向錢看」節目中指出，美國對中國先前防堵主要防止用於軍事國防，列很多實體清單都是跟國防相關的，但現在美國有議員很生氣，因為蘋東把長江存儲列為NAND供應商，長江存儲已被美國盯很久，認為跟軍方有關係，美國現在連IC，例如輝達和AMD有關AI晶片等資料中心晶片也被禁止輸往中國。除了輝達、AMD外，英特爾及一些新創公司的部分產品也被禁止，對美商公司很受傷，其中對輝達衝擊不少，約影響7%的營收，所以股價大跌。中國有自己的IC設計公司，例如沅任科技，延攬輝達上海總經理及AMD全球高級副總，這家躅司也仿輝達的A100、以台積電7奈製造，所以也算厲害。但美國對於中國高科技掌控力道會愈來愈重，就是擔心中國用於軍事用途。台積電8月營收再創新高達2181.32億元，年增58.7%，累計前8月是1.43兆元，年增43.5%。另據IC Insight統計，今年第3季因為記憶體跌價很兇，三星營收下跌很大，推估台積電第3季營收約204億美元，三星約183億美元，英特爾只有155億美元，台積電居全球最大半導體企業。以全年來看，吳金榮推算台積電也是有機會超過三星，因為第三到第四季記憶體市況持續不佳，推算三星全年只有755億美元，台積電則約767億美元，台積電可說發展35年以來，首次登頂成為全球最大半導體企業，真的是台灣之光。壹蘋娛樂粉專：https://www.facebook.com/nextapple.entertainment壹蘋新聞網粉專：https://www.facebook.com/nextapplenews.tw★快點加入《壹蘋》Line，和我們做好友！★
