relsub,relsum,rel,index,title,date,summary,link
1,1,1,490,北京疫情加劇　外地進京者7天內禁聚餐聚會,2022-09-12 12:12:00,中國官方今天（9/12）公布新增COVID-19病例（含確診與無症狀感染者）1094例，其中本土病例949例。北京疫情仍未趨緩，當局下令外地進京者7天內嚴禁聚餐聚會，同時需3日2檢。,https://tw.nextapple.com/international/20220912/01832FE1B3D4F2E0B5090635CEADD32F
0,0,0,491,學校餐廳「番茄炒月餅」變一道菜　女學生：我和同學都驚呆了,2022-09-13 19:58:00,【劉育良／綜合報導】中秋節過完了，月餅沒吃完怎麼辦？中國安徽省蕪湖市一所學校想出了妙招，將過量的月餅和番茄一起炒，然後當成一道菜在學校自助餐廳出售。,https://tw.nextapple.com/international/20220913/018336B734290EE95B918737339BF20D
0,0,0,492,Fed升息3碼倒計時！道瓊漲近200點　晶圓雙雄ADR續跌,2022-09-21 21:32:00,【財經中心／綜合外電】投資人相信聯準會稍晚會如預期升息3碼，美股4大指數周三早盤反彈，其中道瓊漲近200點，晶圓雙雄ADR則是繼續走弱。,https://tw.nextapple.com/finance/20220921/018360332417B3A97C180511FB992C9F
0,0,0,493,小馬可仕首次聯大發言提海洋法公約　未談南海裁決,2022-09-21 06:45:00,菲律賓總統小馬可仕當地時間周二（9/20）首度在聯合國大會總辯論發言，談到「聯合國海洋法公約」、氣候變遷、地緣政治對立及貧富國家鴻溝，但未提具體的區域緊張情勢及2016年南海仲裁。,https://tw.nextapple.com/international/20220921/01835D0E6F5B6BFADE29E8A43A93EA96
0,0,0,494,高以翔銅像揭幕狗兒子懵懂看爸爸　黑人分享催淚影片「每一天都在想念你」,2022-09-22 16:58:00,【娛樂中心／綜合報導】高以翔3年前在中國錄製節目時心臟病發猝逝，今（22日）是他38歲冥誕，黑人（陳建州）PO出昨天高以翔紀念銅像的揭幕影片，高的父母、哥哥和好友們齊聚一堂獻上白玫瑰，他心愛的狗兒子帝歐在二哥高宇橋懷中參與儀式，場面溫馨又引人鼻酸。,https://tw.nextapple.com/entertainment/20220922/0183640512BA7B3ACED4321503C39273
1,1,1,495,民進黨本週六黨慶台中登場　蔡賴蘇合挺蔡其昌,2022-09-22 22:39:00,【記者謝仁禮／台北報導】9月28日是民進黨黨慶，民進黨本週六（24日）將在台中提早舉辦36年黨慶音樂會，配合九合一大選，當天將發表競選主題曲，而總統蔡英文、副總統賴清德、行政院長蘇貞昌都會出席力挺蔡其昌，中部地區的中彰苗投雲5位縣市長參選人都會進行短講。,https://tw.nextapple.com/politics/20220922/018363105C120A9D48123A7E501FAFC9
0,0,0,496,申敏兒甜勾金宇彬手臂曬幸福　巴黎約會影片曝光閃爆,2022-09-22 15:40:00,【記者陳薇安／綜合報導】韓國銀色情侶檔金宇彬、申敏兒愛情長跑7年，今年大方合作療癒劇《我們的藍調時光》，戲裡各自有另一半，展現演員的專業。他們最近飛到法國度假，繼巴黎咖啡廳約會後，前幾天又被拍到走在巴黎街頭，小倆口穿著白色系情侶裝，申敏兒自然挽著金宇彬的手臂交談，互動自然甜蜜，短短3秒影片在網路傳開，讓網友看到閃瞎，敲碗2人快結婚。,https://tw.nextapple.com/entertainment/20220922/018363DF0A4E330052F5CF03C5F82A6F
0,1,1,497,合體造勢！劉建國批雲林張家「近親繁殖」　蔡其昌要找回台中光榮,2022-09-24 21:47:00,【記者鮮明／台中報導】民進黨今天（9/24）在台中舉辦「民主36挺18」黨慶音樂會，邀請新北市及中部5縣市的縣市長參選人致詞。雲林縣長參選人劉建國火力全開，痛批對手、現任市長張麗善家族「近親繁殖」，阻擋農會改革、濫墾濫伐；台中市長參選人蔡其昌則痛批盧秀燕滿意度排名落後，他有信心贏回台中，找回台中的光榮與驕傲。,https://tw.nextapple.com/politics/20220924/01836F265EFBB53B198E72F078191613
0,0,0,498,普丁徵召30萬人戰烏克蘭　馬克宏籲全球加強施壓,2022-09-22 12:14:00,俄羅斯總統普丁（Vladimir Putin）徵召30萬名後備役人員投入烏克蘭戰事後，法國總統馬克宏（Emmanuel Macron）當地時間周三（9/21）呼籲全世界對普丁進一步施壓。,https://tw.nextapple.com/international/20220922/01836362FF55775EDBF41154DA8291F9
0,0,0,499,禾馨疑涉詐保　金管會要求17家保險公司2周內交檢討報告,2022-09-22 15:50:00,【財經中心／台北報導】針對之前禾馨集團5家診所遭北檢查出，涉嫌出具不實醫療診斷證明，聯手孕婦和保險業務詐領醫療保險金6738多萬元，金管會已要求17家保險公司2周內交出檢討報告。,https://tw.nextapple.com/finance/20220922/01836429C232865CAAEC38E50EFB67A5
0,1,1,500,長江存儲恐遭列入實體清單衝擊台廠　威剛：只是供應商之一供貨佔比有限,2022-09-22 11:00:00,【記者黃意淳／台北報導】外媒報導美國兩黨參議員21日要求情報部門，評估Apple iPhone 14採用長江存儲記憶體晶片國安威脅，市場擔憂NAND Flash後市對台廠恐有影響。,https://tw.nextapple.com/finance/20220922/0183631B64E5BD2BD33C91A47E144C14
0,0,0,501,和鄭爽同命！李易峰買春一夜掉粉30萬　遭華鼎獎拔除視帝,2022-09-12 15:39:00,【娛樂中心／綜合報導】35歲陸劇男神李易峰因多次買春遭行政拘留，不只13家代言全滅，微博粉絲一夜少了30萬，連獲頒的獎項都被收回！華鼎獎昨晚宣布取消李易峰第22屆華鼎獎「中國百強電視劇最佳男主角」和「全國觀眾最喜愛的影視明星」稱號。,https://tw.nextapple.com/entertainment/20220912/01832F1CFF78C362BA2526ACDDFEBA49
1,1,1,502,北京3校疫情近百例　需持48小時核酸報告返校,2022-09-13 01:02:00,中國北京COVID-19疫情升溫，官方表示，發生在3所學校的感染合計已經96例，但「社會面外溢風險總體可控」。當局要求，13日起需持48小時核酸檢測陰性證明返回工作崗位及返校。,https://tw.nextapple.com/international/20220913/0183329A4288277E1783D862785D4375
0,0,0,503,國外研究：2060年全球3/4成人超重或肥胖　阻礙經濟發展,2022-09-21 18:37:00,一項今天（9/21）發表的研究指出，2060年以前，不斷攀升的肥胖率將對世界經濟造成3.3%的國內生產毛額（GDP）損失，不僅會減緩低收入國家發展，更讓人們難以過上健康生活。,https://tw.nextapple.com/international/20220921/01835F9F937C0674A28EB3409D6C23DC
0,0,0,504,北韓不戴口罩　金正恩「無罩」被萬民簇擁,2022-09-22 13:06:00,【國際中心／綜合外電】當北韓最高領導人金正恩出現時，北韓民眾紛紛興奮的靠向金正恩，將現場擠得水洩不通，更有不少民眾眼中帶著淚水。等等，這是室內的萬人集會，而且他們跟金正恩靠得這麼近，全都沒戴口罩！金正恩本人更不讓口罩遮住他那肥滿的笑容，原來，北韓已經解除口罩強制令了。,https://tw.nextapple.com/international/20220922/018363906ABB2223224D7798A58BA597
0,0,0,505,張穎穎間接認愛汪小菲　開箱iPhone 14曖昧回應手機主人,2022-09-22 13:37:00,【娛樂中心／綜合報導】汪小菲去年和大S離婚後，火速與小他15歲的中國女星張穎穎傳出緋聞，多次被狗仔拍到出雙入對，宛如同居中的戀人，不過雙方始終沒有認愛。20日張穎穎在抖音分享開箱iPhone 14 Pro手機，還一次買2支，網友就好奇問是不是給汪小菲？她罕見承認，被外界解讀是間接認愛。,https://tw.nextapple.com/entertainment/20220922/0183639657F534EF27A917410731DC15
0,0,0,506,台捷簽署六項合作備忘錄　奠定雙邊關係新里程碑,2022-09-23 19:57:00,【記者施智齡／台北報導】台灣、捷克合作邁入新篇章，捷克參議院「教育、科學、文化暨請願委員會」主席德拉霍斯訪團一行，今天（23日）在外交部和我相關單位簽署6項合作備忘錄及協議；外交部常務次長俞大㵢表示，此象徵雙方加強緊密友好關係的決心，盼為台捷關係再創新猷。,https://tw.nextapple.com/politics/20220923/01836A329943018073A609CC62D15118
0,0,0,507,不忍了！新北國王發聲明　嚴正警告：不得危害戴維斯本土球員權益,2022-09-25 18:22:00,【記者黎建忠／綜合報導】PLG傳出有球團以多數決，在賽務決策委員會時打算讓Q戴維斯「轉回」洋將身份，儘管PLG已經發聲明表示此事還未成決議，但新北國王今天決定不忍了，同樣發出措辭強硬的聲明，提到「未來任何危害到戴維斯本土球員身份的決議，球團都將捍衛到底。」,https://tw.nextapple.com/sports/20220925/0183741C2BB6DA89E7E6501CEF2ECDF6
0,0,0,508,美好證券董座黃谷涵涉炒股削數千萬！　手插口袋移送北檢50萬交保,2022-09-23 09:18:00,【記者呂志明／台北報導】大慶證券(已更名美好證券)董事長黃谷涵，涉嫌於2020年上半年間，疑利用人頭與凌網公司大股東合謀，炒作凌網股票，擬制性獲利達數千萬元，台北地檢署昨（22日）指揮台北市調查處兵分9路搜索，並約談黃谷涵等7名被告釐清案情，漏夜複訊，凌晨依違反《證交法》操縱股價罪諭令黃谷涵50萬交保。,https://tw.nextapple.com/local/20220923/018365D136AD3C13F422EC1A9A6E4AAC
0,1,1,509,咬張淑娟是「和蔣孝嚴滾床單女主」！周玉蔻稱3道查證再爆：監視器有拍到,2022-09-23 15:22:00,【即時中心/綜合報導】資深媒體人周玉蔻，近日將砲火對準國民黨台北市長參選人蔣萬安，更扯出蔣萬安父親蔣孝嚴「晶華緋聞案」。她昨在民視《辣新聞152》揭露緋聞案女主角，是華航前空服員張淑娟，而不是王筱嬋。她更透露當初就連飯店監視器，都有拍到這位「女主角」的身影。她強調她經過層層查證，確認就是張淑娟沒錯！不過張淑娟下午也發出聲明，表示將提告！,https://tw.nextapple.com/politics/20220923/018367E863BC8E130C6DCD0F8A8980BD
0,1,1,510,限電完又封控！四川停工沒完沒了　專家：當地已漸漸習慣,2022-09-02 13:56:00,【記者黃意淳／台北報導】中國疫情未見趨緩，剛實施限電令的四川再遭控管。當地政府宣布，自9月1日18時起，全市民眾原則居家、非必要不離城，等同實施「封城」，再度影響產業鏈，且政府未宣布解禁時間。,https://tw.nextapple.com/finance/20220902/0182FCBA565F74A70E66BAFBD36808AB
0,0,0,511,加密資產平台幣安設立全球顧問團隊　推動Web3向前一步,2022-09-23 10:16:00,【記者黃意淳／台北報導】加密資產交易平台幣安宣佈設立全新全球顧問委員會（GAB），該委員會由公共政策、政府、金融、經濟、公司治理等領域的專家組成。幣安全球顧問委員會成員名單包括美國、韓國、法國、歐洲等專家。,https://tw.nextapple.com/finance/20220923/0183681EE6F7AD3C1397A39898AB66A6
0,0,0,512,單親貧媽逼17歲女兒「陪睡6旬乾爹還債」　1砲690元做了「不計其數」,2022-09-21 21:26:00,馬來西亞新山市一名17歲詹姓少女，控訴成為單親母親的還債工具，以每次100令吉（約690元台幣）的代價，與「乾爹」發生性關係，從今年初開始做愛次數已經「不計其數」。,https://tw.nextapple.com/international/20220921/01835F6AEB0A8FCAE6A27B948041E4C7
0,0,0,513,張藝興身邊出現神秘女子　MV耗時3天瘋狂換6場景,2022-10-05 18:55:00,【記者李志展/綜合報導】中國歌手張藝興新歌《Veil》MV講述「夢中夢」故事，張藝興從現代熱鬧的街景倏忽轉換到超現實場景，出現1個神秘女子，將張藝興帶往超現實之處。為拍攝，團隊至廣東佛山取景，MV結合當地街邊舞獅表演。,https://tw.nextapple.com/entertainment/20220921/01835FAA579F0235E219083ECEB2A51D
0,0,0,514,分析：酷熱恐在2045年之前威脅全球7成糧食生產,2022-09-08 13:11:00,一項分析示警，隨著全球暖化，在2045年之前，讓作物枯萎的高溫不僅會危及農業工作者的健康，也可能威脅到64個主要經濟體的農業，相當於目前全球糧食生產的71%。,https://tw.nextapple.com/international/20220908/01831B827CC6F47AF57FC2376939039C
0,0,0,515,央行估台灣今年GDP為3.51%　通膨率2.95%,2022-09-22 17:33:00,【財經中心／台北報導】央行今天舉行理監事會議，宣布升息半碼，會後記者會也針對今年經濟成長及通膨變化提出說明，央行預估今年台灣經濟成長率為3.51%，通膨率為2.95%，低於3%水準。,https://tw.nextapple.com/finance/20220922/018364890F6A7B3F737A8674894FD758
1,1,1,516,美中科技戰升級　晶片大廠挫、自駕車晶片恐下一波,2022-09-02 07:55:00,【記者陳俐妏／台北報導】美國祭出禁止輝達（NVDA）及超微（AMD）向中國出售高端繪圖處理器（GPU），因高階GPU為高速運算（HPC）及人工智慧（AI）應用的關鍵，將延緩中國AI產品開發。但法人示警，未來美國禁令可能還會升級，包括：輝達、英特爾、高通等自駕車晶片，或台積電、三星等晶片製造都是潛在高風險領域。,https://tw.nextapple.com/finance/20220902/0182FB79BAFB494CDAD06F217D1B3CB5
0,0,0,517,Fed今開升息會議！美股又回落　道瓊跌逾350點,2022-09-20 21:34:00,【財經中心／綜合外電】Fed周二展開2天的議息會議，美股周二早盤又回落，道瓊盤初跌逾350點。,https://tw.nextapple.com/finance/20220920/01835B0F0FB028501813DE954B0147BC
0,0,0,518,美好證券董座黃谷涵涉炒股削千萬　手插口袋移送北檢複訊,2022-09-22 23:19:00,【記者呂志明、黃意淳/台北報導】大慶證券(已更名美好證券)董事長黃谷涵，涉嫌於2020年上半年間，疑利用人頭與凌網公司大股東合謀，炒作凌網股票，擬制性獲利達數千萬元，涉嫌違反《證券交易法第》操縱有價證券罪，台北地檢署今指揮台北市調查處兵分9路搜索，並約談黃谷涵等7名被告釐清案情，晚間陸續移送北檢複訊。,https://tw.nextapple.com/local/20220922/01836429CC411B5F7E7230F6731A18D2
0,0,0,519,國一新生入學就被學長盯上　家長「用這招求情」大快人心！校方臉卻綠了,2022-09-16 23:15:00,【即時中心／綜合報導】孩子在學校遇到霸凌事件，家長該怎麼辦呢？近日中國流傳一段學生家長送五條香菸在校外要面交的影片，引起網友熱議。原來是他的孩子國一剛入學，就被國三學長堵在廁所勒索要香菸，表面上是向霸凌的學生示弱，實際上是向學校施壓，要求調查處理，而且無法私了，也被網友讚許秒招。,https://tw.nextapple.com/international/20220916/018345910F2C29938565B7DA0B1D1B9E
0,0,0,520,12歲女中秋返家「一身血」　竟是被基層官員性侵犯,2022-09-13 21:58:00,【劉育良／綜合報導】中國江西省貴溪市出現一名禽獸不如的基層官員，天祿鎮流橋村52歲的村支書劉亮宗，竟然在中秋節當天性侵村內一名12歲女童，鎮政府表示目前此案已經交由司法處理，目前不便回應。,https://tw.nextapple.com/international/20220913/01833652A05ADFE9DAC9CBEB8CF7FEF2
0,0,0,521,出席安倍國葬　日政府：請戴口罩,2022-09-22 15:25:00,【賴宇萍／綜合外電】日本前首相安倍晉三的國葬儀式27日將於東京日本武道館舉行。日本政府今天（9/22）宣布，將有217個國家、地區與國際機關人士出席，而參加國葬的人將被要求戴口罩。,https://tw.nextapple.com/international/20220922/018363D226C9ABBC3B5F87AAB6C4288F
0,0,0,522,楊丞琳「在台灣吃海鮮是奢侈」讓她翻車！ 熱血球評酸：患上台灣過敏症,2022-09-06 10:54:00,"【即時中心/綜合報導】女星楊丞琳在中國節目上說「自己在台北長大，但我是廣東人」，還稱「其實我在台灣沒吃過什麼海鮮，其實吃海鮮是奢侈的在那」，引起台灣網友們兩極討論，有人認為她其實只是在描述童年家境不好，但也有人認為她意有所指，不滿。而熱血球評石明瑾，則看狠狠再酸，「要嘛是她患上了海鮮過敏症，要嘛是她患上了台灣過敏症。」
",https://tw.nextapple.com/entertainment/20220906/018310B4CA4AE0E06AAA0C4FF966D3F3
0,0,0,523,隆鼻、豐唇樣樣來　恐怖！高雄雙姝學一天就持刀幫整形,2022-09-22 13:24:00,【記者林錫淵／高雄報導】潘姓越南籍配偶經營美甲美睫店，涉嫌與只學1天就上工的姪女阮姓女子，從事非法整形，利用臉書直播醫美手術過程，吸引同鄉及移工慕名整形。兩人否認從事密醫，全案仍依違反《醫師法》法辦。,https://tw.nextapple.com/local/20220922/0183638E3AA35C39B024590E85694D2E
1,0,1,524,美第七艦隊：美軍驅逐艦和加拿大護衛艦昨通過台海,2022-09-21 07:47:00,【盧宥竹／綜合外電】美國海軍第七艦隊表示，一艘美國海軍軍艦和一艘加拿大護衛艦周二（9/20）在符合國際法的情況下，例行性通過台灣海峽。,https://tw.nextapple.com/international/20220921/01835C2E97A68B4240C8374E79E87CA2
0,0,0,525,李易峰被爆召妓戴墨鏡嘿咻　蘇美島約砲網美黑歷史全被扒,2022-09-11 18:22:00,【娛樂中心／綜合報導】中國男星李易峰憑藉著電視劇《古劍奇譚》及《盜墓筆記》，當年號稱四大流量之一紅極一時，豈料今被北京公安通報多次嫖妓被逮，演藝事業恐全面斷送。他染黃事件爆發後，過往黑歷史也被扒出，微博流傳他在嫖妓時為免被認出，全程都戴墨鏡，另他過往曾開車肇事逃逸、約砲小網紅到泰國蘇美島狂歡，加上他曾和韓團「BIGBANG」前成員勝利互關，種種負面作為都與陽光形象大相逕庭。,https://tw.nextapple.com/entertainment/20220911/01832C081415038C5A981E1981BCC77E
0,0,0,526,高通膨下金價卻黯然失色　「沉默的黃金」何時可綻放光芒？,2022-09-20 12:28:00,【財經中心／台北報導】今年全球面臨高通膨環境，投資人原本預期，高通膨將推高金價，然而，目前的情況卻正朝著另一個相反的方向發展。,https://tw.nextapple.com/finance/20220920/018359254B0AAA41796112F5DFFE290D
1,1,1,527,習近平若出席印尼G20峰會　拜登：確定兩人將會面,2022-09-07 11:17:00,美國總統拜登當地時間周二（9/6）表示，若中國國家主席習近平決定出席11月在印尼峇里島舉行的20國集團（G20）峰會，他「確定」將與習近平會面。,https://tw.nextapple.com/international/20220907/018315EC1C9C9A45F6FFC093928A13DB
0,0,0,528,南瑪都颱風戲劇性變化　「南墜台灣」機率上升！2度和台超有緣,2022-09-14 13:30:00,【即時中心／綜合報導】第14號颱風「南瑪都」今晨2時生成，若北轉的位置更偏西，可能離台灣更近；民間氣象粉專「台灣颱風論壇」分析，最新一報的歐洲數值模式中，南瑪都出現戲劇性變化，南墜台灣、西進中國、北轉日韓都有機會，但靠近台灣機率上升中。,https://tw.nextapple.com/life/20220914/018339F5DFD5CDC3D2BA1A61F05B10A4
1,1,1,529,高虹安「戰學歷」風波！　矢板明夫：台積電需要學霸但政治人物未必,2022-09-21 19:53:00,【劉育良／綜合報導】民眾黨立委、新竹市長參選人高虹安，在回擊博士論文抄襲風波時，意外引發「戰學歷」的爭議，日本《產經新聞》台北支局長矢板明夫認為，像台積電研發團隊這樣的地方，當然需要學霸，「但是從政也需要學霸嗎？我並不這樣認為。」,https://tw.nextapple.com/politics/20220921/01835FE4FEA2FC789AEA3AA97CA8ABF2
0,0,0,530,男星瞞婚1年報喜！祕娶圈外女友生子,2022-09-19 17:55:00,【記者蔡依庭／台北報導】王小棣老師監製、導演「茁劇場」第3部影集《誰說媽媽像月亮》今天舉辦首映會，男主角張耀仁驚喜透露，去年2月和交往11年圈外女友登記結婚，並育有近1歲兒子，就連王小棣都不知情，今誇他：「難怪（演戲）進步了！」,https://tw.nextapple.com/entertainment/20220919/018354DB7E81437264022EA3F58D70C7
1,0,1,531,范疇專欄：「台灣生存時刻」十問　「反佔領」就是保台,2022-09-19 07:30:00,【作者：范疇／戰略作家】台灣遇上了「生存時刻」（existential moment），每個人不管願意不願意都得做出艱難的選擇，兩全其美的日子已經過去了。,https://tw.nextapple.com/latest/20220919/018353089DDA1B1724DAFE39990F1649
1,1,1,532,日本帛琉東京高峰會　強調台海和平穩定重要性,2022-09-10 09:32:00,【國際中心】日本首相岸田文雄9日在首相公邸（寓所）與來訪的帛琉總統惠恕仁舉行會談，鑑於中國逐漸擴大霸權，兩人都反對試圖以武力片面改變現狀，且強調台灣海峽和平穩定的重要性。,https://tw.nextapple.com/international/20220910/01832506EB5A2C49C6CAC8F6672436A9
0,0,0,533,iPhone 14傳採用制裁的陸廠晶片　Apple這樣說,2022-09-10 16:45:00,【財經中心／綜合報導】Apple iPhone 14下周就要開賣！但外電消息指出，iPhone 14或採用中國長江存儲NAND Flash晶片，由於長江存儲為美國拜登政府制裁名單，美國共和黨議員砲轟「蘋果正在玩火」。,https://tw.nextapple.com/finance/20220910/0183268DE6FA0FC1C9BC9ED933838F9D
1,1,1,534,美參院外委會通過《台灣政策法案》　總統府：不冒進持續關注進展,2022-09-15 16:22:00,【記者施智齡／台北報導】美國聯邦參議院外交委員會於美東時間14日通過《2022年台灣政策法案》（Taiwan Policy Act of 2022），該法案囊括美國在外交、軍事等多領域上的對台政策，旨在阻止中國進一步侵略台灣，總統府及外交部今天皆對此表達誠摯感謝，並將持續關注法案進展。,https://tw.nextapple.com/politics/20220915/0183403E2A64D7BF11ED297BDCA59CC0
1,0,1,535,英國金融時報：曹興誠擬捐「百萬架攻擊無人機」　中共犯台時可反擊,2022-09-21 12:05:00,【財經中心／台北報導】聯電前董事長曹興誠日前宣布豪捐30億元幫助台灣國防，他接受外媒金融時報訪問時表示，正與台灣無人機廠商洽組產業聯盟，擬生產百萬架無人機，一旦中共來犯時可予以殲滅。,https://tw.nextapple.com/finance/20220921/01835E38EA4CAC5F250E9D2E5B6A7CD1
0,0,0,536,港星李燦森中秋團圓片開酸台灣　「小孩懂事就回來了」,2022-09-11 16:17:00,【記者臺孝婷／綜合報導】46歲的港星李燦森演過《新古惑仔之少年激鬥篇》、《特警新人類》、《中華英雄》、《掃毒2：天地對決》等港片，曾2度入圍金馬獎最佳男主角，並以《香港製造》奪下2006年的香港電影金像獎最佳新演員。除了演藝事業外尚且可圈可點外，李燦森最讓人有印象的就是政治立場鮮明，多次強調「中國只有1個」，還拍影片暗喻台灣是年幼小孩子，等過陣子懂事後，就會重回「中國爸爸」的懷抱。,https://tw.nextapple.com/entertainment/20220911/01832B8FA762C885DEE21ADADB18F476
0,1,1,537,不甩高虹安淚崩　王浩宇推中華大學日通關語「虹油抄手」免費領襪子,2022-09-21 14:32:00,【記者吳慧芬／高雄報導】民眾黨新竹市長參選人高虹安昨一席「不是像什麼中華大學夜間部，才要去做台大碩士灌水」言論，在網路炸鍋，她為此淚崩，桃園前議員王浩宇則在臉書宣布921為中華大學日，今晚6點後中華大學學生校友與憑通關密語「一份虹油抄手」，可到全台夥伴生活門市領襪子。,https://tw.nextapple.com/politics/20220921/01835E92048C7E4A4A565F67359CDB53
0,0,0,538,寶島歌王洪一峰紀念特展　釣出超大咖歌王歌后狂讚,2022-09-21 09:53:00,【記者林丞偉／台北報導】寶島歌王洪一峰生前創作無數經典歌曲，由財團法人洪一峰文化藝術基金會與中華文化總會共同主辦，文化部指導的《黑狗兄返來了-寶島歌王洪一峰10周年紀念特展》將於9月23日開展，地點選在歌王從小生長的「萬華」剝皮寮歷史街區，這是他金曲歌王的兒子洪榮宏、洪敬堯、洪榮良3兄弟對父親深深思念的回憶展。,https://tw.nextapple.com/entertainment/20220921/01835DB3F82750A87A05CEE605B1BC78
0,0,0,539,女王國葬冠蓋雲集　德仁沒戴口罩、拜登防彈座駕代步〡圖輯,2022-09-19 12:48:00,【國際中心／綜合外電】英國將為女王伊麗莎白二世舉行國葬，並邀請各國政要出席，白金漢宮在國葬前夕舉辦招待會款待各國貴賓，重量級人物齊聚一堂，被媒體形容為「世紀招待會」，英國上次有這樣盛大的場面，就是女王父親喬治六世的葬禮。,https://tw.nextapple.com/international/20220919/018353A1E10BD0AE15E07866C25751C0
0,0,0,540,被送人的姊姊拒幫親弟弟買房子　父母竟提告求償223萬元,2022-09-13 19:42:00,【劉育良／綜合報導】中國廣東省廣州市一名29歲的張姓女子，從2歲起就被親生父母送給姑姑扶養，張女長大後報答姑姑，為姑姑兒子、張女表弟買了一間房子，豈料竟因而被親生父母告上法院求償50萬元人民幣（約223萬元台幣）。,https://tw.nextapple.com/international/20220913/018335DA93DD836A922809D49F56AF01
