index,origin,title,inputime,summary,link
1,人民日报客户端,驻美大使秦刚：美方不断歪曲和掏空一个中国政策,1658450916000,秦刚在谈话中重点就中美关系、<em>台湾</em>等问题阐述中方政策立场。  　　关于<em>台湾</em>问题，秦刚表示，美方不断歪曲和掏空一个中国政策，大肆提升美台官方关系，不断派高官访台，售台大量先进武器，发表“军事防卫<em>台湾</em>”错误言论。,http://usa.people.com.cn/n1/2022/0722/c241376-32482887.html
2,人民网－人民日报海外版,大暑：送瘟消暑 滋补养生（解码二十四节气）,1658449623000,比如福建、广东和<em>台湾</em>在大暑前后有吃仙草的习俗。仙草是一种草本植物，茎叶晒干后可熬制成“烧仙草”，是一种消暑甜品。当地有“六月大暑吃仙草，活如神仙不会老”的民谚。,http://yn.people.com.cn/health/n2/2022/0722/c228588-40048750.html
3,人民网－《人民日报》,第十九届台胞青年千人夏令营开营,1658449207000,全国台联副会长纪斌在致辞中表示，希望广大<em>台湾</em>青年追求进步，用青春的智慧和汗水为民族复兴贡献力量；追求奋斗，积极投身祖国发展建设；追求真理，看清历史发展大势，为推动两岸关系和平发展、融合发展扛起时代重任。中国国民党前主席、中华青雁和平教育基金会董事长洪秀柱，新党前主席郁慕明，劳动党主席吴荣元，统一联盟党主席戚嘉林等<em>台湾</em>嘉宾通过视频对开营表示祝贺。　　,http://hb.people.com.cn/n2/2022/0722/c194063-40048708.html
4,人民网-人民日报海外版,大暑：送瘟消暑 滋补养生,1658449071000,比如福建、广东和<em>台湾</em>在大暑前后有吃仙草的习俗。仙草是一种草本植物，茎叶晒干后可熬制成“烧仙草”，是一种消暑甜品。当地有“六月大暑吃仙草，活如神仙不会老”的民谚。,http://kpzg.people.com.cn/n1/2022/0722/c404214-32482711.html
5,人民网－人民日报海外版,第十九届台胞青年千人夏令营开营 “龙脉相传 青春中华”之旅再启程,1658447189000,中国国民党前主席、中华青雁和平教育基金会董事长洪秀柱，新党前主席郁慕明，劳动党主席吴荣元，统一联盟党主席戚嘉林等<em>台湾</em>嘉宾通过视频对开营表示祝贺。营员代表、北京大学<em>台湾</em>学生林彦辰表示，通过夏令营活动，自己对中华文化传承一定会有新的认识。未来，将多向岛内青年分享在大陆的经历和感悟，帮助更多岛内青年认识祖国大陆。营员代表、<em>台湾</em>政治大学学生许陈品表示，全国台联努力不懈组织两岸青年交流活动，让课本、视频中的祖国江山真实呈现在<em>台湾</em>青年眼前，帮助我们深刻认识中华文化的源远流长和与时俱进。线下活动将在大陆近30个省区市举行，通过参访新兴行业代表企业、体验传统非遗项目等方式，帮助<em>台湾</em>青年感受祖国日新月异的发展变化，加深两岸青年情感认知，促进两岸同胞心灵契合。开营前夕，两岸的台胞青年分别在北京长城脚下和<em>台湾</em>新北平溪，共同书写祝福语、放飞祈福孔明灯，祝愿两岸早日战胜疫情，更表达对实现民族伟大复兴的期盼。,http://edu.people.com.cn/n1/2022/0722/c1006-32482595.html
6,人民网－人民日报海外版,大暑：送瘟消暑 滋补养生（解码二十四节气）,1658447054000,比如福建、广东和<em>台湾</em>在大暑前后有吃仙草的习俗。仙草是一种草本植物，茎叶晒干后可熬制成“烧仙草”，是一种消暑甜品。当地有“六月大暑吃仙草，活如神仙不会老”的民谚。,http://health.people.com.cn/n1/2022/0722/c14739-32482585.html
7,人民网－人民日报,第十九届台胞青年千人夏令营开营,1658439714000,全国台联副会长纪斌在致辞中表示，希望广大<em>台湾</em>青年追求进步，用青春的智慧和汗水为民族复兴贡献力量；追求奋斗，积极投身祖国发展建设；追求真理，看清历史发展大势，为推动两岸关系和平发展、融合发展扛起时代重任。中国国民党前主席、中华青雁和平教育基金会董事长洪秀柱，新党前主席郁慕明，劳动党主席吴荣元，统一联盟党主席戚嘉林等<em>台湾</em>嘉宾通过视频对开营表示祝贺。　　,http://tw.people.com.cn/n1/2022/0722/c14657-32482490.html
8,新华网,2022两岸青年峰会在京举办 共话青春与友谊,1658414844000,中共中央台办、国务院台办主任刘结一在开幕式上致辞表示，习近平总书记7月11日给参加海峡论坛的部分<em>台湾</em>青年回信，站在国家前途和民族未来的历史高度，为两岸青年指明了前进方向，为团结广大<em>台湾</em>青年共谋民族复兴伟业明确了根本遵循热诚欢迎<em>台湾</em>青年来京学习生活、就业创业、交流实践。我们将一如既往为<em>台湾</em>青年提供更优的服务和更好的平台，继续办好京台科技论坛、京台青年创新创业大赛等活动，用好两岸青年创新创业基地等平台，持续开展在京台生北京社会实践等活动，促进两岸青年交往交流。  　　峰会展示近年来<em>台湾</em>青年融入大陆的青春风采，向两岸青年朋友发出“复兴有我”的倡议。中国国民党副主席连胜文通过视频祝两岸青年在克难前行中厚植友谊、积累互信、携手打拼、共创双赢。开幕式上举行了“<em>台湾</em>青年边疆行系列活动”启动仪式。北京大学教授林毅夫和全国青联副主席、全海深载人潜水器“奋斗者”号总设计师叶聪发表主旨演讲。  　　,http://tw.people.com.cn/n1/2022/0721/c14657-32482450.html
9,新华网,秦刚在阿斯彭安全论坛就中美关系阐述中方立场,1658409762000,秦刚表示，<em>台湾</em>问题一直是中美关系中最重要、最敏感的核心问题。美方不断歪曲和掏空一个中国政策，大肆提升美台官方关系，不断派高官访台，售台大量先进武器，发表“军事防卫<em>台湾</em>”错误言论。,http://world.people.com.cn/n1/2022/0721/c1002-32482423.html
10,外交部,2022年7月21日外交部发言人汪文斌主持例行记者会,1658408836000,美国国会是美国政府的组成部分，理应严格遵守美方在<em>台湾</em>问题上的承诺。乌克兰问题同<em>台湾</em>问题有着根本区别。我们敦促美方恪守一个中国原则，不得干涉中国内政。  　　韩联社记者：发言人刚才发布了印度尼西亚总统访华的计划。请问他这次会访问北京吗？  　　,http://world.people.com.cn/n1/2022/0721/c1002-32482420.html
11,泉州晚报,刘建洋主持召开泉州市委常委会会议,1658392154000,　　 20日，福建省委常委、泉州市委书记刘建洋主持召开市委常委会会议，认真学习贯彻习近平总书记给参加海峡青年论坛的<em>台湾</em>青年回信、给中国国家博物馆的老专家回信、向世界互联网大会国际组织成立致贺信、对机关事务工作的重要指示精神要增进泉台青年交流交往、互学互鉴，提供发展空间和便利条件，吸引更多<em>台湾</em>青年来泉学习实习、就业创业。 　　,http://fj.people.com.cn/n2/2022/0721/c181466-40048139.html
12,人民网－广西频道,全国台联第十九届台胞青年千人夏令营广西分营开营,1658389588000,来自广西各高校的<em>台湾</em>青年教师和在区内外学习、就业创业的台胞青年等参加活动。 记者 彭远贺 摄影报道,http://gx.people.com.cn/n2/2022/0721/c179430-40048032.html
13,人民网-国际频道,驻美大使秦刚：美方不断歪曲和掏空一个中国政策,1658381444000,秦刚在谈话中重点就中美关系、<em>台湾</em>等问题阐述中方政策立场。关于<em>台湾</em>问题，秦刚表示，美方不断歪曲和掏空一个中国政策，大肆提升美台官方关系，不断派高官访台，售台大量先进武器，发表“军事防卫<em>台湾</em>”错误言论。,http://world.people.com.cn/n1/2022/0721/c1002-32481990.html
14,人民网－北京频道,东城区史家胡同博物馆挂牌首批“京台基层交流基地”,1658376742000,街道台联会会长郝法宗现场与远在<em>台湾</em>的子女通过电话“云”交流，分享了自己参加街道台胞台属联谊活动的喜悦心情，邀请他们回北京后到交流基地做客。,http://bj.people.com.cn/n2/2022/0721/c233088-40047748.html
15,青海日报,绿色引领 生态共享 同谱建设现代化新青海奋进乐章,1658369266000,除主宾省展区外，会展中心A馆还设有国内国际展区、香港展区、<em>台湾</em>展区，集中展示国内对口援青及相关省（区、市）、在华跨国公司和外资企业发展生态产业的先进技术和生态绿色产品，展示在环境综合治理、环保装备与技术,http://qh.people.com.cn/n2/2022/0721/c405332-40047496.html
16,中国台湾网,2022浙江·<em>台湾</em>周在杭开幕 两岸共商浙台融合高质发展,1658369059000,中国台湾网7月20日杭州讯 （记者 孙路路）7月20日上午，以“新格局、新机遇、新发展”为主题的2022浙江·<em>台湾</em>周在杭州开幕。两岸企业家峰会大陆方面副理事长张平、<em>台湾</em>方面副理事长陈瑞隆，浙江省委常委、常务副省长徐文光，中央台办、国务院台办副主任龙明彪，全国台企联会长李政宏等出席开幕式并致辞。浙江·<em>台湾</em>周是国务院台办支持浙江高质量发展建设共同富裕示范区的重要措施，也是深化“东引台资”、推进浙台经济社会融合发展、助力浙江“两个先行”的重要涉台经贸平台。本届浙江·<em>台湾</em>周除在杭州举办开幕式和主场活动外，还在嘉兴、宁波、温州、台州、绍兴等地举办专场和专题活动。（审校/许辉）,http://tw.people.com.cn/n1/2022/0721/c14657-32481823.html
17,青海日报,第23届青洽会、第二届生态博览会布展工作紧锣密鼓进行中,1658368601000,据了解，A馆作为国内国际馆，共设31个展示馆和2个综合服务区，其中主宾省展示馆2个、青海省展示馆2个，<em>台湾</em>、香港以及17个省区市共设展示馆22个、央企展示馆5个，参展企业213家，搭建总面积7746平方米,http://qh.people.com.cn/n2/2022/0721/c405332-40047471.html
18,人民网－人民日报海外版,<em>台湾</em>老百姓的日子有点难,1658366229000,　　据新华社台北电　（记者齐湘辉、岳夕彤）台经济事务主管部门刚宣布本月开始调涨电价，岛内民生物资便陆续涨价，<em>台湾</em>百姓的日子有点难。  　　<em>台湾</em>造纸大厂正隆集团表示，卫生纸涨价“势在必行”。  　　其他民生用品也“涨”声一片。岛内市占率最高的牛奶品牌计划月中涨价。台当局统计部门最新数据显示，<em>台湾</em>6月份消费者物价指数（CPI）年增率达3.59%，是近14年来最大涨幅。其中，外食费涨幅扩大到6.38%，也是近14年来最大涨幅。虽然<em>台湾</em>的基本工资有所调升，但基本上被物价上涨抵消了，甚至还出现倒退状况。据台当局统计，今年前5月岛内全体受雇员工经常性薪资年增2.83%。近七成岛内制造业者预估<em>台湾</em>今年全年CPI将在2%以上，43.5%的业者认为物价上涨态势会延续到2023年以后。  　　,http://tw.people.com.cn/n1/2022/0721/c14657-32481722.html
19,新华社,2022年<em>台湾</em>大学生实习体验活动在广州启动,1658365994000,　　新华社广州7月20日电（洪泽华、张颖茵）2022年<em>台湾</em>大学生广州实习体验活动20日在广州南沙区创享湾启动。本次活动吸引了来自北京大学、中山大学、澳门大学、<em>台湾</em>交通大学等30余所高校的150余名<em>台湾</em>学生报名参加。  　　活动将组织<em>台湾</em>学生在广东省属、广州市属国企以及大陆知名民企、港澳台企业、院校和科研院所等单位进行实习体验，实习岗位涉及金融、人工智能、生物科技、互联网等领域。  　　近年来，广州深入实施“五乐计划”，推动穗台青年开展人文交流与合作，为<em>台湾</em>青年来穗学习、实习、就业、创业、生活提供便利。<em>台湾</em>大学生广州实习体验活动已举办6届，累计吸引100余所<em>台湾</em>高校、近2000名<em>台湾</em>大学生参与。,http://tw.people.com.cn/n1/2022/0721/c14657-32481700.html
20,北京日报,蔡奇：努力用青春和汗水创造无愧于时代的业绩,1658364378000,　　本报讯（记者 祁梦竹 刘菲菲）昨天上午，中共中央政治局委员、北京市委书记蔡奇与参加“同心同行”——2022两岸青年峰会的<em>台湾</em>方面代表座谈。他强调，青年兴则国家兴，青年强则国家强。希望大家深入学习习近平总书记给参加海峡青年论坛的<em>台湾</em>青年回信精神，坚持立大志、明大德、成大才、担大任，不负韶华、拼搏奋斗，努力用青春和汗水创造无愧于时代的业绩。蔡奇对参加“同心同行”——2022两岸青年峰会的<em>台湾</em>方面代表表示欢迎，对大家关注、支持、参与首都建设发展表示感谢。他说，习近平总书记一直十分关心关怀青年成长，在多个场合深刻指出青年对推动两岸关系和平发展的重要性，上周又专门给参加海峡青年论坛的<em>台湾</em>青年回信，充分体现了习近平总书记对包括<em>台湾</em>青年在内的全体中国青年的亲切关怀与厚望会上，5名<em>台湾</em>青年代表发言，分享了在京创业、工作、生活、学习感受。会后，与会领导与<em>台湾</em>青年代表合影留念。　　中央有关部门和北京市领导田学军、徐晓、游钧、赵磊出席，部分<em>台湾</em>青年代表等参加。,http://bj.people.com.cn/n2/2022/0721/c82844-40047177.html
