index,origin,title,inputime,summary,link
1,新华社,署名文章：“九二共识”的思想内涵与历史意义,1659316289000,　　新华社北京7月30日电 题：“九二共识”的思想内涵与历史意义  　　中国社会科学院<em>台湾</em>研究所所长 杨明杰  　　今年是两岸达成“九二共识”30周年。<em>台湾</em>问题是中国的内政。两岸是一家人，两岸的事是家里事。从“九二共识”的形成过程看，两岸中国人完全有智慧有能力解决好自己的问题。2016年5月以来，民进党当局拒不承认“九二共识”，直接导致海协会与台湾海基会协商谈判中断，国台办与<em>台湾</em>方面陆委会联系沟通机制停摆，台海地区和平稳定受到严峻挑战。  　　坚持一个中国原则和“九二共识”，不仅是推动现阶段两岸关系和平发展的政治基础，也是开启两岸民主协商、探索“两制”<em>台湾</em>方案的政治基础。<em>台湾</em>的政党、团体、人士只有顺应中华民族复兴的历史潮流，看清祖国必将统一的历史大势，认同和捍卫体现一个中国原则的“九二共识”，坚定反对“台独”和外部势力干涉，才能确保台海局势和平稳定，才能维护台湾同胞福祉利益,http://tw.people.com.cn/n1/2022/0801/c14657-32490880.html
2,新华社,综述：少年有志当擎云——两岸青年交流暑期活动火热开展 共话新机遇新未来,1659316265000,北京分营营员、来自<em>台湾</em>新竹的方承暄在大陆互联网领域工作多年，在她看来，电商经济是近年来经济发展的风口。“这次研习营对有志于从事相关领域工作的<em>台湾</em>青年提供了很好的学习机会。”    　　陕西分营营员、<em>台湾</em>青年赵邓夏馨在开营时说，两岸年轻朋友身处不同地域环境，有着不同的成长背景，千人夏令营给了大家很好的机会，相互交流，增进了解。近年来，大陆为<em>台湾</em>青年在大陆发展持续创造更多便利条件。图为<em>台湾</em>青年黄亭瑗（前左）在对接会上与用人单位招聘人员交流（资料图片）。新华社记者 姜克红 摄  　　“大陆为<em>台湾</em>青年在大陆发展持续创造更多便利条件，越来越多<em>台湾</em>青年愿意来大陆求学、创业、就业。”湖南分营营员、<em>台湾</em>青年许博翔表示，两岸年轻人应当多参加线上线下的交流活动，进一步加深了解，互学互鉴互助，共同承担时代重任。  　　,http://tw.people.com.cn/n1/2022/0801/c14657-32490878.html
3,新华社,如果照片会说话——<em>台湾</em>大学生重走云南茶马古道,1659316235000,在<em>台湾</em>大学生们的镜头里，有优美的自然风光，有当地百姓的生活日常，也有民族特色和人文风情。  　　今年7月初，一群<em>台湾</em>大学生再次踏上这条古道。  　　<em>台湾</em>大学生刘子君在南京大学交换期间报名参加了今年的摄影营活动。“一路上就像一页页历史和地理课本呈现在眼前，我们到当地少数民族家里观赏手工技艺，也被寺庙里庄严肃穆的氛围所感染。<em>台湾</em>新竹清华大学学生郭芳任表示，在活动中认识了很多当地朋友，学员们也感受到彼此温暖的友谊，可以说这是一个心灵疗愈的活动。  　　照片是历史的真实记录。重走茶马古道，<em>台湾</em>大学生们以他们的视角，记录下古道的新变化。  　　位于云南德钦县的雨崩村曾经以骑骡子作为进出村的主要交通方式。曾连续两年参加摄影营的<em>台湾</em>青年黄登昌依然记得，“骑骡子大概要花三个多小时，后面还要徒步，不过近几年交通便利，学员可以乘坐越野车前往雨崩村”。  　　,http://tw.people.com.cn/n1/2022/0801/c14657-32490877.html
4,新华社,署名文章：“九二共识”是台海和平的基础,1659316226000,　　新华社北京7月31日电 题：“九二共识”是台海和平的基础  　　全国<em>台湾</em>研究会秘书长 杨幽燕  　　7月26日举行的“九二共识”30周年座谈会是一场具有重要政治意义的活动。30年前台湾当局曾经主张努力谋求国家统一，<em>台湾</em>是中国的一部分；1992年台湾海基会认同海峡两岸交往中的具体问题是中国的内部事务，应本着一个中国原则协商解决，并在讨论如何坚持一个中国原则的口头表述方案中提出了承认“九二共识”，两岸关系就能不断改善，和平发展就可以持续取得丰硕成果和历史性突破，台湾同胞就从中受益；反之两岸关系就紧张动荡，<em>台湾</em>民众也会深受其害。,http://tw.people.com.cn/n1/2022/0801/c14657-32490876.html
5,新华社,国台办：日方某些人要汲取历史教训，在<em>台湾</em>问题上谨言慎行,1659313481000,我们敦促日方某些人充分认识<em>台湾</em>问题的高度敏感性，认清世界上只有一个中国，<em>台湾</em>是中国的一部分的事实，尤其要汲取历史教训，恪守一个中国原则和中日四个政治文件精神，在<em>台湾</em>问题上谨言慎行。  　　,http://japan.people.com.cn/n1/2022/0801/c35421-32490742.html
6,央视新闻客户端,玉渊谭天丨中美元首通话：美国必须摆正世界观,1659274772000,路透社的报道在标题就点明，“中方警告美方，不要在<em>台湾</em>问题上玩火”，在正文中更是完整引用了“玩火必自焚，希望美方看清楚这一点”；  福克斯新闻网则是在导语里完整引用了中方的警告——“玩火必自焚”；  值得一提的是，美国国会议员都会读的《国会山报》也做了完整引用，“玩火必自焚”；  而《金融时报》在标题中特别点明，“在佩洛西可能的<em>台湾</em>行之前，中方警告美方不要玩火”。此次通话中，拜登总统重申，美国的一个中国政策没有改变也不会改变，美方不支持<em>台湾</em>“独立”。这表明，美方有摆正行动的意愿。  只是，从意愿到行动，仍有距离。  这一点，美国人自己也很着急。,http://world.people.com.cn/n1/2022/0731/c1002-32490387.html
7,新华网,元首沟通交流坦诚深入 期待中美发挥引领作用——多国人士热议中美元首通电话,1659271207000,在<em>台湾</em>问题上，美方应该言行一致恪守一个中国原则，履行中美三个联合公报。  　　元首直接通话对两国关系发展十分有益  　　美国前驻华大使马克斯·鲍卡斯评论说，中美两国元首直接通话对两国关系发展十分有益。美方应恪守一个中国原则  　　阿德希尔表示，<em>台湾</em>问题一直是中美关系中最重要最敏感的问题，美国一直企图利用<em>台湾</em>问题来制衡中国。毫无疑问，<em>台湾</em>是中国领土不可分割的一部分，这一点美方非常清楚。贝西历数近期美国在<em>台湾</em>问题上的挑衅行径，指出美国试图破坏中国统一，制造地区的不稳定局面，甚至发动舆论战攻击中国是极其错误的。她说，美国的做法极其危险，美方应恪守一个中国原则。  　　谈及美国频频在<em>台湾</em>问题上打擦边球试探中方底线，奥努纳伊朱直言，美国应在<em>台湾</em>问题上放弃所谓“战略模糊”，应言行一致，不要制造麻烦。  　　翁德生同样注意到中方就<em>台湾</em>问题对美方“玩火必自焚”的警告。他指出，这一明确警告向美国再次表明中国维护国家主权和领土完整的坚定意志。我们希望美国能言行一致，不要试探中国的红线。,http://world.people.com.cn/n1/2022/0731/c1002-32490370.html
8,央视新闻客户端,国际锐评丨美方要信守承诺回到正轨,1659267985000,习主席阐述了中美两个大国的职责所在，指出美方对中美关系的误判和对中国发展的误读，并重点就<em>台湾</em>问题阐述了原则立场。拜登总统表示寻求开展美中合作、妥善管控分歧，并承诺美国的一个中国政策没有改变也不会改变，美方不支持<em>台湾</em>“独立”。  这是本届美国政府上台以来中美元首第五次举行通话，也是在关键时刻一次极为重要的通话。外界注意到，习主席在本次通话中重点阐述了中方在<em>台湾</em>问题上的原则立场。这既是因为<em>台湾</em>问题是中美关系当中最重要、最敏感的问题，也反映出当前台海局势因美方不断挑衅所面临的风险正在上升。这是中国最高领导人就<em>台湾</em>问题向美方释放的明确信息。美方必须认识到：<em>台湾</em>问题如果处理不好，将会对中美关系产生颠覆性影响。美方也应端正对华战略认知，用实际行动落实拜登总统对华“四不一无意”承诺，特别是在<em>台湾</em>问题上谨言慎行，避免把局势引向危险境地。,http://world.people.com.cn/n1/2022/0731/c1002-32490367.html
9,环球网,中美元首时隔四个月再通话，回答了这四个关键问题,1659251248000,三、 美国打“<em>台湾</em>牌”为何必输无疑？  <em>台湾</em>问题是中国最大的家事之一，也是中美关系的最大“雷区”。近期美国政府第三号人物佩洛西众议长捣鼓“访问”<em>台湾</em>，再次把中美关系和台海地区推向险境。其实美国这些年来在<em>台湾</em>问题上搞的小动作远不止一个佩洛西“窜台”这么简单。美国口口声声说“反对单方面改变台海现状”，然而“改变现状”的不是中国，恰是<em>台湾</em>民进党当局和美国。习近平主席在通话中强调，“<em>台湾</em>问题的历史经纬明明白白，两岸同属一个中国的事实和现状清清楚楚。”美国还不顾中方强烈反对，持续不断向<em>台湾</em>售武、搞抵近侦查、派高官和议员窜访。2021年以来，拜登先后三次公开表示，如台海发生战争，美国将协防<em>台湾</em>。如果一次是口误，那三次呢？乌克兰危机爆发后，美国一些人又急不可耐地将<em>台湾</em>与乌克兰相提并论，宣称“乌克兰问题凸显中国对<em>台湾</em>构成的严重威胁”，趁机炒作“民主对抗威权”叙事，公然挑战中国底线。,http://world.people.com.cn/n1/2022/0731/c1002-32490332.html
10,新华网,中方呼吁构建均衡有效可持续的全球和地区安全架构,1659231565000,他特别指出，个别国家在乌克兰问题上一再强调主权原则，但在<em>台湾</em>问题上却不断挑战中国主权，甚至蓄意在台海制造紧张局势，这是对宪章宗旨和原则的亵渎和侵害。,http://world.people.com.cn/n1/2022/0731/c1002-32490245.html
11,中国新闻网,上海新增本土确诊病例3例和无症状感染者3例,1659228475000,无症状感染者8为<em>台湾</em>居民，在台湾地区探亲，自台湾地区出发，于2022年7月28日抵达上海浦东国际机场，入关后即被集中隔离观察，其间例行核酸检测异常。经排查，区疾控中心新冠病毒核酸检测结果为阳性。,http://health.people.com.cn/n1/2022/0731/c14739-32490183.html
12,福建日报,第二十一届海峡两岸大学生辩论赛成功举办,1659228340000,福建省委常委、统战部部长王永礼出席颁奖仪式，中国科协党组成员兼港澳台办公室主任罗晖出席颁奖仪式并致辞，<em>台湾</em>中华青年交流协会理事长黄荣护线上致辞。 　　,http://fj.people.com.cn/n2/2022/0731/c181466-40061391.html
13,新华网,新华全媒+｜就中美关系重大问题传递明确信息——专家谈中美元首通电话,1659227932000,阐述在<em>台湾</em>问题上原则立场，展现14亿多中国人民的坚定意志  　　一段时间以来，美方涉台消极动作不断，引发各界关注。  　　“<em>台湾</em>问题的历史经纬明明白白，两岸同属一个中国的事实和现状清清楚楚。通话中，习近平主席重点阐述了中方在<em>台湾</em>问题上的原则立场。他强调：  　　“我们坚决反对‘台独’分裂和外部势力干涉，绝不为任何形式的‘台独’势力留下任何空间。中国政府和中国人民在<em>台湾</em>问题上的立场是一以贯之的，坚决维护中国国家主权和领土完整是14亿多中国人民的坚定意志。民意不可违，玩火必自焚。希望美方看清楚这一点。外交学院教授高飞表示，<em>台湾</em>问题是中美关系中最重要、最敏感、最核心的问题。美方多次明确表示奉行一个中国政策，不支持“台湾独立”。但近来美方一些人频频搞“小动作”，妄图“以台制华”，行动与表态大相径庭。如果美方执意打“<em>台湾</em>牌”，在错误道路上越走越远，必将把局势引向危险境地。  　　吴心伯说，习近平主席的讲话从历史和现实两个维度，阐明了中方在<em>台湾</em>问题上立场的正当性、坚定性、严肃性。,http://politics.people.com.cn/n1/2022/0731/c1001-32490169.html
14,中国新闻网,第一届<em>台湾</em>史青年学者研讨会在广州开幕,1659227257000,本次研讨会由中国社科院<em>台湾</em>史研究中心与中山大学历史学系联合主办，采用线上线下相结合方式举行，22位学者将在会上分享有关清代以来<em>台湾</em>历史的研究成果。广西师范大学历史文化与旅游学院<em>台湾</em>教师侯彦伯说，此次研讨会演讲主题多元，研究年代跨越清初至20世纪60年代，多位在大陆高校任职的<em>台湾</em>教师与青年学者开展对话，有助于进一步促进两岸<em>台湾</em>史研究的交流。中国社会科学院学部委员、中国社会科学院<em>台湾</em>史研究中心主任张海鹏接受中新社记者采访时表示，<em>台湾</em>史研究最重要的是要坚持正确的史观，即<em>台湾</em>史是中国历史的一部分，青年学者要牢牢把握这一点。他说，目前<em>台湾</em>史研究开展得还不是很深入，未来我们寄希望于青年一代，此次研讨会体现了青年学者在<em>台湾</em>史研究领域的学术深度与学术潜力。据介绍，<em>台湾</em>史青年学者研讨会由中国社会科学院<em>台湾</em>史研究中心《<em>台湾</em>历史研究》编辑部发起，旨在培养<em>台湾</em>史研究的新力量，推动<em>台湾</em>史学科建设，将每年举办一届。(记者 王捷先),http://edu.people.com.cn/n1/2022/0731/c1006-32490148.html
15,人民网－人民日报,国际社会期待中美发挥引领作用,1659226126000,“习近平主席在通话中就<em>台湾</em>问题表达坚定立场，体现了负责任大国领导人的担当，受到国际社会的广泛关注。”“<em>台湾</em>是中国领土的一部分，这是不争的事实。”泰国皇家理工大学科创文化学院院长元德表示，中美元首在<em>台湾</em>问题上进行有效沟通，对整个亚太地区的和平稳定尤为重要。地区国家渴望和平，因为和平是发展的基础。菲律宾《亚洲商业周刊》总编辑安东尼·洛佩斯表示，美国总统拜登重申，美国的一个中国政策没有改变也不会改变，美方不支持<em>台湾</em>“独立”。,http://cpc.people.com.cn/n1/2022/0731/c64387-32490112.html
16,人民网－人民日报,国际社会期待中美发挥引领作用,1659214731000,“习近平主席在通话中就<em>台湾</em>问题表达坚定立场，体现了负责任大国领导人的担当，受到国际社会的广泛关注。”“<em>台湾</em>是中国领土的一部分，这是不争的事实。”泰国皇家理工大学科创文化学院院长元德表示，中美元首在<em>台湾</em>问题上进行有效沟通，对整个亚太地区的和平稳定尤为重要。地区国家渴望和平，因为和平是发展的基础。　　菲律宾《亚洲商业周刊》总编辑安东尼·洛佩斯表示，美国总统拜登重申，美国的一个中国政策没有改变也不会改变，美方不支持<em>台湾</em>“独立”。,http://world.people.com.cn/n1/2022/0731/c1002-32490066.html
17,人民网-台湾频道,第一届<em>台湾</em>史青年学者研讨会在广州开幕,1659167086000,人民网广州7月30日电 （记者程龙）第一届<em>台湾</em>史青年学者研讨会30日在广州中山大学开幕。活动由孙中山基金会资助，中国社会科学院<em>台湾</em>史研究中心与中山大学历史学系联合主办。中国社会科学院学部委员、中国社会科学院<em>台湾</em>史研究中心主任张海鹏接受记者采访表示，<em>台湾</em>史研究最重要的是要坚持正确的史观，那就是<em>台湾</em>史是中国历史的一部分，青年学者要牢牢把握这一点。<em>台湾</em>史的研究，目前来说开展得还不是很深入，未来我们寄希望于青年一代。此次举办第一届<em>台湾</em>史青年学者研讨会体现了青年学者在<em>台湾</em>史研究领域的学术深度与学术潜力。我们也欢迎更多<em>台湾</em>青年学者参与学术研讨，共同推动<em>台湾</em>史研究。据介绍，<em>台湾</em>史青年学者研讨会由中国社会科学院<em>台湾</em>史研究中心《<em>台湾</em>历史研究》编辑部发起，旨在培养<em>台湾</em>史研究的新队伍，推动<em>台湾</em>史学科建设，将每年举办一届。,http://tw.people.com.cn/n1/2022/0730/c14657-32490009.html
18,新华网,中方呼吁构建均衡有效可持续的全球和地区安全架构,1659166638000,他特别指出，个别国家在乌克兰问题上一再强调主权原则，但在<em>台湾</em>问题上却不断挑战中国主权，甚至蓄意在台海制造紧张局势，这是对宪章宗旨和原则的亵渎和侵害。,http://world.people.com.cn/n1/2022/0730/c1002-32490008.html
19,人民网－辽宁频道,办得好 | 夜市噪音扰民 沈阳：立即调整降低分贝,1659155463000,沈阳塔湾兴顺夜市云集外国美食和四川、云南、<em>台湾</em>等全国各地知名小吃，是沈阳市民的深夜食堂。但是露天演艺确实给附近居民带来了噪音困扰，“家人交流只能靠吼，根本不敢开窗户。”该市民说。,http://ln.people.com.cn/n2/2022/0730/c378489-40060938.html
20,人民网－人民日报,处理中美关系必须加强沟通避免误判（钟声）,1659144403000,习近平主席为中美关系发展指明正确方向，重点阐述了中方在<em>台湾</em>问题上的原则立场，强调双方要保持各层级沟通，用好现有沟通渠道，推动双方合作，充分展现了一个大国领袖、一个政治家对中美两国人民利益、对世界各国人民利益高度负责的鲜明态度国际社会高度关注此次中美元首通话，聚焦点不约而同放在习近平主席就<em>台湾</em>问题阐明的原则立场上。“习近平主席强调不要在<em>台湾</em>问题上玩火”“中国警告美国应恪守一个中国原则”……这些报道标题反映出国际社会对美国打“<em>台湾</em>牌”、企图“以台制华”危险做法的担忧。<em>台湾</em>问题始终是中美关系中最重要、最敏感的问题。中国政府和中国人民在<em>台湾</em>问题上的立场是一以贯之的，坚决维护中国国家主权和领土完整是14亿多中国人民的坚定意志。民意不可违，玩火必自焚。拜登总统在通话中表示，美国的一个中国政策没有改变也不会改变，美方不支持<em>台湾</em>“独立”。美方应将相关承诺落到实处，明确、坚定地反对任何“台独”行径，不再向“台独”势力发出错误信号。,http://cpc.people.com.cn/n1/2022/0730/c64387-32489957.html
