index,origin,title,inputime,summary,link
1,人民网-台湾频道,国台办：愿意以最大诚意、尽最大努力争取和平统一的前景,1656472204000,台湾中国时报记者：最近美国高盛集团发表的两岸风险指数和两岸风险晴雨表显示，两岸紧张局势升到近十年以来最高。香港的中国海峡研究院最新报告也指出，两岸风险指数达到历史高位。请问发言人对此有何评论？马晓光：首先，大家应该反思出现这种现象背后的原因是什么，是因为民进党当局勾连外部势力谋“独”挑衅，造成台海局势紧张动荡，引起台湾社会普遍的深层次忧虑。最后，我们坚持“和平统一、一国两制”的方针政策没有变，我们愿意以最大诚意、尽最大努力争取和平统一的前景，但我们绝不允许台湾从中国分裂出去。,http://tw.people.com.cn/n1/2022/0629/c14657-32460253.html
2,新华网,王毅同委内瑞拉外长法里亚通电话,1656471411000,王毅说，中方感谢委方在台湾、涉港、涉疆、人权等问题上同中方坚定站在一起，发出正义之声。,http://world.people.com.cn/n1/2022/0629/c1002-32460205.html
3,人民网-台湾频道,国台办：美西方拉拢盟友打“台湾牌”十分危险,1656470888000,第二个问题，“台湾民意基金会”最新调查显示，超过一半民众认为，大陆如果“武力攻台”，台军撑不过100天，同时超过一半的台湾民众不相信美国的“协防承诺”，请问发言人对此有何评论？马晓光：第一个问题，台湾是中国的一部分。台湾问题纯属中国内政，不容任何外来干涉。美西方拉拢盟友打“台湾牌”，企图遏制中国发展和统一，这是十分危险的。这种现象反映了台湾民众、台湾社会对民进党当局谋“独”挑衅所带来危险性和危害性的深层次担忧。  我想强调的是，我们坚持“和平统一、一国两制”的方针政策没有变。,http://tw.people.com.cn/n1/2022/0629/c14657-32460175.html
4,人民网-台湾频道,国台办：民进党当局持续操弄“借疫反中”是在损害台湾民众健康福祉,1656470764000,台湾中国电视记者提问：第一个问题，海关总署日前公布，从台湾地区输入大陆的2批水产品外包装样本中检出新冠病毒核酸阳性。民进党当局声称，抽查后没有发现问题，并称大陆“应做好食安管理”。对此有何评论？马晓光回答：第一个问题，因从台湾输入大陆的2批水产品的外包装样本中检出新冠病毒核酸阳性，按照海关总署公告2020年第103号规定，大陆对有关生产企业采取了暂停接受产品申报各1周的紧急预防性措施。该措施实施前已向台湾有关方面通报。截至目前，台湾有关方面未就相关情况进行反馈。新冠肺炎疫情发生以来，部分地区疫情与污染的进口冷链食品及包装相关联。第二个问题，在岛内疫情严重、抗原检测试剂紧缺的情况下，民进党当局不顾台湾民众健康安危，在抗原试剂问题上捕风捉影，做政治文章，其目的是撕裂两岸同胞感情、破坏两岸关系。疫情发生以来，民进党当局持续操弄“借疫反中”，煽动两岸对立，这种政治操弄已不止一次，最终都是在损害台湾民众的健康福祉。,http://tw.people.com.cn/n1/2022/0629/c14657-32460171.html
5,人民网-台湾频道,国台办：民进党当局“倚美谋独”、“倚武谋独”必遭失败,1656470472000,马晓光表示，民进党当局不断加强与外部势力的军事、准军事勾连，造成台海紧张动荡，其从外国购武的行径更是花台湾老百姓的血汗钱，不惜把台湾民众推向战火。“倚美谋独”、“倚武谋独”必遭失败。,http://tw.people.com.cn/n1/2022/0629/c14657-32460163.html
6,人民网-台湾频道,国台办：奉劝民进党当局不要做外部势力任意宰割台民众利益的帮凶,1656470335000,奉劝民进党当局，停止损害台湾同胞的切身利益，不要在“倚美谋独”的歧路上越走越远，也不要做外部势力任意宰割台湾民众利益、榨取台湾经济成果的帮凶。,http://tw.people.com.cn/n1/2022/0629/c14657-32460159.html
7,人民网-台湾频道,国台办：坚决反对任何为“台独”分裂势力及其活动提供舞台和便利的行为,1656470193000,中国台湾网记者提问：有媒体报道，波兰哥白尼大学同中国台湾地区有关机构成立所谓“台湾极地研究站”，并展示“伪旗”。对此有何评论？民进党当局玩弄各种伎俩改变不了台湾是中国一部分的事实。,http://tw.people.com.cn/n1/2022/0629/c14657-32460153.html
8,人民网-台湾频道,民进党当局大肆炒作所谓“对美外交成绩” 国台办：没有底线,1656470091000,中央广播电视总台国广记者：有台湾媒体日前曝出美国司法部门文件内容，显示民进党当局大肆炒作的所谓“对美外交成绩”，大多通过向美政治公关公司撒钱来实现。他们不断拿台湾老百姓的血汗钱去收买美有关政客，为反华势力服务，编造所谓“外交成绩”，欺骗舆论和岛内民众，可谓是“认知作战”的惯犯。正告民进党当局，“台独”是绝路。,http://tw.people.com.cn/n1/2022/0629/c14657-32460152.html
9,人民网-台湾频道,国台办：民进党当局如不从源头上解决问题 就无法保障岛内渔民切身利益,1656469801000,人民政协报记者提问：大陆暂停输入台湾石斑鱼后，台农业主管部门声称，已完成11个石斑鱼养殖场的检验，“都没有禁用药物”，希望大陆尽快恢复输入。对此有何评论？马晓光表示，去年底，大陆向台湾有关方面通报石斑鱼药物不合格情况后，台湾方面回复“未检出禁用药物”，但近期大陆又从两批台石斑鱼中检出了禁用药物结晶紫。这说明相关问题根本没有得到解决。台湾石斑鱼养殖及安全卫生管理体系存在的问题查清了吗？得到根本解决了吗？谁又能保证输往大陆出现的问题不会出现在其他地方？,http://tw.people.com.cn/n1/2022/0629/c14657-32460146.html
10,人民网-台湾频道,国台办回应台湾输大陆石斑鱼问题：民进党当局监管不力所致,1656469520000,新华社记者：据台湾媒体报道，岛内石斑鱼出口养殖“寄生黑户”“借牌”问题严重，民进党当局放任违法者，养殖渔民是在替出口商背黑锅。马晓光：输大陆石斑鱼养殖户都是台湾主管部门按照岛内的规定和标准认定合格后允许的，每一批输大陆石斑鱼都随附台湾主管部门签发的证书，证明货物合法性和安全性。出现“借牌”问题，台湾主管部门作为证书管理者和签发者，应承担全部责任。岛内出现的所谓“寄生黑户”“借牌”等乱象，完全是民进党当局监管不力、管理混乱所致。对于自身管理出现的重大漏洞，民进党当局不但不思改善，反而借机向大陆“甩锅”，被台湾社会揭露出问题并理屈词穷后，又强行归咎于两岸农产品贸易机制，这种凡事都要进行政治操弄的拙劣伎俩可笑至极。,http://tw.people.com.cn/n1/2022/0629/c14657-32460140.html
11,人民网-台湾频道,国台办：坚持“九二共识”、反对“台独”是维护台海和平稳定的关键,1656469420000,马晓光表示，“九二共识”是1992年海协会与台湾海基会受权达成各自以口头方式表述“海峡两岸均坚持一个中国原则”的共识，界定了大陆和台湾同属一个中国的两岸关系性质，是改善和发展两岸关系的最大公约数，不容扭曲当前台海形势陷入紧张动荡，根源是民进党当局拒不承认“九二共识”，勾连外部势力不断进行谋“独”挑衅，包括挥霍台湾民众的血汗钱对外大肆求购武器，其结果不仅保不了台，还会把台湾一步步推向险境，严重损害广大台湾民众的安全福祉,http://tw.people.com.cn/n1/2022/0629/c14657-32460139.html
12,人民网-台湾频道,国台办痛批“中国从未统治过台湾”等荒谬言论,1656469114000,中华人民共和国理所当然地完全享有行使中国的主权，其中包括对台湾的主权。  其次，虽然海峡两岸尚未统一，但台湾是中国领土一部分的地位从未改变，也不允许改变，中国拥有对台湾的主权从未改变，也不可能改变。海峡两岸内战状态的长期存在并没有赋予台湾在国际法上的地位和权利，也不能改变台湾是中国一部分的法律地位。第三，国际社会承认世界上只有一个中国，台湾是中国的一部分，中华人民共和国政府是中国的唯一合法政府。在此原则下台湾无权参加联合国及其他只有主权国家参加的国际组织，与中国建交的国家不能与台湾发展官方关系，不能向台湾出售武器或与台湾进行任何形式的军事结盟。中国政府以一个中国原则对待台湾的对外交往活动，保障台湾同胞在海外的一切正当合法权益。这就是我们对台湾行使主权的具体象征。,http://tw.people.com.cn/n1/2022/0629/c14657-32460131.html
13,人民网-台湾频道,国台办：厦门、金门通桥是顺应两岸民众民生诉求的好事,1656469020000,台陆委会称建桥有所谓“安全风险”，有绿营政客指责柯文哲“出卖台湾”。金门县议长则表示，建金厦大桥不仅有助形成“金厦生活圈”，更可以创造金门稳定两岸和平的特殊价值，化解两岸僵局。马晓光说，至于陆委会拿所谓“安全风险”说事，我想说的是，民进党当局惯于以谎言对台湾民众进行恐吓欺骗，当年推动两岸直接“三通”时，民进党就大肆散布什么大陆“木马屠城”、“客机背后是军机”等荒唐可笑的言论。今天面对金厦通桥的呼吁，他们又故技重施，这再次说明只要有利于台湾民众的事情，有利于两岸关系改善和发展的事，他们都反对，这就是他们的政治本性。,http://tw.people.com.cn/n1/2022/0629/c14657-32460129.html
14,人民网-台湾频道,国台办：“台青黄河游记”为台湾青年提供了解中华民族新视角,1656468716000,福建厦门卫视记者：我们注意到，近期参与“台青黄河游记”的台湾青年制作发布了不少新媒体产品，受到关注和好评。请发言人介绍活动有关情况。十余名台湾青年从黄河入海口溯河而上至青海黄河源头，沿途走访并拍摄9省区36个地市的黄河人家，和当地青年一起实地感受黄河流域的壮阔风景、优秀传统文化、民俗文化和生态保护，见证黄河流域30年来的发展进步和沧桑巨变期待参与这次活动的台青们能为更多台湾青年提供一个了解黄河、了解大陆、了解中华民族历史与现实的新视角。感谢9省区当地台办、文旅、农业农村等部门对活动提供的大力支持。,http://tw.people.com.cn/n1/2022/0629/c14657-32460120.html
15,华西都市报,三星堆遗址中的海贝 暗藏文明的密码,1656465906000,“这种海贝分布于我国台湾、香港和海南诸岛。”从事动物考古研究的中科大人文学院科技史与科技考古系副研究员王娟告诉记者，“在世界范围内，它们广泛分布于印度洋到太平洋的暖海区。” 　　,http://sc.people.com.cn/n2/2022/0629/c345528-40015817.html
16,中国新闻网,香港回归25年，如何全面理解“一国两制”？,1656463532000,其次，“五十年不变”是指在一个中国的前提下，国家的主体坚持社会主义制度，香港、澳门以及今后的台湾保持原有的资本主义制度长期不变，而不是什么都不变。 　　这里的“不变”不是不发展、不进步、不与时俱进。我们既要把这些治理理念在中国主权范围内实现，包括“一国两制”下的香港、澳门(以及今后的台湾)，也要在理论上将其概括、提炼、升华，成为中国特色的制度建设和理论的有机组成部分。 　　,http://sc.people.com.cn/n2/2022/0629/c345460-40015552.html
17,人民网－人民日报海外版,台湾青年畅游黄河两岸体验齐鲁文化,1656463270000,　　据新华社济南电　（记者孙晓辉）20余位来自台湾的高校学生、创业青年，日前在山东省聊城市景阳冈结束了为期9天的“台青黄河游记”主题活动。　　“这是我第一次来到黄河入海口，感觉非常震撼，推荐台湾青年有机会来亲眼看一看，感受黄河的魅力。”台湾青年朱晏辰说。　　该活动负责人介绍，在山东段9天的行程中，台湾青年团队在黄河三角洲保护区、齐文化博物馆、聊斋故里、大明湖、趵突泉等文旅胜地开展采风活动，共同领略黄河流域孕育的齐鲁文化景观。　　台湾青年刘信愔对非物质文化遗产博山琉璃印象最为深刻。“博山琉璃虽然传统，但一点也不‘老掉牙’。至今仍然有人传承、坚守着，并不断创新。”他说。　　一路直播的台湾青年黄恺嘉说。,http://env.people.com.cn/n1/2022/0629/c1010-32459823.html
18,人民网－人民日报海外版,台湾青年畅游黄河两岸体验齐鲁文化,1656460588000,据新华社济南电 （记者孙晓辉）20余位来自台湾的高校学生、创业青年，日前在山东省聊城市景阳冈结束了为期9天的“台青黄河游记”主题活动。“这是我第一次来到黄河入海口，感觉非常震撼，推荐台湾青年有机会来亲眼看一看，感受黄河的魅力。”台湾青年朱晏辰说。该活动负责人介绍，在山东段9天的行程中，台湾青年团队在黄河三角洲保护区、齐文化博物馆、聊斋故里、大明湖、趵突泉等文旅胜地开展采风活动，共同领略黄河流域孕育的齐鲁文化景观。台湾青年刘信愔对非物质文化遗产博山琉璃印象最为深刻。“博山琉璃虽然传统，但一点也不‘老掉牙’。至今仍然有人传承、坚守着，并不断创新。”他说。一路直播的台湾青年黄恺嘉说。,http://ent.people.com.cn/n1/2022/0629/c1012-32459611.html
19,人民网－人民日报海外版,台湾青年畅游黄河两岸体验齐鲁文化,1656452019000,　　据新华社济南电　（记者孙晓辉）20余位来自台湾的高校学生、创业青年，日前在山东省聊城市景阳冈结束了为期9天的“台青黄河游记”主题活动。　　“这是我第一次来到黄河入海口，感觉非常震撼，推荐台湾青年有机会来亲眼看一看，感受黄河的魅力。”台湾青年朱晏辰说。　　该活动负责人介绍，在山东段9天的行程中，台湾青年团队在黄河三角洲保护区、齐文化博物馆、聊斋故里、大明湖、趵突泉等文旅胜地开展采风活动，共同领略黄河流域孕育的齐鲁文化景观。　　台湾青年刘信愔对非物质文化遗产博山琉璃印象最为深刻。“博山琉璃虽然传统，但一点也不‘老掉牙’。至今仍然有人传承、坚守着，并不断创新。”他说。　　一路直播的台湾青年黄恺嘉说。,http://tw.people.com.cn/n1/2022/0629/c14657-32459553.html
20,新华网,台湾西南部海域发生5.3级地震,1656432520000,新华社台北6月28日电（记者岳夕彤、齐湘辉）据台湾气象部门消息，28日晚间9时43分台湾西南部海域发生里氏5.3级地震，震源深度40.9公里，震央位于高雄市政府南方70.8公里，最大震度屏东县3级。另据中国地震台网正式测定：6月28日21时34分在台湾屏东县海域（北纬22.18度、东经120.12度）发生4.8级地震，震源深度20公里。21时43分在台湾屏东县海域（北纬22.18度、东经120.11度）发生5.3级地震，震源深度20公里。,http://tw.people.com.cn/n1/2022/0629/c14657-32459480.html
