index,origin,title,inputime,summary,link
1,新华社,在同胞温暖中喜迎春节——大陆各地走访慰问台胞台商综述,1643331865000,在广西南宁开展的走访慰问台胞活动中，南宁师范大学的台湾少数民族教师沙部·鲁比感谢台办和学校的关心与帮助，并表示要继续教书育人回馈社会，做好连接两岸的“螺丝钉”。  　　图为广西南宁市台办走访慰问南宁师范大学台湾教师。以“翰墨书香浓 乡音满庭春”为主题的两岸山东乡亲迎春送福活动中，山东济南与台湾台北、基隆的乡亲欢聚“云端”，叙乡情、话发展。在湖南长沙举行的台湾大学生迎新年活动中，同学们热烈分享在当地学习生活心得。湖南中医药大学的刘姓同学说，自己已在长沙生活6年，很适应这里的生活，希望将来能留在长沙工作。  　　台胞们表示，在大陆体会到了来自同胞的温暖，会将这份感动传递给在台湾的亲人朋友。,http://tw.people.com.cn/n1/2022/0128/c14657-32342154.html
2,人民日报客户端,国防部：美日在台湾问题上陷得越深 将来会痛得越烈,1643330245000,必须指出，台湾是中国的一部分。台湾问题纯属中国内政，不容任何外来干涉。造成当前台海紧张局势的根源，是民进党当局和“台独”分裂势力勾连外部势力不断进行谋“独”挑衅。美日试图介入台湾问题，是一个危险的动向。在这个问题上，美日陷得越深，将来会痛得越烈。在捍卫国家主权和领土完整上，中国人民解放军的决心意志坚如磐石，能力手段不断增强，绝不只是说说而已。,http://usa.people.com.cn/n1/2022/0128/c241376-32342031.html
3,中国新闻网,福建大力推动闽台农业融合发展,1643329976000,进入腊月以来，位于福建省西南部的漳平台湾农民创业园，台农、福建龙岩御山晨露农业观光休闲旅游有限公司董事长陈濂丰正忙着给茶园里的观赏樱上肥催花，以迎接春节长假的络绎人群。2018年，受大陆频频出台的惠及台胞农林措施鼓励，来自台湾南投制茶世家的陈濂丰下定决心，将茶园规模从300亩猛增到1000亩。四年过去，茶园已有数十倍余的增量产出。连续四年，漳平台湾农民创业园在全国国家级台农创业园评比中居于首位。专家认为，此地形成产业特色鲜明、台农集聚发展、辐射效应凸显的良好态势，成为闽台农业合作交流双赢的示范样板。福建自2006年率先创建台湾农民创业园，除漳平永福外，还有漳州漳浦、莆田仙游、三明清流、福州福清、泉州惠安等共6个国家级台湾农民创业园。这6个台创园综合评价连续4年包揽全国前六名。,http://fj.people.com.cn/n2/2022/0128/c181466-35116374.html
4,人民网-人民日报海外版,“番鸭市集”选年货,1643329613000,　　近日，来自大陆和台湾的青年创业者在江苏省南京市江宁区共同打造“番鸭市集”，带来各种充满“创业味”的特色年货，吸引当地市民前来选购。图为台湾青年展示文创产品。  　　中新社记者 泱 波摄,http://jx.people.com.cn/n2/2022/0128/c186330-35116337.html
5,解放军报,1949，牛年春节,1643329309000,从此，他所考虑的已不是上海的战局能撑多久，而是担心“中央银行”的存金能不能顺利运到台湾了。又过几天，得报存金已大部运抵厦门和台湾，蒋介石如释重负。多年以后，国民党“党产”报告公开提到，迁台时，蒋介石把“中央银行”227万两黄金、合计约10亿美元，以及故宫博物院众多国宝运抵了台湾。  　　,http://dangshi.people.com.cn/n1/2022/0128/c436975-32341969.html
6,人民网－人民日报,王毅应约同美国国务卿布林肯通电话,1643328726000,当务之急，美方应当停止干扰北京冬奥会，停止在台湾问题上玩火打牌，停止打造各种反华遏华“小圈子”。  布林肯表示两国外长经常性沟通非常重要，强调拜登总统在两国元首会晤中阐述的立场没有变化。,http://cpc.people.com.cn/n1/2022/0128/c64094-32341882.html
7,人民网－人民日报,共同走和平、安全、进步之路（国际论坛）,1643328718000,尼加拉瓜政府承认，世界上只有一个中国，台湾是中国领土不可分割的一部分，中华人民共和国政府是代表全中国的唯一合法政府——这也是国际社会公认的事实。  世界正在经历深刻而复杂的变化。,http://cpc.people.com.cn/n1/2022/0128/c64387-32341878.html
8,人民网－人民日报,共同走和平、安全、进步之路（国际论坛）,1643320688000,尼加拉瓜政府承认，世界上只有一个中国，台湾是中国领土不可分割的一部分，中华人民共和国政府是代表全中国的唯一合法政府——这也是国际社会公认的事实。　　世界正在经历深刻而复杂的变化。,http://world.people.com.cn/n1/2022/0128/c1002-32341769.html
9,人民网－人民日报,王毅应约同美国国务卿布林肯通电话,1643320688000,当务之急，美方应当停止干扰北京冬奥会，停止在台湾问题上玩火打牌，停止打造各种反华遏华“小圈子”。　　布林肯表示两国外长经常性沟通非常重要，强调拜登总统在两国元首会晤中阐述的立场没有变化。,http://world.people.com.cn/n1/2022/0128/c1002-32341767.html
10,新华网,全国青联开展联谊活动与港澳台青年共迎新春,1643287745000,在福建南靖，由福建省青联组织的“土楼故里过大年”活动吸引了40余名台湾青年参加，他们在土楼中体验舞龙舞狮、制作木板年画等新春民俗项目。  　　,http://hm.people.com.cn/n1/2022/0127/c42272-32341736.html
11,新华网,王毅应约同美国国务卿布林肯通电话,1643267660000,当务之急，美方应当停止干扰北京冬奥会，停止在台湾问题上玩火打牌，停止打造各种反华遏华“小圈子”。  　　布林肯表示两国外长经常性沟通非常重要，强调拜登总统在两国元首会晤中阐述的立场没有变化。,http://usa.people.com.cn/n1/2022/0127/c241376-32341496.html
12,人民日报客户端,“过境”美国？国台办：挺台谋“独”只会玩火自焚,1643267272000,　　国台办发言人朱凤莲26日应询表示，台湾是中国不可分割的一部分，我们坚决反对我建交国与民进党当局开展官方往来。任何借“过境”或会见、偶遇等方式进行的美台接触都改变不了台湾是中国一部分的事实。无论怎样撒谎，无论编织什么样的称谓，台湾都不是一个国家。祖国统一进程不可阻挡，台湾的未来除了与大陆实现统一，没有其他选项。民进党当局上台以来，钳制言论，欺骗民众，打压异已，操弄民粹，制造族群对立，分化台湾社会，煽动两岸对立，把民主当私器，假“民主”之名，行“绿色恐怖”之实，有何资格谈“民主自由”？,http://usa.people.com.cn/n1/2022/0127/c241376-32341490.html
13,新华网,王毅应约同美国国务卿布林肯通电话,1643264222000,当务之急，美方应当停止干扰北京冬奥会，停止在台湾问题上玩火打牌，停止打造各种反华遏华“小圈子”。  　　布林肯表示两国外长经常性沟通非常重要，强调拜登总统在两国元首会晤中阐述的立场没有变化。,http://world.people.com.cn/n1/2022/0127/c1002-32341439.html
14,新华网,王毅应约同美国国务卿布林肯通电话,1643261771000,当务之急，美方应当停止干扰北京冬奥会，停止在台湾问题上玩火打牌，停止打造各种反华遏华“小圈子”。  　　布林肯表示两国外长经常性沟通非常重要，强调拜登总统在两国元首会晤中阐述的立场没有变化。,http://world.people.com.cn/n1/2022/0127/c1002-32341411.html
15,人民网-重庆频道,"""面子""""里子""兼顾 渝北龙溪走好新的""赶考路""",1643258426000,积极拓展“直播荐货”“网红带货”等线上生活新模式，配合开展电商节、“青年网农”直播带货技能大赛、台湾美食展等活动，持续升温消费市场。  　　,http://cq.people.com.cn/n2/2022/0127/c365411-35115455.html
16,人民网-福建频道,包饺子、写春联 福州台胞围炉过小年,1643249995000,福建福州华优汇创闽台家园台湾青年就业创业基地一早就来了数十名台青，为围炉守岁日做准备。    留榕台胞包饺子过小年。今年是李宛芯第一次没有回台湾过年，选择留在福州和闽台家园大家庭的伙伴团聚，“疫情之下大家都做得很艰难，希望‘雨后天晴’，大家在新的一年能够找出自己的新路数，在福州发展得更好。”她也向台湾的亲朋好友送去了祝福，“很想念在台湾的父母、女儿，希望他们健康平安，一切顺心如意。”    台胞在许愿墙前拍照留念。人民网 林盈摄  据悉，华优汇创闽台家园台湾青年就业创业基地以“台引台帮扶台青在闽创业就业”为服务宗旨，以文创、文体、康养及艺术培训为主体，协助台青创业项目在福州市职工三创中心落地发展，成立至今已有超二十家台企入驻,http://fj.people.com.cn/n2/2022/0127/c181466-35115186.html
17,中国青年报,北京冬奥会对俄罗斯来说是“双喜临门”,1643247753000,记者会上，杰尼索夫还就中俄合作、俄外交政策、地区热点问题等回答了记者提问，详细介绍了中俄在经贸、能源、疫苗、航天等多领域的合作进展，并在台湾、南海等涉及中国核心利益的问题上代表俄方对中方表达支持。,http://sc.people.com.cn/n2/2022/0127/c345460-35115065.html
18,中国青年报,美日互动频繁 遏制中国意图越来越明显,1643247691000,双方还特别谈到了中国南海、台湾、新疆和香港等问题。岸田文雄“特别关心”中国发展核武器能力，拜登则重申《美日安保条约》，保证美国将“坚定不移地全力保护日本”。日本前首相安倍晋三不久前曾妄言，“台湾有事即日本有事，也就是日美同盟有事”。2021年12月，自民党在“预算编制大纲”中要求增加军费支出，提高“防卫能力”，理由是钓鱼岛和台湾地区的安保需求。,http://sc.people.com.cn/n2/2022/0127/c345460-35115055.html
19,人民日报客户端,四问张桂梅创办的华坪女子高中“红色教育”,1643246603000,同学们与时俱进唱起“2035去台湾”，还跳鬼步舞，除了接受“红色教育”，还要背《弟子规》等接受传统教育。在女高有个奇特的现象：学生们争着和张桂梅住一个宿舍，有什么心里话也愿意告诉校长。,http://yn.people.com.cn/n2/2022/0127/c378439-35114962.html
20,新华网,国台办：福建与金门通电工程福建一侧已开工建设,1643243098000,朱凤莲表示，福建与台湾地缘相近、人缘相亲，多年来形成经贸合作不断扩大、产业合作持续深化、社会交往渐趋频密、乡情亲情日益增进的良好态势。,http://fj.people.com.cn/n2/2022/0127/c181466-35114602.html
