title,date,summary,link,content
看很遠！他堅持台灣半導體業要走出代工困境  不能只做me too的產品,2022-06-13,二○二一年十二月初，李國鼎紀念論壇邀請產業界領袖，包括台積電、聯發科、日月光及旺宏董事長吳敏求齊聚一堂，為台灣產業未來發展方向與面臨的挑戰，提出寶貴建言。 創造價值 從重研發開始Q&amp;A時，提...,https://udn.com/news/story/7240/6375648, 二○二一年十二月初，李國鼎紀念論壇邀請產業界領袖，包括台積電、聯發科、日月光及旺宏董事長吳敏求齊聚一堂，為台灣產業未來發展方向與面臨的挑戰，提出寶貴建言。 創造價值 從重研發開始Q&A時，提到系統整合量子電腦，吳敏求舉手直言道：「要做系統整合滿好的，但是我們要注意一件事，不能再很便宜賣給人家了，我們要有自己的價值存在。」向來敢做敢言的他指出，如果一個公司沒有自己的價值，做系統整合就是幫人家做苦工，而台灣現在就是在幫人家做工，因為沒有know-how，講白一點，系統整合都是英特爾或AMD〈超微半導體〉做出來的，台灣只是代工而已，其他都是人家弄好的。 這番諍言一出，全場鼓掌。 投資研發就不怕中國威脅 吳敏求感慨，台灣的問題在於經濟發展過程裡，最大的苦處就是早期家庭及工廠幫忙做外銷時，都是做便宜的代工，造成台灣長期低薪，因為老闆習慣賺低毛利，所以給員工的薪資也很便宜。他認為現在台灣的重點應該放在，創造自己的know-how，才有價值。 由於台灣科技業經過三十多年的代工，在過去這十年確實累積技術到一定程度，也做出競爭力，但這個方式是否正確，他表示存疑，在他看來，台灣還是在做me too 的工作。 盧志遠也分析，科技業代工有兩種，一種是拿了人家技術，我就幫你做，也就是你技術給我，我還要付一些錢給你，我拿去賣一顆的錢，要提撥一定的比例給技術授權的公司。台灣多數科技公司都是這樣，每一家背後都有一個主子，跟他買技術，照著做就對了，但這不叫做自有，因為如果對方倒了，台灣的公司也會跟著倒。當年台灣所有做DRAM的公司今天為什麼會變得這麼慘，就是因為他們的母公司倒了。做半導體如果長久代工就會受制於人，因為你長不大，沒有自己的品牌，賣技術給你的公司把你看做海外工廠而已。 在堅持自有技術與自有產品上，一直走在一條孤單道路上的吳敏求直言，台灣最大的問題是，大家都不想花時間做長時間研發，太短線操作，產品都不是自己開發，而是別人做好的，經過加工再拿到外面便宜賣，毛利雖低，但是大量生產還是可以做大。更何況，做自己產品的缺點在於，因為市場有限，營業額要變大不容易，而做代工的好處是，不必負擔產品在市場上的競爭力與輸贏，只要根據對方的要求生產就好，也省了一半資源與金錢。 影響所及，從媒體到投資人，大家都習慣這樣的經營模式，看到旺宏動輒投入別人數倍的研發經費，反而認為不正常，質疑為什麼要投入這麼多的研發經費？但事實上，國外在研發經費上，也是每年提撥營業額的一○％以上。 「一個遠見，通常要二十年到三十年才會顯現出來。」這是吳敏求的感慨。每一種事業都有它的成功模式，沒有好或不好，但是從他的角度來看，台灣如果只會代工，總有一天會遭遇到困境。 吳敏求認為首先遭遇的很可能就是來自中國大陸的威脅。因為中國大陸的技術不會永遠落後台灣，不會停在那裡，雖然台灣現在會的，中國大陸還不會，但是他直指核心，台灣做的很多還是me too的產品，而非走在前面的領先者，一旦中國大陸技術起來，很快就會趕上。所以他才在論壇上，呼籲大家要想得遠一點。他甚至硬氣地說，我寧可整個公司關門，也不會只為了賺一點錢走近路，雖然眼前賺到了，卻無法走長。 提供別人不能提供的價值 吳敏求從創業一開始就要求跟客戶平起平坐，在美國工作十幾年的他，認為公司彼此之間應該基於平等條件談合作，拒絕吃悶虧。只不過，旺宏剛創業時，想要堅持平起平坐很困難，因為與客戶談判時，對方會說，每家公司都接受同樣的合約條款，為什麼你們不接受？吳敏求會說，因為我跟別人不一樣。 《吳敏求傳﹕從零到卓越的識與謀》。圖/天下文化提供這個堅持的背後，在於一定要提供別人所不能提供的價值，才有談判空間。如果只做me too的產品，自然毫無談判優勢。這就是他一直強調研發的重要，因為所有東西都有相對存在的條件，只有靠自己的技術研發出特殊價值，才有能力堅持平等談判。 吳敏求語重心長地說：「做為經營者一定要學會一件事，那就是自己的價值要能賣得出去，如果自己的價值賣不出去，就對不起員工。」包括打國際官司，到目前為止，旺宏是台灣唯一在國際上打贏專利官司的科技公司。 (本文摘錄自《吳敏求傳﹕從零到卓越的識與謀 》，天下文化出版，未經同意禁止轉載。)
黃齊元／地緣政治加速企業雙平台,2022-06-13,全球地緣政治衝突，從俄烏戰爭到中美對峙，正掀起新一波企業改組與布局遷徒。最近滙豐銀行大股東平安保險，提議分拆亞洲業務單獨上市，但遭拒絶。滙豐原總部位於香港，一九九三年遷到倫敦。滙豐亞洲業務貢獻總盈利...,https://udn.com/news/story/121739/6383208,全球地緣政治衝突，從俄烏戰爭到中美對峙，正掀起新一波企業改組與布局遷徒。最近滙豐銀行大股東平安保險，提議分拆亞洲業務單獨上市，但遭拒絶。滙豐原總部位於香港，一九九三年遷到倫敦。滙豐亞洲業務貢獻總盈利百分之六十五，但很多跟歐美跨國客戶有關，這正是全球化吊詭之處，很難切割。由於俄烏戰爭，麥當勞最近宣布撤出已經營卅二年的俄國市場，其在當地有八百家門市，占全球營收百分之九。另外法國雷諾汽車也宣布出售俄羅斯資產，俄國是其全球第二大市場。近期中國大陸上海封城，對經濟造成重大影響，供應鏈斷鏈，部分多國籍企業決定解封後撤離中國大陸，還有不少企業正規劃將供應鏈遷往東南亞。這是外商繼「港版國安法」撤離香港後，另一波大規模遷徒潮。企業並非只有逃離共產主義國家。最近香港富豪李嘉誠大舉出售其英國資產，拜訪越南胡志明市，計劃以八百億美元投資房地產及基礎建設等項目，「脫歐返亞」，震驚全球。二○一三年起，李嘉誠逐漸出售其在中港投資，轉進英國，但脫歐導致英國邊緣化，俄烏戰爭重創歐洲經濟，促使李氏重新布局。在半導體領域，英特爾在美歐宣布多個投資計畫，申請政府巨額補助。台積電創辦人張忠謀近期受訪時表示，他對未來地緣政治發展感到悲觀，認為台積電可以為「所有人」服務的舊日美好時光，將一去不復返。他表示是被美國政府強力要求去美國設廠的，但美國生產成本太高，沒有競爭力。綜觀全球局勢，共有四大「脫鉤」現象，改寫我們熟知的世界。第一是貿易脫鉤。由於俄烏戰爭，俄國遭到制裁，但全球仍需仰賴俄國能源，導致石油和天然氣價格狂漲。烏克蘭是歐洲糧倉，最近全球糧食嚴重短缺，惡化通膨危機。第二是投資脫鉤。外資撤離俄國及中國大陸，對後者影響較輕，因可依賴「內循環」。但近期大陸祭出振興經濟措施，可見封城所造成衝撃非常巨大。第三是金融脫鉤。美國監管機構對中概股展開調查，許多列入黑名單，自美國下市，改轉香港或Ａ股上市。中國政府正積極推動人民幣結算系統，此外香港資金大量移向新加坡，後者成為亞洲新財富管理中心。第四是科技脫鉤。最近加拿大加入對華為制裁行列，至此「五眼聯盟」大獲全勝，聯手對抗中國大陸。但大陸在綠能、電動車、ＡＩ等領域仍有優勢，台企很難脫離。台商沒有選擇，必須走出去。最近外媒報導，全球大企業紛紛提出購買「台灣保險」需求，因為台灣被視為高風險地區，特別在俄烏戰爭後。台企必須積極打造海外平台，未來才有彈性，可行方案包括分拆業務海外上市，其次是併購海外公司或合資，最沒有效率的是自行搭建海外平台。「印太經濟架構」（IPEF）簽署，台灣被排除在外，說明地緣政治現實。最近工總新任理事長苗豐強表示，在「五缺」情況下，不需把什麼東西都放在台灣，應以虛擬總部架構，將台灣打造為「區域性運籌中心」。IPEF代表美國「全球化二點○」論述，台灣提出新的全球化思維，此其時矣！
【專家之眼】香會期間美中針對台相持不下的癥結與緩解,2022-06-13,因疫情睽違兩年之後，香格里拉對話6月10-12日在新加坡登場。美中兩國防長針對台灣議題相持不下，但都同意強化「護欄」，不讓美中兩軍的競爭變成衝突。由英國智庫「國際戰略研究所」（IISS)每年在新加坡...,https://udn.com/news/story/6809/6383537,因疫情睽違兩年之後，香格里拉對話6月10-12日在新加坡登場。美中兩國防長針對台灣議題相持不下，但都同意強化「護欄」，不讓美中兩軍的競爭變成衝突。由英國智庫「國際戰略研究所」（IISS)每年在新加坡舉辦的亞洲安全會議，因為會議都在香格里拉大飯店舉行，也被稱為「香格里拉對話」(Shangri-La Dialogue)。表面上，該會議是由英國與新加坡出面主辦，但實則是由美國幕後主導，邀請亞洲、印太與歐洲的國防官員、智庫學者與軍事專家參加，針對亞洲安全情勢交換意見。在10日傍晚與美國國防部長奧斯汀的雙邊會談中，中國國防部長魏鳳和針對台灣與南海議題的發言，立場十分強硬。因此，奧斯汀在會中也高調回應，可謂沒有交集，各自表達自己的立場而已。魏鳳和表示，「以台制華」絕不可能得逞。這句話警告意味甚濃，當然主要是說給美日兩國聽的。美國總統拜登上台以來，經常打「台灣牌」刺激中國，大陸認為這是「切香腸式地鼓勵台獨」。日本首相岸田文雄在這次香格里拉對話亞洲安全會議發表演說，除了呼應美國提出的「印太戰略」之外，也表示將至少在本區投資20億美元，強化印太地區的海上安全與培訓海上安保人員。在拜登5月訪問日本期間，岸田除了與拜登發表支持台灣的聯合聲明之外，並強調東亞不容許任何侵略發生，力挺台灣溢於言表。奧斯汀則要求中國停止機艦擾台，破壞台海穩定。此外，在11日對大會的演說中，他並嚴詞抨擊中國侵略性愈來愈強，破壞台海和平。魏鳳和在中美防長會議特別強調，「台灣是中國歷史上不可分割的領土」，任何人將台灣分裂出去，中國將「不惜一戰」。這句話的主要對象無疑是美國。美國國務院官網5月5日移除「台灣是中國的一部分」與「美國不支持台獨」等文字。雖然「不支持台獨」的文字在5月28日又放回到國務院的官網，但「台灣是中國的一部分」卻一直未放回官網。針對魏鳳和的戰爭威脅，奧斯汀也高調強調，美國的「一中政策」不變，並說美國反對單方面改變現狀。在11日對香格里拉對話「亞洲安全會議」的演說中，奧斯汀表示美國不支持台獨，但華府「決心」維護台灣現狀。他並說，中國的侵略性日益升高，但美國會盡全力處理以避免兩岸衝突。在12日最後一天的會議上，魏鳳和在演說中特別舉美國南北戰爭為例，指出台灣一旦宣布獨立，中國一定打到底。在南海議題上，魏鳳和表示，南海地區相關與周邊國家有能力自行解決問題，境外國家無需在南海地區說三道四，不僅劍指美國的意味甚濃，而且要將美國趕出南海。奧斯汀則強硬回應，指出美國將致力於維護美國自身與盟國的自由航行與飛航權利。儘管中美兩國在台灣、南海等議題針鋒相對，但都有意強化兩軍的「護欄」，以避免情勢失控，讓競爭變成衝突。美中兩國的高度競爭不可避免地會讓雙方的陸海空三軍在國際舞台上增加接觸甚至競逐。如此一來，兩軍擦搶走火甚至衝突的機率也會大為增加。美國五角大廈早在2020年就成立「中國研究中心」，與北京的對口單位交換意見或處理危機管控。此外，兩軍並設有熱線，讓雙方在危機發生時進行溝通。從這次美中防長會議到兩位防長在香格里拉會議上的演說，可以看出雙方針鋒相對與相持不下的癥結就是北京堅持「一中原則」，而華府奉行「一中政策」。雖然二者都高舉「一個中國」，但內涵卻南轅北轍。北京主張的「一中原則」不排除武力統一的選項，而華府支持的「一中政策」則堅持兩岸必須以和平方式解決他們之間的歧見，反對片面改變現狀。儘管如此，在這次中美防長會議舉行時，魏鳳和與奧斯汀都同意增加熱線，以對可能的危機進行更有效的管控。從美中競爭的態勢來看，鞏固兩軍現有的「護欄」，並增加熱線，以更有效地管控分岐，減少擦槍走火的機會，恐怕也是雙方既要高度競爭又要避免衝突的唯一辦法。
法人估台股Q3區間震盪 看好四大產業,2022-06-13,"中國大陸封城政策解除後，台股觸底反彈，但因美國5月通膨數據不如預期，美股上周五重挫，拖累台股今（13）日回跌，重挫389.14點，收在16,070.98點，月線失守；統一投信認為，下半年在國內外解封...",https://udn.com/news/story/7251/6384777,
俄總統府副首長：「中國台灣」問題不能討價還價,2022-06-13,主責俄羅斯內政與烏克蘭被占領區事務的俄羅斯總統府第一副首長基里延科今天表示，中國領導人習近平提出的「中國台灣」（Chinese Taiwan）問題，不是可以拿來討價還價的議題。基里延科（Sergey...,https://udn.com/news/story/6809/6383496,
台灣石斑魚遭禁  綠委批中國養套殺以農圍政,2022-06-13,中國以檢出禁用藥物為由，13日起暫停台灣石斑魚輸入。民進黨立法院黨團幹事長鄭運鵬今天說，中國長期以來用「養套殺」的方式，對台灣農漁民設陷阱，完全是政治動作、以農圍政。鄭運鵬也指出，農委會將努力把中國...,https://udn.com/news/story/122886/6384211,
國際周報／親美、九二共識反映朱立倫困境 解放軍遭爆進駐柬埔寨,2022-06-13,國民黨主席朱立倫率團訪美展開為期12天行程，6日拜會美國國務院與亞太助卿康達（Daniel Kritenbrink）、美國在台協會（AIT）前處長梅建華會面，並與前處長莫健視訊；7日與白宮國安會中國...,https://udn.com/news/story/6809/6380395,
