title,date,summary,link,content
楊志良／兩岸根本一中，政治體制則非,2022-06-23,「抗中保台」是蔡政權的根基，更是民進黨的提票機。在今日台灣，如果有人說自己是中國人，難免遭人側目，甚至被嗆聲，可見民進黨認知作戰的成功，深入民心。而在野的國民黨，近年來領導無方，論述無力，已快淪為第...,https://udn.com/news/story/7340/6408203,楊志良「抗中保台」是蔡政權的根基，更是民進黨的提票機。在今日台灣，如果有人說自己是中國人，難免遭人側目，甚至被嗆聲，可見民進黨認知作戰的成功，深入民心。而在野的國民黨，近年來領導無方，論述無力，已快淪為第三大黨。今天在台灣的居民，除少數的原住民外，連ＤＮＡ都不必驗，即可確定絕大多數是漢人，或者至少祖先是來自中國。但是十分有趣的，有些台灣朋友自以為是日本人，可是不會講日文；自以為是美國人，可是看不懂英文；不承認自己是中國人，卻說得一口流利的中文，雖然各自口音常有所不同。想當日本人，日本人不承認；想當美國人，美國人認為他們瘋了；不想當中國人，但至今多數中國人把你當同胞。他們拜中國的神，他們說中國的語言，他們過中國的節日，他們用中國的文字，他們的祖先全部來自中國。自從鄭成功驅趕荷蘭人據台後，大量漢人移入，不論政治體制如何，上述的中國元素一直未曾改變，可是在綠色執政的「教化」下，台灣民眾，特別是年輕人，不再認為自己是中國人。這是多麼神奇的邏輯，真是令人嘆為觀止，讓人懷疑他們是否精神錯亂了。大約一周以前，面對近廿位記者，我請問他們，台灣是越來越團結，還是越來越分裂？唯一答案是越分裂；再問他們，１４５０是讓台灣越來越團結，還是越來越分裂？唯一答案是越分裂；最後問，台灣分裂，是越來越有實力？還是越來越弱化，越來越有利於老共統一台灣？這樣的執政黨該不該下台？記者都不說話了。再問大家喜歡統一嗎？幾乎全部都搖頭。簡單的一句話，血缘、語言、宗教、經濟（哪位民進黨大老，包括蔡英文、賴清德、蘇貞昌，敢大言取消ＥＣＦＡ？）根本上都是一中，但是兩岸政治體制完全不同，絕大多數台灣同胞都堅決要維持自己的政治體制，這一項絕對無法一中。今天的執政黨與在野黨，就是沒膽識，或者不願意，大聲的、公開的敍明這一點，只能繼續用「抗中保台」綁架全民。蔡英文跟她任主席的民進黨，為維持其政權，一方面篡奪原民進黨民主、自由、愛台灣的創黨精神，成為濫權、貪汙、腐敗，無法無天，將行政、立法、司法、監察玩弄於股掌之間的邪惡政黨；另一方面以錢及權掌握媒體及名嘴，從事認知作戰，洗腦全民，使得具有理想的創黨元老，一一憤而離開。由於台灣在民進黨腐敗的統治下，相對大陸及周邊國家，不斷弱化，因此無法對抗逐漸強大的政治中國，只得淪為美國圍堵中國興起的棋子，唯命是從，以民眾的血汗錢，去購買美國超高價的二流武器。有這麽多「好康」，老美會支持國民黨重返執政才怪。朱主席訪美，是熱臉貼冷屁股，自爽而已。另方面，民進黨不斷去中國化，包括歷史、文學、社會、倫理，更操弄網軍，激起兩岸人民，特別是年輕人之間的仇恨，導致大陸年輕的人多主張武統台灣，抗中保台反成為亡國滅台。國人及各在野黨，對此必須深刻認知，否則無以自救、救國。（作者為退休教授、前衛生署長）
國際援藏大會華府召開 達賴喇嘛重申：不尋求西藏獨立,2022-06-23,第八屆「世界國會議員西藏大會」近日在美國華府召開，對此達賴喇嘛透過視訊致詞重申，不尋求西藏獨立，但強調一定要重視西藏文化及語言的維護，而西藏流亡政府與美國官員會晤後提到目的是恢復「藏中和談」。根據達...,https://udn.com/news/story/7331/6408751,
五大績優個股 防禦買盤卡位,2022-06-23,台股跌跌不休，行情再轉弱勢，引動市場恐慌氛圍急遽上升。值此震盪時刻，法人建議，投資人應轉進防禦型個股，包括台積電（2330）、廣達、台達電、南電及亞德客-KY等五大績優股，攻守兼備。經過周二報復性反...,https://udn.com/news/story/7251/6407983,
紐時：台灣石斑遭禁 凸顯經濟過度依賴中國風險,2022-06-23,中國近期以檢出禁藥為由暫停進口台灣石斑魚。紐約時報報導，中國運用經濟手段對台施壓，台灣養殖戶準備蒙受重大損失，此事提醒台灣經濟過度依賴中國的風險。這篇發自屏東縣枋寮鄉的報導寫道，林春來著眼中國對水產...,https://udn.com/news/story/122886/6408637,
全球面臨經濟衰退 台綜院下修今年經濟成長率3.80%,2022-06-23,台灣綜合研究院今天發布2022年下半年台灣經濟展望。在俄烏戰事持續，加上中國大陸封控停工加劇供應鏈中斷，全球經濟面臨嚴重經濟衰退危機，且台灣本土疫情進入高原期，在俄烏戰爭導致的輸入性通膨壓力帶動國內...,https://udn.com/news/story/7239/6409793,
奈伊：俄烏拉鋸 降低陸侵台機率,2022-06-23,曾任美國國防部助理部長的哈佛大學榮譽教授奈伊（Joseph Nye）指出，台灣局勢可能是當前亞洲最類似烏克蘭的情況，但他認為，因俄烏戰爭長期化，反而降低未來幾年中國大陸入侵台灣的可能性。奈伊近日在「...,https://udn.com/news/story/7331/6408303,
談台灣家樂福併購案 徐旭東：價格只是個數字,2022-06-24,遠百（2903）被視為統一集團之外，競爭台灣家樂福的最強對手，徐旭東在今（24）日遠百股東會後被問及此事，他指出，以自己經手的併購案來說，這標的不複雜，價格更「只是個數字」，現在要釐清「統一的優先承...,https://udn.com/news/story/7238/6412288,
學者：美P-8A穿越台灣海峽 反制中共系統擴張,2022-06-24,中共機艦近期頻繁侵擾台灣與日本，美軍一架P-8A巡邏機今天穿越台灣海峽。國防部表示，對台海周邊外籍機、艦動態，均能全程掌握；學者認為，美軍此舉是應對中共宣稱台灣海峽不是國際水域說法，反制中共系統性擴...,https://udn.com/news/story/10930/6413773,中共機艦近期頻繁侵擾台灣與日本，美軍一架P-8A巡邏機今天穿越台灣海峽。國防部表示，對台海周邊外籍機、艦動態，均能全程掌握；學者認為，美軍此舉是應對中共宣稱台灣海峽不是國際水域說法，反制中共系統性擴張。美國有線電視新聞網（CNN）引述美軍印太司令部發布的聲明指出，一架美國海軍P-8A海神式巡邏機今天飛越台灣海峽，展現美國對「自由開放印太地區的承諾」；另據「火腿族」無線電玩家監聽音檔顯示，共軍應對美軍機時稱台灣海峽為「領空」。對此，國防部晚間告訴中央社記者，有關台海周邊外籍機、艦動態，國軍運用聯合情監偵手段，均能全程掌握，並適切應處。國防安全研究院國防戰略與資源所長蘇紫雲向中央社記者表示，美軍是執行自由航行的宣告，同時應對中共宣稱台灣海峽不是國際水域的說法。蘇紫雲指出，日本為了方便其他船隻通過輕津海峽而自主退縮領海，但中俄軍艦近日不僅穿越津輕海峽侵擾日本，更「貼近」日本領海邊緣航行，加上中國在南海、台海等作為，綜觀看來，中共是「系統性的擴張」。國防院學者舒孝煌認為，美機「穿越」台灣海峽是較少見狀況，但近期中國與俄羅斯軍艦聯手侵擾日本，美機此舉反制意味濃厚。國防院國家安全所長沈明室分析，中共的廣播是虛張聲勢，因為完全不合乎聯合國海洋法及國際法等規定，「就算台灣是中國的」，也不能說台灣海峽是中國的內海或領海，此舉是蠻橫的態度。沈明室指出，日前外界提及美機的出現，是為了偵蒐剛下水的中共航空母艦福建艦，但福建艦尚未部署，且利用其他工具也能掌握行蹤；他推測美機近期舉措是例行巡邏，抑或美方透過衛星發現不明目標，派遣軍機偵蒐確認。尖端雜誌主任編輯李思平表示，中國一直認為台灣是中國的一部分，當然認為台海就是中國「內海」，且要求外國機艦通過必須要報備；但到目前為止，「中國也只是喊喊而已，並不能怎樣」。據國防部公開訊息，6月21日有29架共機擾台，數量今年第3多；另據日本防衛省統合幕僚監部公開訊息，21日還有一艘「052C」驅逐艦、一艘「056A」護衛艦通過台灣宜蘭東部、日本與那國島之間海域。
新聞眼／後阿拉伯之春 道義放兩旁，中東利字擺中間,2022-06-24,沙烏地阿拉伯實質領導人、王儲穆罕默德訪問土耳其，顯示哈紹吉案造成的雙方芥蒂已隨時間淡化，重拾經貿合作，共同發揮區域影響力才是王道。俄烏戰爭下的油價及糧食價格居高不下，土耳其五月通膨年增率高達百分之七...,https://udn.com/news/story/6809/6411261,
疫情衝擊下 台商應加快進行中國大陸企業傳承,2022-06-24,中國大陸封城期間深化兩岸地理上的分隔情況，許多在大陸有重要布局的台商，因隔離政策多在觀望離開台的時間。而這段時間若發生突發狀況，臨時要傳承大陸資產就很麻煩。資誠聯合會計師徐丞毅表示，中國大陸的台商因...,https://udn.com/news/story/7238/6412967,
總經理翁宗斌：仁寶今年挑戰更嚴峻 未來發展以AI為中心,2022-06-24,筆電代工廠仁寶今天召開股東常會，總經理翁宗斌表示，今年受到俄烏戰爭、中國封城、通膨影響，挑戰比過去2年更嚴峻；本業的PC及智慧裝置將繼續用數位化、自動化提高經營效率和獲利，未來發展以AI為中心。翁宗...,https://udn.com/news/story/7240/6411796,
政策鬆綁 大陸A股領先全球走揚,2022-06-24,中國大陸股市經過自4月底到5月上旬打底階段，近兩個月來表現，已經領先全球股市反彈，上證A股指數近2個月上漲5.84%，近三個月也有8.19%報酬，明顯走出自己的路，可望持續於美中貿易關稅政策與互聯網...,https://udn.com/news/story/12806/6411652,中國大陸股市經過自4月底到5月上旬打底階段，近兩個月來表現，已經領先全球股市反彈，上證A股指數近2個月上漲5.84%，近三個月也有8.19%報酬，明顯走出自己的路，可望持續於美中貿易關稅政策與互聯網政策等等鬆綁下，消費持續復甦回到正常行情。揮別本輪新冠疫情帶來的衝擊，大陸5月宏觀經濟數據初現好轉，預計復產復工帶來的正向循環，逐步反饋在第3季經濟活動當中；與此同時，大陸有別於其他歐美國家，所採取的貨幣政策、財政政策皆不同，大陸政府持續採取刺激方案，對於陸股來說，有相當助益。富蘭克林華美中國A股研究團隊認為，陸股將分三階段，以「慢牛態勢」向上走升。大陸國家主席習近平已表示對於互聯網的監管將回歸常態化，大陸網路金融巨頭螞蟻集團整頓改革也進入尾聲；網路遊戲審查部分，截至目前為止，6月份共60款遊戲獲得審查通過版號，加上電商與物流平台皆在上海疫情爆發期間的貢獻獲得當局相當的肯定，618電商更是盛大舉辦，上述種種跡象都顯示，北京當局正持續放鬆對互聯網公司的監管，預期沉潛已久、股價已大幅修正的騰訊、美團、京東等網路公司巨頭長線投資價值浮現。富蘭克林華美大陸A股基金經理人沈宏達表示，陸股所謂的三階段，分別是繼2021年第四季政策落底、2022年第二季市場打底，在疫情擾動過後的市場情緒修復期，2022年第三季有機會成為經濟打底的階段，從六月上海解封復工復產開始，大陸A股行情也可望露出曙光，有望迎接下一波行情。目前大陸經濟雖在休養生息階段，但情況不會維持太久；未來股市行情結構，沈宏達認為，看好大消費、醫療保健以及受惠於雙碳政策的新能源車、太陽能等，此外，隨著北京當局政策對互聯網的監管放鬆，故也長期看好估值大幅修正的互聯網公司，也將分批布局。富蘭克林華美投信表示，時序來到7、8月除了期待美中貿易關稅有望解除外，更是上市公司公布半年報時間點，投資人可審視在這疫情影響下，企業基本面是否良好。而沈宏達認為，具備領導地位的龍頭企業，才有足夠的現金流抵禦短期的逆風且能快速重振旗鼓；將逐步集中在金融、食品與醫藥類股龍頭企業的配置，靜待財報公布期的短線波動後，迎接下一波行情的到來。綜上所述，隨著北上資金連續三個月湧入A股，也觀察到外資多數都佈局產業龍頭，一如A股研究團隊的策略思考；因此，富蘭克林華美投信建議，投資人不妨趁股市第二季末第三季初開始之際，分批單筆進場，或以定期(不)定額方式投資，以掌握大陸A股下一波行情之機會。
千金股撐盤 台股反彈露曙光,2022-06-24,台股昨（23）日再度破底，但盤面上漲家數約占57%，除統一、裕隆、台塑等集團股表態走強，衝刺季底作帳績效外，矽力-KY、信驊、大立光、旭準等四檔千金股亦同步收紅，透露短線行情急跌後，反彈曙光乍現。通...,https://udn.com/news/story/7251/6411325,
經濟日報社論／提前防範ECFA可能變化,2022-06-24,2010年6月29日兩岸於重慶簽署海峽兩岸經濟合作架構協議（ECFA），迄今已滿12年；若非最近中國大陸禁止屬於ECFA項目的石斑魚進口，相信很多人已經忘了它的存在。ECFA既為架構協議，是採取逐步...,https://udn.com/news/story/7338/6411308,
民調：若大陸武力進犯 51%台灣人認為台軍撐不過百日,2022-06-24,俄烏戰爭爆發4個月後，台灣民意基金會近日發表民調顯示，超過一半的台灣民眾不相信，假如中國大陸武力進犯，台灣有能力抵禦100天以上。1. 中國若武力犯台，台軍撐得過100天嗎？問卷的提問是，「俄烏戰爭...,https://udn.com/news/story/10930/6413541,俄烏戰爭爆發4個月後，台灣民意基金會近日發表民調顯示，超過一半的台灣民眾不相信，假如中國大陸武力進犯，台灣有能力抵禦100天以上。俄烏戰爭爆發4個月後，台灣民意基金會近日發表民調顯示，超過一半的台灣民眾不相信，假如中國大陸武力進犯，台灣有能力抵禦100天以上。1. 中國若武力犯台，台軍撐得過100天嗎？問卷的提問是，「俄烏戰爭爆發到今天已持續了超過100天，烏克蘭還在辛苦作戰中。如果中共（中國）武力犯台，您相信台灣也像烏克蘭一樣撐100天以上嗎？」問卷的提問是，「俄烏戰爭爆發到今天已持續了超過100天，烏克蘭還在辛苦作戰中。如果中共（中國）武力犯台，您相信台灣也像烏克蘭一樣撐100天以上嗎？」結果顯示：17.2%的人非常相信，20.6%的人還算相信，28.6%的人不太相信，22.4%的人一點不相信，11.2%的人不知道或拒絕回答。結果顯示：17.2%的人非常相信，20.6%的人還算相信，28.6%的人不太相信，22.4%的人一點不相信，11.2%的人不知道或拒絕回答。以上數據表明，不相信台灣能夠抵御大陸進犯百天以上的人超過一半（51%），相信的人只佔37.8%。不相信者比相信者高13個百分點。以上數據表明，不相信台灣能夠抵御大陸進犯百天以上的人超過一半（51%），相信的人只佔37.8%。不相信者比相信者高13個百分點。這項調查報告的作者寫道，簡單地說，過半數台灣人傾向認為台灣不如烏克蘭，沒辦法支撐那麼久，只有較少數的台灣人相信台灣可以和烏克蘭一樣撐那麼久。作者認為，這項發現意義重大。這項調查報告的作者寫道，簡單地說，過半數台灣人傾向認為台灣不如烏克蘭，沒辦法支撐那麼久，只有較少數的台灣人相信台灣可以和烏克蘭一樣撐那麼久。作者認為，這項發現意義重大。從受教育程度看，教育程度越高，越傾向不相信能堅持100天以上；從地區看，包括台南市和高雄市，不相信的比例都呈現多數。從受教育程度看，教育程度越高，越傾向不相信能堅持100天以上；從地區看，包括台南市和高雄市，不相信的比例都呈現多數。2.是否相信美國協防的承諾？美國總統拜登5月23日在東京回答記者提問時明確說，「一旦中國對台動武，美國將會軍事介入以協防台灣。這是美國的承諾」。美國總統拜登5月23日在東京回答記者提問時明確說，「一旦中國對台動武，美國將會軍事介入以協防台灣。這是美國的承諾」。台灣民意基金會就此提問：請問您相不相信他這項承諾？台灣民意基金會就此提問：請問您相不相信他這項承諾？結果顯示：10.5%的人非常相信，29.9%的人還算相信，28.8%的人不太相信，22.1%的人一點也不相信，8.7%沒意見。結果顯示：10.5%的人非常相信，29.9%的人還算相信，28.8%的人不太相信，22.1%的人一點也不相信，8.7%沒意見。調查表明，儘管有美國總統明確且堅定的表示，但相信他的人仍然相對是少數，更多人傾向不相信。報告作者寫道，同今年3月對同一問題的詢問調查相比，對美國協防台灣的信心增加了4.1個百分點，存疑比例則下降了2.9%。調查表明，儘管有美國總統明確且堅定的表示，但相信他的人仍然相對是少數，更多人傾向不相信。報告作者寫道，同今年3月對同一問題的詢問調查相比，對美國協防台灣的信心增加了4.1個百分點，存疑比例則下降了2.9%。3.為避戰，不尋求正式獨立？NO！今年5月24日，台灣外交部長吳釗燮對美國媒體表示，台灣「為避免戰爭，將維持現狀，不尋求正式獨立。」今年5月24日，台灣外交部長吳釗燮對美國媒體表示，台灣「為避免戰爭，將維持現狀，不尋求正式獨立。」調查提問：您贊不贊成「因怕中共打台灣，放棄追求台灣獨立」？調查提問：您贊不贊成「因怕中共打台灣，放棄追求台灣獨立」？結果顯示：8.1%的人非常贊成，23.3%的人還算贊成，29.7%的人不太贊成，18%的人一點也不贊成，14.9%的人沒意見，6%不知道。結果顯示：8.1%的人非常贊成，23.3%的人還算贊成，29.7%的人不太贊成，18%的人一點也不贊成，14.9%的人沒意見，6%不知道。該結果表明，只有三成略強一點的人因害怕大陸攻打台灣而放棄追求獨立，但四成八的人不贊成這一態度。報告作者寫道，調查反映的重要訊息是，大多數台灣人不贊成蔡英文政府的「為避戰，不尋求正式獨立」的立場。從分析數據的分類來看，不論年齡層、族群、教育程度、政黨還是地區層面，都顯示出大多數「不贊同」政府立場的現象。該結果表明，只有三成略強一點的人因害怕大陸攻打台灣而放棄追求獨立，但四成八的人不贊成這一態度。報告作者寫道，調查反映的重要訊息是，大多數台灣人不贊成蔡英文政府的「為避戰，不尋求正式獨立」的立場。從分析數據的分類來看，不論年齡層、族群、教育程度、政黨還是地區層面，都顯示出大多數「不贊同」政府立場的現象。台灣民意基金會創立於2016年2月，它對自己的定義是一個非營利、非政府、超黨派的智庫型公益組織。基金會宗旨主要在關懷、研究與傳達台灣民意。台灣民意基金會創立於2016年2月，它對自己的定義是一個非營利、非政府、超黨派的智庫型公益組織。基金會宗旨主要在關懷、研究與傳達台灣民意。© 2022年德國之聲版權聲明：本文所有內容受到著作權法保護，如無德國之聲特別授權，不得擅自使用。任何不當行為都將導致追償，並受到刑事追究。© 2022年德國之聲版權聲明：本文所有內容受到著作權法保護，如無德國之聲特別授權，不得擅自使用。任何不當行為都將導致追償，並受到刑事追究。【 本文章由德國之聲授權提供】
主持金磚峰會 習近平：金磚國家要勇於擔當,2022-06-24,大陸國家主席習近平昨晚在北京以視訊方式主持金磚國家峰會。他批評國際制裁被濫用，呼籲金磚國家承擔起它們在世界上的責任。習近平還指出，金磚國家作為重要的新興市場國家和發展中大國，要勇於擔當、勇於作為，為...,https://udn.com/news/story/7331/6411280,
美眾院軍委會通過國防授權法 支持美台防衛關係,2022-06-24,美國聯邦眾議院軍事委員會廿三日凌晨審查完竣二○二三財年國防授權法，將送眾院表決；根據該委員會事前公布的內容，國會強調對美台防衛關係的支持，要求印太司令部說明應對與戰略競爭對手發生超過半年衝突時的必要...,https://udn.com/news/story/6813/6411260,
抗衡美國 習近平呼籲金磚國家敞開大門、擴大成員,2022-06-24,金磚國家領導人第14次會晤23日晚間以視頻方式舉行。大陸國家主席習近平於會中再度呼籲金磚國家敞開大門、引入新血，提升金磚國家的代表性和影響力。他強調，金磚國家不是封閉的俱樂部，也不是排外的「小圈子」...,https://udn.com/news/story/7331/6411784,
3架中共轟6機飛經沖繩 日本戰機緊急升空因應,2022-06-24,日本防衛省統合幕僚監部昨天晚間發布中共軍機動態表示，昨天下午有3架中共轟6機飛經沖繩本島與宮古島之間的海域，在太平洋上迴旋後折返。日本戰鬥機緊急升空因應、監控。日本防衛省統合幕僚監部（相當於國防部參...,https://udn.com/news/story/6809/6411656,
未掌握轉型契機 前輩分析石斑魚產業失去優勢的原因,2022-06-24,台灣曾經以石斑王國自居，但曾幾何時外銷卻遭他國禁運，需要政府花4億元號召全民吃食班，產業界認為，台灣石斑產業未能掌握轉型契機，導致目前的產業危機。石斑魚繁殖業先驅、印尼台商會長蘇文炳表示，他在金融海...,https://udn.com/news/story/122886/6412640,
