title,date,summary,link,content
北約決擴增快速反應部隊,2022-06-28,（德國之聲中文網）在俄羅斯侵烏戰爭背景下，北約決定成倍擴增其快速反應部隊，從目前的約4萬人增至30萬人以上。北約馬德裡峰會前夕，秘書長斯托爾滕貝格周一（6月27日）宣布，將為此目的重組快速反應部隊。...,https://udn.com/news/story/6809/6419695,（德國之聲中文網）在俄羅斯侵烏戰爭背景下，北約決定成倍擴增其快速反應部隊，從目前的約4萬人增至30萬人以上。北約馬德裡峰會前夕，秘書長斯托爾滕貝格周一（6月27日）宣布，將為此目的重組快速反應部隊。鑑於與俄羅斯關係緊張，數月來，該部隊已處於高度戒備狀態。  （德國之聲中文網）在俄羅斯侵烏戰爭背景下，北約決定成倍擴增其快速反應部隊，從目前的約4萬人增至30萬人以上。北約馬德裡峰會前夕，秘書長斯托爾滕貝格周一（6月27日）宣布，將為此目的重組快速反應部隊。鑑於與俄羅斯關係緊張，數月來，該部隊已處於高度戒備狀態。  重組計劃屬於整個聯盟地區新部隊模式的一部分，意味著將有更多部隊進入高度戒備狀態。此外，部隊將調遣至特定地區。據此，德國部隊將可被確切納入計劃，在俄羅斯入侵時向立陶宛軍隊提供支持。  重組計劃屬於整個聯盟地區新部隊模式的一部分，意味著將有更多部隊進入高度戒備狀態。此外，部隊將調遣至特定地區。據此，德國部隊將可被確切納入計劃，在俄羅斯入侵時向立陶宛軍隊提供支持。  聯盟目前有30個成員國。斯托爾滕貝格稱，保護東翼是聯盟的首要任務。他說，他預期，周二開幕的北約峰會將明確這一點：聯盟將俄羅斯視為「最重要和最直接的威脅」。他表示，因此，北約東翼成員國的現有多國戰鬥群應擴至旅級。目前，在立陶宛的戰鬥群規模為1600人。旅級規模部隊通常由3000至5000名士兵組成。  聯盟目前有30個成員國。斯托爾滕貝格稱，保護東翼是聯盟的首要任務。他說，他預期，周二開幕的北約峰會將明確這一點：聯盟將俄羅斯視為「最重要和最直接的威脅」。他表示，因此，北約東翼成員國的現有多國戰鬥群應擴至旅級。目前，在立陶宛的戰鬥群規模為1600人。旅級規模部隊通常由3000至5000名士兵組成。  德國已宣布願意指揮立陶宛作戰旅。在這個與俄羅斯飛地加裡寧格勒接壤的國家，德國國防軍目前在現有北約戰鬥群中居領先地位，派駐有約1000名士兵。該戰鬥群現編入立陶宛「鐵狼」步兵旅。德國已宣布願意指揮立陶宛作戰旅。在這個與俄羅斯飛地加裡寧格勒接壤的國家，德國國防軍目前在現有北約戰鬥群中居領先地位，派駐有約1000名士兵。該戰鬥群現編入立陶宛「鐵狼」步兵旅。30萬人以上規模的這支北約未來快速反應部隊在和平時期分由各相關國家指揮，但在緊急情況下，可由北約駐歐洲部隊最高指揮官請求派遣。對該部隊還將為其部署准備預設固定時間。尚在磋商的是，某些部隊需具備在最多10天內被派遣的能力，其它部隊則能在30天或50天內被派遣。30萬人以上規模的這支北約未來快速反應部隊在和平時期分由各相關國家指揮，但在緊急情況下，可由北約駐歐洲部隊最高指揮官請求派遣。對該部隊還將為其部署准備預設固定時間。尚在磋商的是，某些部隊需具備在最多10天內被派遣的能力，其它部隊則能在30天或50天內被派遣。緊急情況細節將在新區域防御計劃中確定。該計劃明年完成。本周二，主要工業化民主國家領導人在德國埃爾茂峰會後數小時，北約馬德裡峰會就將開幕。北約將在此次峰會上通過新戰略理念。現行理念制定於2010年。當時，聯盟尚希冀與俄羅斯的緊張關係時代已然結束，能和該國建起「真正的戰略夥伴關係」。  緊急情況細節將在新區域防御計劃中確定。該計劃明年完成。本周二，主要工業化民主國家領導人在德國埃爾茂峰會後數小時，北約馬德裡峰會就將開幕。北約將在此次峰會上通過新戰略理念。現行理念制定於2010年。當時，聯盟尚希冀與俄羅斯的緊張關係時代已然結束，能和該國建起「真正的戰略夥伴關係」。  在這一理念中，也未提中國。這一點現將改變。斯托爾滕貝格周一表示，新理念將首次提及中國、及其對北約的安全、利益和價值觀構成的挑戰。  在這一理念中，也未提中國。這一點現將改變。斯托爾滕貝格周一表示，新理念將首次提及中國、及其對北約的安全、利益和價值觀構成的挑戰。  此次峰會是否會因土耳其繼續拒絕同意與芬蘭和瑞典啟動加入北約的談判而蒙上陰影，目前仍不清楚。上月中旬，芬、瑞兩國正式申請加入北約，並希望能以被邀請入盟國家的身份出席馬德裡峰會。然而，土耳其迄今阻撓接納程序，理由是，芬蘭和瑞典支持「恐怖組織」，如遭禁的庫爾德工人黨和敘利亞庫爾德民兵。──兩國均予否認。 此次峰會是否會因土耳其繼續拒絕同意與芬蘭和瑞典啟動加入北約的談判而蒙上陰影，目前仍不清楚。上月中旬，芬、瑞兩國正式申請加入北約，並希望能以被邀請入盟國家的身份出席馬德裡峰會。然而，土耳其迄今阻撓接納程序，理由是，芬蘭和瑞典支持「恐怖組織」，如遭禁的庫爾德工人黨和敘利亞庫爾德民兵。──兩國均予否認。 （德新社） （德新社） © 2022年德國之聲版權聲明：本文所有內容受到著作權法保護，如無德國之聲特別授權，不得擅自使用。任何不當行為都將導致追償，並受到刑事追究。 © 2022年德國之聲版權聲明：本文所有內容受到著作權法保護，如無德國之聲特別授權，不得擅自使用。任何不當行為都將導致追償，並受到刑事追究。 【 本文章由德國之聲授權提供】
台美國安會談 牽動國防人事？,2022-06-28,國安會秘書長顧立雄率團赴美參加台美「蒙特瑞會談」已結束。昨有媒體報導顧立雄已取代國安會副秘書長陳文政，成為蔡英文總統最倚重的國安軍事幕僚，並可望成為文人國防部長。總統府昨表示，總統非常肯定國防部長邱...,https://udn.com/news/story/10930/6419732,國安會秘書長顧立雄率團赴美參加台美「蒙特瑞會談」已結束。昨有媒體報導顧立雄已取代國安會副秘書長陳文政，成為蔡英文總統最倚重的國安軍事幕僚，並可望成為文人國防部長。總統府昨表示，總統非常肯定國防部長邱國正的表現，沒有異動國防部長的打算。媒體報導，指美方近年對陳文政有所不滿，另傳出我駐美代表蕭美琴與陳文政曾有爭執，蕭美琴一回氣得在電話中說，「不是你走，就是我走」。據了解，往年常帶隊出席的陳文政，今年確未赴美出席，但知情人士、涉外人士皆否認陳文政與蕭美琴曾有激烈言語衝突。總統府發言人張惇涵昨表示，蕭與陳從未有過任何爭執。至於報導所稱陳文政「開罪美方」，知情人士並未聽說，惟其闡述政策堅持我方立場，確曾讓美方「印象深刻」，但陳仍受層峰信任，目前仍擔任協調國防部相關業務。另有熟悉台美軍事交流的人士說，陳文政雖與美方打交道多年，但其作風鮮明，立場強硬，較難以溝通，在美國拜登政府與蔡政府尋求就「不對稱戰力」定義達共識之際，美方可能也希望能與較易溝通的人討論。上周在美國舉行的軍事、國安會議，除了「蒙特瑞會談」，還有被視為極機密的國安高層「特殊管道會談」。涉外人士說明，「特殊管道會談」過去多由國安會副秘書長與白宮副國安顧問主談，但二○一九年時任國安會秘書長李大維與白宮國安顧問波頓（John Bolton）會晤，層級提升，近兩年都是由顧立雄率團赴美；再加上近兩年「特殊管道會談」與「蒙特瑞會談」安排接續舉行，由顧立雄領軍很正常，並沒有所謂取代誰。據指出，今年會談聚焦美國最關切的兩大議題，即台灣發展不對稱戰力，以及充實全民防衛能力；美方欲說服台灣放棄價格高的大型武器，投資可以強化台灣威懾中國大陸侵略行為，且更符合成本效益的項目，例如海軍水雷等。有關顧立雄可能接任國防部長的傳言，知情人士研判，蔡總統任期不到兩年，若等十一月選舉結束後，更只剩不及一年半，層峰除非意在為創下文人部長先例，否則由顧立雄出任部長，其本身意願應該也不會太高。
澳門新博彩法增訂國家安全條款 可撤銷美資賭場,2022-06-28,中美交惡，雙方相互反制，連澳門博彩業也不能倖免。澳門立法會日前修訂通過新博彩法，加入「國家安全」的條款，可隨時撤銷賭場經營權，防止賭場資金洗錢或流入反政府、從事勾結外國勢力活動，確保「一國兩制」在澳...,https://udn.com/news/story/7331/6420896,中美交惡，雙方相互反制，連澳門博彩業也不能倖免。澳門立法會日前修訂通過新博彩法，加入「國家安全」的條款，可隨時撤銷賭場經營權，防止賭場資金洗錢或流入反政府、從事勾結外國勢力活動，確保「一國兩制」在澳門行穩致遠等。觀察者網報導，澳門立法會6月21日通過修改「娛樂場幸運博彩經營法律制度」（新「博彩法」），並已於23日起生效，當中新加入了國家安全條款。其中第45條第1項規定，行政長官在聽取博彩委員會的意見後，可基於「危害國家或澳門特別行政區的安全」等原因解除娛樂場幸運博彩的經營批給。「新博彩法」還要求，經營娛樂場幸運博彩須不受犯罪影響，並應確保其經營及操作配合澳門特別行政區打擊跨境非法資金流動，以及預防清洗黑錢和恐怖主義的政策及機制。報導引述澳門大學政治經濟學與公共政策教授盛力表示，過去澳門部分外資博企或其間接關係人，可能涉及推動內地資本外流，他們與海外政治勢力的關係也比較複雜，甚至有參與本地敏感事務的嫌疑。盛力解讀，這個法案必須有威懾力，不能光說要在維護國家安全的前提下去經營，還要在判斷在危害到國家安全後，可以立即終止合約。他說，「新博彩法」表現出國家對澳門的關注，保障一國兩制在澳門行穩致遠，實際上也是涉及到國家安全的一個條款。澳門立法會議員陳澤武此前表示，法案賦予特首有權就國家安全撤銷賭牌，估計將會按國安法的框架去審視，如資金來源、從事勾結外國勢力活動等。事實上，澳門特區政府宣佈修法之初，在澳門擁有業務的美國賭場公司股票一度受到重挫。目前澳門的六家持牌博彩企業中，有美資博企「兩個半」之說。除了永利澳門和金沙中國兩個純美資外，美高梅中國則是美國博彩業巨頭美高梅與賭王之女何超瓊成立的合資公司。報導稱，「國家安全」不單只是涉及中美博奕的問題，也要和總體國家安全觀聯繫起來。「新華澳報」曾刊文指出，將國家安全有關條文列入「新博彩法」，是一把懸掛在未來獲得新賭牌博企、尤其是美資博企頭上的「達摩克利斯之劍」，相信會對美資博企起具有較大的震懾作用。
習近平將親赴港 港警反恐隊換新裝,2022-06-28,中國大陸國家主席習近平出席香港七一活動，赴港之說成主流。港府消息說仍待北京通知，但已對習預定到訪地方實施高度保安，港警三支反恐隊也換了新裝，因習近平要搭乘高鐵到港，港警鐵路應變隊更首度亮相。香港七一...,https://udn.com/news/story/7331/6419724,中國大陸國家主席習近平出席香港七一活動，赴港之說成主流。港府消息說仍待北京通知，但已對習預定到訪地方實施高度保安，港警三支反恐隊也換了新裝，因習近平要搭乘高鐵到港，港警鐵路應變隊更首度亮相。香港七一上午將舉行「慶祝香港回歸廿五周年大會暨第六屆政府就職禮」，晚上將舉辦文藝晚會。目前傳說習近平要赴港，上午出席大會和演講，下午參觀香港西九文化區、香港科學園。香港建制派人士連日放風，指習近平將在七月一日發表重要演說，重點講述香港的一國兩制，並對香港未來發展作出指示。港區全國人大代表田北辰說，習會提出有關香港未來廿五年可發揮的優勢。他期望，習近平可提及香港繼續鞏固金融及貿易中心、與外國接軌的定位。目前有說習近平七月一日晨搭高鐵到港，也有說他六月卅日即先來，現任特首林鄭月娥訂於六月卅日在香港禮賓府設晚宴招待習近平，屆時現屆及候任主要官員都會出席；然後習近平當晚回深圳，七月一日再來。港區人大代表葉國謙說，疫情下很多活動已經取消，即使習近平到港，行程不會像五年前一樣，預料只會短時間逗留。將出席慶祝大會暨第六屆政府就職典禮的港府現屆及候任主要官員，提早於廿七日入住酒店，作好防疫隔離。香港警方也作出高規格保安部署，暫定維持至七月二日止。除在活動場地香港會展附近布防，昨起加強維多利亞港水域巡邏。傳說習近平要去參觀的西九文化區戲曲中心，附近港鐵站出口已封閉，附近亦有軍裝警員駐守。香港警方也提前以換服裝為由，亮相香港警察的三支「反恐戰術部隊」，包括機場特警組、反恐特勤隊及鐵路應變部隊，他們七月一日將著新裝上街，執行反恐鎮暴任務。
王岐山再代表習近平 出席菲律賓新總統就職儀式,2022-06-28,中國國家副主席王岐山將擔任國家主席習近平特別代表，率團赴菲律賓出席30日在馬尼拉舉行的新任總統小馬可仕（Ferdinand Marcos Jr.）就職儀式。根據中國外交部官網，發言人趙立堅今天作上述...,https://udn.com/news/story/7331/6421533,中國國家副主席王岐山將擔任國家主席習近平特別代表，率團赴菲律賓出席30日在馬尼拉舉行的新任總統小馬可仕（Ferdinand Marcos Jr.）就職儀式。根據中國外交部官網，發言人趙立堅今天作上述宣布。王岐山5月10日也曾以習近平特別代表的身分，赴首爾出席韓國新任總統尹錫悅就職儀式，當時是2020年初疫情發生以來，中國正國級國家領導人首次走出國門。習近平已2年多沒有離開中國。中國與菲律賓之間仍有關於南海主權的爭議。小馬可仕5月下旬受訪時曾說，在南海議題上，新政府不會允許任何「平方毫米」的菲律賓沿海海域權利被踐踏。現任菲律賓總統杜特蒂（Rodrigo Duterte）日前指示，馬尼拉已全面終止與北京的南海油氣開發合作協商。
俄烏戰爭長期化 全球需為外溢效應做準備,2022-06-28,雖然G7峰會昨天傳出烏克蘭總統澤倫斯基敦促大國領袖們「在年底前」讓俄羅斯停止侵略，但多數專家都已提出要為俄烏戰爭的長期化做好準備，包括因應國際戰略格局和經濟資源等的外溢效應。澤倫斯基（Volodym...,https://udn.com/news/story/122663/6421501,雖然G7峰會昨天傳出烏克蘭總統澤倫斯基敦促大國領袖們「在年底前」讓俄羅斯停止侵略，但多數專家都已提出要為俄烏戰爭的長期化做好準備，包括因應國際戰略格局和經濟資源等的外溢效應。澤倫斯基（Volodymyr Zelenskyy）透過視訊向七大工業國集團（G7）領袖說，他尚未準備好與俄國展開協商。烏克蘭的立場加上俄軍在G7峰會期間轟炸基輔和烏克蘭中部的平民設施，在在顯示短期內看不到和談契機；而除非蒲亭（Vladimir Putin）政權意外垮台，也看不到俄國主動喊停的可能。歐盟部長理事會的安全顧問、未來學家高布（Florence Gaub）日前在美國政治新聞網站Politico的Podcast訪問中指出，統計過去200年的戰爭史，國與國的戰爭平均持續15個月，當然也有例外如兩伊戰爭打了8年等。俄烏戰爭展示了從民間網路動員到國際經濟封鎖等非傳統軍武的面向，華府智庫戰略暨國際研究中心（CSIS）榮譽主席柯迪斯曼（Anthony H. Cordesman）認為：「想要讓衝突能夠以一種帶來持續和平的方式終結，正變得日益困難。」他的意思是即便停火，經濟和民間的衝擊仍會持續，因為俄國和歐洲的政治緊張不止，更別說俄烏人民間的仇恨將延續至少一個世代。柯迪斯曼在CSIS撰文指出幾個俄烏戰爭帶來的「外溢效應」：一、在俄國和北約、歐盟、美國間的緊張關係下，軍備競賽將達5年或更久，使軍費占GDP（國內生產毛額）的比重拉高好幾個百分點，對經濟帶來衝擊；二、中國將全力發展從政治到經濟上可以抵抗美國封鎖的能力；三、北韓、巴基斯坦、伊朗、土耳其以及其他在區域內有軍事力量的第三世界小國，都將捲入東西兩陣營的對抗中，包括貿易投資、軍事基地和防衛協助等。經濟合作暨發展組織（OECD）6月的一份報告也分析這場戰爭帶來的中長期影響，包括改變全球能源市場結構、外匯存底配置結構，以及供應鏈重組等。報告指出，世界重新分割成互設壁壘的陣營後，專業（生產）分工、規模經濟、資訊和技術的分享、單一主導貨幣…這些過去帶來經濟效率的好處都將縮減。OECD已在6月將全球今年經濟成長的預估值從原本的4.5%下修到3%，明年更預估只有2.8%。因此，俄烏戰爭的拖長，包括持續一段長期的打打停停，或者即便達成停火協議但緊繃態勢長期持續下，不只歐美，全球許多國家都得因應資源的重新配置，例如國防預算上升的排擠效應、製造業供應鏈乃至市場布局的劃清界線、外交上拉幫結派的重新洗牌等。美國前外交官哈斯（Richard Haass）6月上旬在「外交事務」（Foreign Affairs）撰文說，（俄烏戰爭）不論勝利或妥協在可預見的未來都被排除之下，美國和歐洲當局需要一個能夠管理「開放式衝突」的策略。他強調：是「管理」而非「解決」，因為真要解決得由俄國從根本改變行為，這在目前難以期待。管理一場可能拖長的危機，而非等待衝突被解決，對於全球受到這場戰爭外溢效應波及的政府乃至企業決策者而言，也是最務實的因應之道。
張憲清搭橋 溫州台企更上層樓,2022-06-28,「溫州人不會被事情追著跑，而是追著事業向上走。」從初遇溫州時的人生地不熟，到如今的侃侃而談溫州思維，2004年至今，台商張憲清已在溫從商18年。中新社報導，回顧這18年，從沒沒無聞到颳起「便當颱風」...,https://udn.com/news/story/7333/6419762,「溫州人不會被事情追著跑，而是追著事業向上走。」從初遇溫州時的人生地不熟，到如今的侃侃而談溫州思維，2004年至今，台商張憲清已在溫從商18年。中新社報導，回顧這18年，從沒沒無聞到颳起「便當颱風」，張憲清是「東池便當」的引「陸」人—東池控股有限公司董事長；從溫州與台灣經貿合作到兩岸融合發展，張憲清是百餘在溫台商創業的熱心人—溫州市台灣同胞投資企業協會（溫州台協）現任會長。除了經營便當生意，張憲清以溫州台協為載體，接引台商「軟著陸」；帶頭創辦甌江口（現浙江溫州海洋經濟發展示範區）溫州台商科技產業園；投身溫州鄉村振興建設……回看創業之初，張憲清表示，從一盒便當開始，萬事開頭難。不過，一場颱風為東池便當吹來了轉機，張憲清說，當時颱風登陸，外面颳風下雨，大家都緊閉窗門、避免外出。這時候大家才知道，有個叫東池便當的小店居然風雨無阻，送餐上門。於是，當天東池便當賣出500餘份外賣，小小的便當從此風起溫州。如今，當初那股便當颱風已遍及中國大陸100餘個城市，而加盟店擴展至600餘家的同時，東池控股有限公司的年銷售也超過了10億元人民幣。然而2013年，由於溫州城市發展建設規畫需要，「退二進三」、「騰籠換鳥」的產業改革對溫州商業形勢提出了新要求，張憲清表示，當時很多台企在溫州從事第二產業，一時間很難轉型第三產業，因此工業用地時刻面臨著被遷退的危險，這樣一來台商們也就很難留下來了。2015年，溫州市獲批海峽兩岸民營經濟創新發展示範區。也正因這張「金名片」，溫州搭建起了引台資、招台智的平台，給張憲清「挽留」台商提供了出路。在溫州市政府和溫州市台辦等相關部門協調下，以溫州台協為紐帶，2020年溫州台商科技產業園在甌江口正式開工建設。園區規畫用地面積5.8萬餘平方公尺，第一批將入駐12家台企，其中涉及光學智能製造、汽車核心、電子部件、自控閥門、智慧變頻器、高端日用品等復合業態，成為兩岸（溫州）民營經濟創新發展示範區的標竿項目。
習近平訪港前夕 香港懸掛一號風暴訊號,2022-06-29,在中國國家主席習近平訪港前夕，香港因為風暴來襲，天文台今晚懸掛一號風暴戒備訊號；天文台預測，風暴不會轉強，明天會吹向廣東西部。香港天文台表示，來襲的熱帶低氣壓會在今晚至明早與香港保持超過500公里，...,https://udn.com/news/story/7331/6424950,在中國國家主席習近平訪港前夕，香港因為風暴來襲，天文台今晚懸掛一號風暴戒備訊號；天文台預測，風暴不會轉強，明天會吹向廣東西部。香港天文台表示，來襲的熱帶低氣壓會在今晚至明早與香港保持超過500公里，預料風力不會顯著增強，一號戒備訊號會在明天中午之前維持。天文台預測，風暴將會逐漸靠近大陸廣東西部沿岸，香港明天會受其外圍雨帶影響，有狂風雷暴。據報導，習近平預定明天來港，晚上出席行政長官林鄭月娥所設晚宴。後天出席慶祝香港回歸25週年大會暨新一屆香港特區政府就職典禮。
