relsub,relsum,rel,index,title,date,summary,link
0,0,0,1135,陸鬆綁國際航線 與英恢復雙向直航,2022-08-12,英國駐北京大使館微博十日公告，英國交通部與中國大陸民航局已正式達成共識，恢復英中之間雙向直航客運服務。中國大陸政府在新冠疫情期間實行的直航禁令將告結束，但初期客運服務將由大陸的航空公司提供。旅客仍可...,https://udn.com/news/story/7331/6531112
0,0,0,1136,BA.5.2入侵 小商品之都義烏突封城3天,2022-08-12,大陸新一波疫情襲來，多地因爆發疫情封城。有「全球最大小商品集散地」之稱的浙江義烏，宣布全市自十一日起實行三天臨時性全域靜默管理；西藏日喀則市十一日宣布持續實施全域靜默管理。受義烏疫情外溢波及的浙江紹...,https://udn.com/news/story/122650/6531113
0,1,1,1137,夏立言率團訪陸 藍諸侯跳腳,2022-08-12,國民黨副主席夏立言率團訪陸，連藍營也跳腳。夏立言是台中市府聘任的無給職國際事務委員，台中市長盧秀燕昨說，夏立言是優秀外交官，但正值中國大陸演習威脅台灣之時，這時率團出訪「時機不宜，徒增困擾」。新北市...,https://udn.com/news/story/122993/6531136
0,0,0,1138,薩德部署喬不攏 中韓再現分歧,2022-08-12,中國大陸和南韓十一日就美軍在南韓部署薩德反飛彈系統問題上發生爭執，推翻大陸外交部前一天宣稱雙方達成「審慎管控」的共識說。南韓政府宣稱，薩德系統事關國家安全，不容妥協。南韓外長朴振本周訪問北京，看似順...,https://udn.com/news/story/6809/6531019
0,0,0,1139,經濟部砸2億 台灣農產前進13國促銷,2022-08-12,中國大陸接連暫停我農漁產品進口。經濟部說，將提撥二億元經費推出「台灣食品全球ＧＯ」計畫，預定自本月起至十二月，密集於東南亞、東北亞、歐洲與北美等十三國舉辦大型促銷活動及購物中心快閃活動等，擴大推廣我...,https://udn.com/news/story/7266/6531033
0,0,0,1140,和碩Q2 單季每股純益1.17元,2022-08-12,代工大廠和碩今年第2季受到中國大陸封控衝擊，營收規模下降，業外還認列匯兌損失6.31億元，稅後純益年減四成，單季每股純益（EPS）1.17元，創近四年同期新低。和碩昨（11）日公布第2季財報，營收2...,https://udn.com/news/story/7253/6531159
1,1,1,1141,鎖台軍演掀漣漪 裴洛西：不放任北京對台建新常態,2022-08-12,解放軍剛結束圍台軍演，並指未來還會常態組織台海方向戰備警巡。美國眾院議長裴洛西十日在國會舉行訪台後首場記者會，她表示，「中國嘗試（對台灣）建立類似新常態，我們不會任其發生」。裴洛西說，中方以她的訪問...,https://udn.com/news/story/122972/6531241
1,1,1,1142,台海緊張 拜登擱置調降陸關稅,2022-08-12,路透十日獨家報導，中國大陸在台灣附近的軍事行動，已使美國重新思考調整大陸商品關稅問題，美國總統拜登尚未做出決定。知情人士表示，「台灣已經改變了所有事」。為了是否要調降川普政府時期對大陸商品加徵的關稅...,https://udn.com/news/story/122972/6531012
1,1,1,1143,台海掀戰全球經濟有多傷？專家：比俄烏戰嚴重10倍,2022-08-12,美國眾議院議長裴洛西訪台，大陸對台祭出報復，除了禁止一百多家食品公司產品、白帶魚、竹筴魚和柑橘類水果進口，連天然砂也禁止；共軍還在台灣周邊進行圍台演習，展現具有「封鎖台灣」的能力。高盛日前發布報告指...,https://udn.com/news/story/7331/6531288
0,0,0,1144,【作家身影】王愷／瘂弦的行板,2022-08-12,斑鳩在遠方唱著，夢從樺樹上跌下來大屯蒼蒼，淡海泱泱，我們在復興崗上，舞盡雞鳴，弦歌夜未央……夕陽下，晚風帶來了一支唱著歌的草綠色隊伍，從野外走進了大屯山下復興崗的校門，領隊帶頭的那個年輕人，是政工幹...,https://udn.com/news/story/7272/6527637
0,0,0,1145,美國駐日大使痛批中國背叛信賴 讚安倍留下最棒遺產,2022-08-12,日本雜誌「文藝春秋」最新一期刊登專訪美國駐日大使易曼紐長文。他痛批中國背叛了信賴，這20年來，在根據國際規則的體系中受惠最多但也是侵犯國際規則最多的國家就是中國。62歲的易曼紐（Rahm Emanu...,https://udn.com/news/story/6809/6531262
0,0,0,1146,M31報喜 年營收拚增25％,2022-08-12,矽智財（IP）廠商M31（6643）昨（11）日舉行法說會，總經理張原熏釋出好消息，上修全年業績成長幅度，從原本估計成長15%至20%，提升為20%至25%。法人預期，下半年是M31的旺季，全年業績...,https://udn.com/news/story/7254/6530693
0,0,0,1147,豐泰上半年EPS 5.28元 賺贏去年全年,2022-08-12,製鞋大廠豐泰（9910）昨（11）日公布上半年合併財報，稅後純益46.5億元、年增39.3%，每股純益5.28元，續創歷史同期新高，半年就賺贏去年全年。豐泰第2季合併營收247.63億元，季增10....,https://udn.com/news/story/7252/6530715
0,1,1,1148,華爾街日報：索馬利蘭拒絕背棄台灣 中國惱怒,2022-08-12,在中國的利益誘惑攻勢下，少有非洲國家敢對北京說不，索馬利蘭共和國是其中的例外，讓中國當局怒不可遏。索馬利蘭國會8日發表聲明，指責中國因美國眾議院議長裴洛西訪台而在台灣四周舉行的軍演「可能破壞區域和平...,https://udn.com/news/story/6809/6531257
0,0,0,1149,正德 獲利暴增3.6倍,2022-08-12,散裝船航商正德（2641）昨（11）日公告第2季財報稅後純益2.13億元，年增191.2%，每股純益1.13元；推升上半年稅後純益達4.67億元、年增3.66倍創新高，每股純益2.47元。正德受惠於...,https://udn.com/news/story/7254/6530718
0,0,0,1150,香菇工寮氣爆 1人80%燒燙傷,2022-08-12,南投縣一處香菇工寮昨天疑因高壓殺菌鍋爐操作不慎發生氣爆，四名員工被燙傷送醫，其中越南籍吳姓男子全身約百分之八十燒燙傷，傷勢嚴重，經送醫後轉院救治，消防局尚在釐清氣爆原因。國姓鄉大長路一處香菇工寮高壓...,https://udn.com/news/story/7320/6531157
0,0,0,1151,以色列前國安顧問專文：轉離北京的時刻到了,2022-08-12,以色列前國家安全委員會主席奈格爾昨天與「保衛民主國家基金會」執行長杜博維茨在當地媒體共同發表評論稱，以色列應與美國同一陣線、疏離中國、重新評估與台灣的關係。耶路撒冷郵報（The Jerusalem ...,https://udn.com/news/story/6809/6531168
0,0,0,1152,四技二專分發 57校未招滿,2022-08-12,一一一學年度四技二專日間部聯合登記分發最近放榜，根據技專校院招生委員會聯合會分析統計，七十一校參加登記分發，高達五十七校未招滿，缺額逾一點一萬個。學者昨呼籲，公立學校招生名額不要再外加，教育部應協助...,https://udn.com/news/story/6929/6531125
0,0,0,1153,王愷／瘂弦的行板,2022-08-12,斑鳩在遠方唱著，夢從樺樹上跌下來大屯蒼蒼，淡海泱泱，我們在復興崗上，舞盡雞鳴，弦歌夜未央……夕陽下，晚風帶來了一支唱著歌的草綠色隊伍，從野外走進了大屯山下復興崗的校門，領隊帶頭的那個年輕人，是政工幹...,https://reading.udn.com/read/story/7048/6527637
0,0,0,1154,克里米亞俄空軍基地爆炸 頓內茨克爆發激戰,2022-08-11,俄羅斯矢志拿下整個烏東工業重地頓巴斯地區，俄烏雙方11日在皮斯基鎮周圍爆發激戰。另衛星影像顯示，俄羅斯在克里米亞一座空軍基地9日發生爆炸後損毀嚴重，多架俄軍機被毀。●克里米亞俄空軍基地爆炸 衛星影像...,https://udn.com/news/story/122663/6530949
0,0,0,1155,新疆病例破千全部無症狀  烏魯木齊伊寧靜態管理,2022-08-11,中國「動態清零」防疫政策越來越艱難。新疆COVID-19疫情自7月底至今累計病例1140例，全部為無症狀感染者。目前，烏魯木齊和伊寧市都處於「靜態管理」中。央視網報導，新疆維吾爾自治區政府晚間召開疫...,https://udn.com/news/story/122650/6531064
0,0,0,1156,台股ETF 人氣匯聚,2022-08-11,美國7月CPI（消費者物價指數）數據優於市場預期，年增率從6月的9.1%高峰下滑至8.5%，剔除食物與能源價格的核心CPI年增率則持穩在5.9%，顯示美國通膨開始有觸頂跡象，美元同步轉弱。法人認為，...,https://fund.udn.com/fund/story/5860/6530824
0,0,0,1157,法人：陸股醞釀多頭行情,2022-08-11,中國大陸A股經歷強勁反彈後，近期行情在整理區間，法人指出，目前中國大陸各大指數的估值皆處在便宜位置，股權風險溢價顯示權益資產的性價比較高，市場下行的空間相對有限，整體投資情緒仍在醞釀利空出盡後的多頭...,https://fund.udn.com/fund/story/5854/6530835
0,1,1,1158,【即時短評】夏立言訪中 綠營趁機擴大台中市長選舉戰場,2022-08-11,兩岸關係緊張之際，國民黨副主席夏立言昨率團出訪中國大陸引發軒然大波，因其身兼台中市政府義務職國際事務委員，台中市長盧秀燕明確表態「時機不宜，徒增困擾」綠營進一步要求盧解聘夏立言，擴大台中戰線，盧秀燕...,https://udn.com/news/story/122682/6531081
0,0,0,1159,錢進實質資產 穩穩賺,2022-08-11,今年來全球股市表現不佳，盤點去年投信發行新基金表現，截至9日，僅兩檔基金維持正報酬，分別是凱基未來世代關鍵收息多重資產及華南永昌實質豐收組合。當中，目前淨值前十高基金以實質資產類型及多重資產型、組合...,https://fund.udn.com/fund/story/5858/6531059
1,1,1,1160,遭嗆不要挑釁中國 蔡英文：對兩岸態度一直冷靜不躁進,2022-08-11,蔡英文總統今天出席民進黨在新北市中和區舉辦的「民主前進挺18」宣講活動，但中途遭民眾闖入中斷，蔡總統今晚在臉書表示，在演講進行到一半的時候，現場有民眾舉牌子說不要挑釁中國，「我要告訴大家，我當總統以...,https://udn.com/news/story/6656/6531037
1,1,1,1161,假裝記者？統促黨3人嗆蔡英文「勿挑釁中共」,2022-08-11,蔡英文總統、民進黨新北市長參選人林佳龍，今天晚上出席新北市中和的國家台灣圖書館，宣講18歲公民權，孰料講到一半，台下3名統促黨員拉布條抗議，場面瞬間緊繃；警方將人攔下，帶回派出所詢問，依社維法送辦。...,https://udn.com/news/story/6656/6531014
0,1,1,1162,統促黨鬧場 林佳龍：台灣民主腳步須加速前進,2022-08-11,民主進步黨新北市長參選人林佳龍今天談及中華統一促進黨人士鬧場事件時說，對照「民主前進挺18」主題，深感台灣民主腳步須加速前進。民進黨主席蔡英文晚間出席新北小英之友會辦的「民主前進挺18」首場宣講活動...,https://udn.com/news/story/122682/6531000
1,1,1,1163,CNBC分析：中國制裁僅影響兩岸貿易0.04%,2022-08-11,美國眾議院議長裴洛西訪台後，中國採取報復行動，對台灣祭出一連串經濟制裁手段。美國財經媒體CNBC分析，北京對台灣的新制裁措施僅影響約0.04%的雙邊貿易。CNBC今天報導，裴洛西（Nancy Pel...,https://udn.com/news/story/6811/6530972
0,0,0,1164,繼立陶宛後 拉脫維亞宣布退出中國中東歐合作機制,2022-08-11,繼立陶宛去年5月正式宣布退出後，拉脫維亞外交部今天表示，考量當前的外交和貿易政策優先事項，決定停止參加中國與中東歐的合作機制。此機制在扣除立陶宛和拉脫維亞後，僅剩15個中東歐國家參加。目前「中國－中...,https://udn.com/news/story/6809/6530971
0,0,0,1165,台灣首尊天主教中華聖母態像 教廷授最高榮譽14日加冕,2022-08-11,前任天主教嘉義教區鍾安住總主教，向教宗方濟各申請，為梅山鄉聖母朝聖地的中華聖母木製態像加冕，去年3月2日收到教廷批准令，將會為聖母態像加上皇冠或星辰光環，是教會授予態像最高榮譽；宗座加冕儀式於14日...,https://udn.com/news/story/7326/6530958
0,0,0,1166,四技二專分發入學57校未招滿 私校招生恐弱者更弱,2022-08-11,111學年度四技二專日間部聯合登記分發8月9日開放查榜，根據技專校院招生委員會聯合會資料分析統計，今年71校參加登記分發，高達57校未招滿。學者呼籲，至少公立學校名額不要再外加，否則未來恐是強者更強...,https://udn.com/news/story/6885/6530953
1,1,1,1167,出席全國首場「民主前進挺18」 蔡英文盼跟上民主潮流,2022-08-11,蔡英文總統今日到新北中和參與全國首場「民主前進挺18」宣講會並表示，台灣是有成熟民主的地方，但卻沒有18歲公民權，台灣民主需要不斷前進，否則會讓其他民主國家遲疑是否繼續挺台灣；與會宣講人士也都呼籲，...,https://udn.com/news/story/6656/6530928
0,0,0,1168,海南累計逾4千病例 三亞疫情高位發展,2022-08-11,中國海南省這一波COVID-19疫情，從1日至今天中午12時，累計已有4139病例，目前旅遊城三亞市疫情仍處於高位發展階段，部分市縣疫情持續發展，社區防控壓力較大。新華社報導，今天的海南疫情防控新聞...,https://udn.com/news/story/122650/6530896
1,1,1,1169,中共對台白皮書關鍵字 陸學者：和平統一方針沒變,2022-08-11,中共日前發布第三部對台白皮書「台灣問題與新時代中國統一事業」，對於其所揭示的中共對台政策方向，大陸學者李鵬解讀為「和平統一基本方針沒變」。據港媒中評社報導，廈門大學台灣研究院院長李鵬指出，此次發表的...,https://udn.com/news/story/7331/6530891
0,0,0,1170,日本8男1女亂交派對…淫僧自拍「連結女高中生」 網嘲：另類修行,2022-08-11,日前，日本一位醫生因爲涉嫌參加亂交派對，並對女高中生進行猥瑣行爲而被捕。當地媒體報導，至今已經有20位以上派對參加者被控告。而且派對的參加者中竟然有教師，甚至是僧侶！根據日本《週刊文春》報導，在東京...,https://udn.com/news/story/6812/6530859
1,1,1,1171,日媒：共軍演習期間測量艦現北日本周邊海域,2022-08-11,日本產經新聞獨家報導，本月4至10日中國人民解放軍（共軍）在台灣周邊的海空域實施大規模軍事演習期間，共軍一艘測量艦航行在北日本的周邊海域。報導指出，多名政府相關人士透露，4至10日共軍在台灣周邊舉行...,https://udn.com/news/story/6809/6530813
1,1,1,1172,陸對台白皮書未談駐軍 學者：美中交惡香港經驗所致,2022-08-11,中國本次對台白皮書未再承諾軍隊不駐台。學者王信賢說，這和美中關係改變、香港經驗有關。且裴洛西訪台打亂中共對台工作方向配置和節奏，反獨和反外力干涉將成北京主軸。正值中國人民解放軍在美眾院議長裴洛西（N...,https://udn.com/news/story/7331/6530846
0,0,0,1173,清代龍銀「絕珍」 2億元創下中國錢幣拍賣最高紀錄,2022-08-11,大陸近年掀起錢幣收藏熱，精品價格節節攀升，如今一枚清代晚期銀元「奉天省造癸卯一兩」突破2億元台幣門檻，也創下中國錢幣拍賣最高紀錄。據首席收藏網報導，8月11日在北京舉行的誠軒拍賣春拍，其中PCGS認...,https://udn.com/news/story/7335/6530845
0,0,0,1174,沈榮津：台灣工具機面臨庫存高、可靠度待提升兩大挑戰,2022-08-11,行政院副院長沈榮津今（11）日參加「工具機產業規範關鍵影響力發展會」時表示，台灣工具機的品質與精度，與歐美日產品差距不大；但面臨庫存量高、產品可靠度待提升等兩大挑戰，政府會與產業界合作，共同為產業高...,https://udn.com/news/story/7238/6530822
0,0,0,1175,中國尼泊爾同意建跨喜馬拉雅山鐵路  年內踏勘,2022-08-11,中國外交部長王毅昨天在山東與到訪的尼泊爾外長卡德加舉行會談。雙方同意將構建跨喜馬拉雅互聯互通網絡。中方將年內派專家赴尼開展踏勘，對中尼跨境鐵路可行性研究。澎湃新聞報導，中國外交部發言人汪文斌今天在例...,https://udn.com/news/story/6809/6530758
0,0,0,1176,台印度學生神祕視訊 印度生根據半導體猜出台灣,2022-08-11,南投縣埔里宏仁國中與印度南部安德拉省（Andhra Pradesh）的中學生，昨天進行視訊交流，增加對彼此國家的認識。活動以「神祕視訊」方式炒熱氣氛，直到台灣學生以半導體為線索時，印度學生終於猜出交...,https://udn.com/news/story/6898/6530704
0,0,0,1177,法海軍參謀長表態「團結作戰即能戰勝中國」 專家驚：駐法使館又要不高興了,2022-08-11,法媒10日揭露，法國海軍參謀長范迪亞上將早在7月底國會國防委員會上就提出警告，中國海軍擴張是二戰後首見，並罕見公開表明，只要與盟友共同作戰，就能戰勝中國海軍。美國眾議院議長裴洛西（Nancy Pel...,https://udn.com/news/story/122972/6530757
0,0,0,1178,受記憶體價格下跌拖累 十銓上半年每股純益0.13元,2022-08-11,記憶體品牌暨模組廠十銓（4967）今日公布第2季及上半年財報，受到DRAM價格下跌影響，第2季呈現虧損，每股虧損 0.26元，並使上半年稅後純益縮至1026萬元，每股純益0.13元。十銓第2季營收為...,https://udn.com/news/story/7253/6530761
1,1,1,1179,朱立倫會美智庫學者：民進黨關上兩岸交流大門,2022-08-11,國民黨主席朱立倫稍早在臉書發文表示，在台北和華府布魯金斯研究院（The Brookings Institute）研究員何瑞恩（Ryan Hass）與主任歐漢龍（Michael O’Hanlon）見面...,https://udn.com/news/story/6656/6530741
0,0,0,1180,《原神》超車《星際公民》成史上最貴遊戲？今年底開發成本估將突破5億美元,2022-08-11,在網路發達的現代，遊戲開發週期被「雲端更新」拉長，為維護遊戲的品質與產品保鮮度，從大規模更新到小漏洞修補檔，都需要一定的成本，以及開發人員勞心勞力投入。不難想像許多 3A 大作所費不貲，但自 202...,https://tech.udn.com/tech/story/123158/6530095
0,0,0,1181,《原神》超車《星際公民》成史上最貴遊戲？今年底開發成本估將突破5億美元,2022-08-11,在網路發達的現代，遊戲開發週期被「雲端更新」拉長，為維護遊戲的品質與產品保鮮度，從大規模更新到小漏洞修補檔，都需要一定的成本，以及開發人員勞心勞力投入。不難想像許多 3A 大作所費不貲，但自 202...,https://game.udn.com/game/story/122089/6530095
1,1,1,1182,新白皮書未承諾不派軍隊駐台 港媒：陸對台「一國兩制」內涵有變,2022-08-11,中國時隔22年再度發布對台政策白皮書。香港媒體指出，新白皮書未承諾台灣「有自己的軍隊」或「大陸不派軍隊也不派行政人員駐台」，一國兩制內涵有變。美國眾議院議長裴洛西（Nancy Pelosi）2日訪台...,https://udn.com/news/story/7331/6530091
0,0,0,1183,珍貴稀土染黑緬甸 管理人：若照永續經營標準來…7成產量都該斷鏈,2022-08-11,不當稀土開發染黑河流，牛屍更漂浮其上！由於全球關鍵原料稀土不當開發，緬甸北部水域在礦石開採及浸出劑的汙染下無法飲用，歐盟針對「衝突礦產」（conflict minerals）管控的法規也選擇忽略不當...,https://udn.com/news/story/6811/6530628
0,0,0,1184,瑞鼎、奇景對Q3展望保守,2022-08-11,驅動IC廠瑞鼎（3592）與在美掛牌的奇景，今日舉行法說會，瑞鼎評估供應鏈庫存水位偏高，可能需要2至3個季度去化。奇景則認為，第3季將是其存貨高峰。瑞鼎先前已公布第2季財報，上半年每股純益為38.8...,https://udn.com/news/story/7253/6530685
0,0,0,1185,羽球／排名賽落幕 中租大同3組升甲組,2022-08-11,為期10天的第二次全國羽球排名賽今天落幕，新科甲組選手也都出爐，中租大同共有3組選手晉升甲組，國體大和亞柏各有兩組選手，其中國體大包下男單和男雙乙組冠軍，收穫頗豐。按照中華羽球協會規定，排名賽中乙組...,https://udn.com/news/story/7005/6530669
0,0,0,1186,大陸半導體反腐續發酵 兩任國企幹部同日落馬,2022-08-11,大陸半導體反腐仍在燒。據大陸中紀委官網11日消息，中國電子信息產業集團原副總經理向梓仲，以及武漢中原電子集團董事長蔣開勤，涉嫌嚴重違紀違法，目前正接受紀律審查和監察調查。據官網介紹，中國電子信息產業...,https://udn.com/news/story/7333/6530664
0,0,0,1187,美國CPI自高點放緩 法人對下半年台股轉趨樂觀,2022-08-11,美國最新CPI數據優於預期，美股大漲激勵今天台北股匯市雙漲，台股勁揚258.83點，新台幣創下近2週新高；法人表示，台股今年以來修正，已經相當程度反映對升息、需求下修的預期，下半年可抱持謹慎樂觀的態...,https://udn.com/news/story/12806/6530562
0,0,0,1188,頓內茨克附近激戰 俄堅決全面拿下烏東頓巴斯,2022-08-11,俄羅斯矢志拿下整個烏克蘭東部工業重地頓巴斯地區，俄、烏雙方今天在烏東皮斯基鎮周圍激戰。與此同時，基輔指控莫斯科拿核能電廠作為防禦烏軍砲火的盾牌。路透社報導，獲俄羅斯支持、自行成立的頓內茨克人民共和國...,https://udn.com/news/story/122663/6530527
1,1,1,1189,菲國防部：若台海情勢升級 準備好撤離在台勞工,2022-08-11,菲律賓國防部候任部長佛斯蒂諾昨天說，軍方正密切監控台海局勢，若情勢升級，已準備好撤離在台灣的菲國勞工，並準備應對可能從台灣湧入的難民。馬尼拉公報和馬尼拉標準報（Manila Standard）等媒體...,https://udn.com/news/story/6809/6530524
0,1,1,1190,聖文森總理龔薩福：將發聯合聲明 譴責中共威脅台灣,2022-08-11,聖文森及格瑞那丁總理龔薩福今天拜訪行政院長蘇貞昌。他致詞時說，聖文森正與台灣其他邦交國起草聲明，將譴責中華人民共和國不合理、不成比例及完全錯誤的行徑，「中共對台灣的威脅是不能被接受的」。蘇貞昌今天接...,https://udn.com/news/story/6656/6530577
1,1,1,1191,李立群晚轉發「一個中國」挨轟　導演王晶建議他直接表態：統一,2022-08-11,資深藝人李立群久居中國大陸，在上海封城期間常透過短視頻平台因分享日常生活而受到不少大陸網友喜歡。70歲的他退休並於7月3日返台，早前受訪時曾說出「打起仗來會死守在台灣」，遭小粉紅轟台獨，過沒幾天卻又...,https://stars.udn.com/star/story/10089/6530622
1,1,1,1192,地圖對台灣標示錯誤違反「一中原則」 重慶海關查扣,2022-08-11,隨著台海局勢、兩岸關係緊張，陸方落實「一中原則」的執法度正在提升。據「海關發布」微信公眾號11日訊息，近日，重慶海關所屬渝州海關根據風險布控指令對一批出口至歐洲的貨物實施查驗時，發現其中24套地圖存...,https://udn.com/news/story/7333/6530627
0,0,0,1193,國巨上半年EPS 22.65元 優於法人預期,2022-08-11,被動元件大廠國巨（2327）今（11）日公布今年第2季財報，單季獲利為59.27億元，季減5.1%、年減6.4%，每股純益11.05元，累計上半年EPS達22.65元，賺進兩個股本，同時也比法人預期...,https://udn.com/news/story/7253/6530625
0,0,0,1194,國巨：標準品需6個月去化庫存 整體價格未大幅調整,2022-08-11,被動元件大廠國巨今天表示，標準品庫存調整，需6個月去化時間，工控車用特殊品需求持穩，稼動率維持高檔；第3季毛利率和營益率拚維持第1季水準，產品價格未有大幅調整狀況。國巨下午受邀參加外資法人舉辦線上法...,https://udn.com/news/story/7240/6530445
0,1,1,1195,外交部：嚴正譴責有心人士曲解裴洛西挺台言論,2022-08-11,外交部今天指出，有心人士斷章取義美國眾議院議長裴洛西接受美國媒體專訪的影片，並渲染成稱讚中國，事實上她讚許對象為民主台灣。外交部嚴正譴責惡意扭曲裴洛西對台讚美，收割台灣民主果實並據為己有。外交部晚間...,https://udn.com/news/story/6656/6530559
0,0,0,1196,十銓上半年營收32.74億元 EPS 0.13 元,2022-08-11,"十銓科技（4967）今（11）日發布 2022年第2季營運報告，上半年合併營收達32.74億元，稅前淨利2,044萬元，稅後淨利1,026萬元，純益率0.39%，每股稅後盈餘（EPS）0.13元，第...",https://udn.com/news/story/7253/6530595
0,0,0,1197,台灣人壽實踐永續創新 獲國內外七大獎殊榮,2022-08-11,中國信託金控子公司台灣人壽重視永續投資與創新共融，積極實踐ESG（Environmental、Social、Governance）永續作為，再獲國內外七大獎肯定。台灣人壽領先同業落實綠色投融資，榮獲...,https://udn.com/news/story/7239/6530591
