relsub,relsum,rel,index,title,date,summary,link
1,1,1,3265,越南憂中共軍演 建議航空公司避飛台灣周邊,2022-08-04,共軍宣布4至7日在台灣周邊6海域軍演，越南官方建議越南的航空公司在今、明兩天調整飛行路線，避開台灣周邊區域。根據掌握，目前尚未有越南飛往台灣的航班發出延誤或取消的公告。網路媒體越南快訊（VnExpr...,https://udn.com/news/story/121143/6510934
0,0,0,3266,經濟學家羅奇評裴洛西「傷口灑鹽」 僅有利地方政治,2022-08-04,曾任職聯準會的美國知名經濟學家、現任耶魯大學研究員的羅奇（Stephen Roach）周三在財經頻道CNBC節目「Street Sign Asia」，評論美國眾院議長裴洛西訪台時說，此事升高美國和中...,https://udn.com/news/story/122972/6510962
1,0,1,3267,裴洛西來台 謝金河：美中角力變明鬥 值得關注是日本,2022-08-04,美眾院議長裴洛西（Nancy Pelosi，或譯裴洛西）旋風式訪台。財信傳媒董事長謝金河說，裴洛西離台，這世界開始有大變化。謝金河說，昨天傍晚很多台灣民眾目送裴洛西的班機飛離台灣，這次不到20小時的...,https://udn.com/news/story/122944/6510956
0,0,0,3268,歐洲議會友台議員擬年底訪台 推動投資協定,2022-08-04,歐洲議會近年成為台歐關係的主要推手，包瑞翰等重要友台議員近日透露正規劃年底造訪台灣，推動歐盟與台灣簽署雙邊投資協定。歐洲議會對中關係代表團團長包瑞翰（ReinhardBütikofer）接受柏林「每...,https://udn.com/news/story/6809/6510948
1,0,1,3269,德國：反對北京對台軍事經濟脅迫,2022-08-04,中國禁止台灣商品進口，並擬在台灣海峽周遭大規模演習，以懲罰美國眾議院議長裴洛西（Nancy Pelosi）訪台，德國政府對此表示反對。德國外交部發言人柏格（Christofer Burger）今天表...,https://udn.com/news/story/122972/6510947
0,1,1,3270,美前官員：北京持續表不滿 不致與美國嚴重衝突,2022-08-04,美國聯邦眾議院議長裴洛西訪台，引來北京文攻武嚇，升高區域衝突。前美國國務院官員王曉岷評估，北京將採取進一步措施表達不滿，但不會與美國挑起更嚴重的軍事或經濟衝突，以免影響自身利益。裴洛西（Nancy ...,https://udn.com/news/story/122972/6510954
0,0,0,3271,油價重挫4%、跌回俄烏戰前水準 OPEC+僅增產每日10萬桶,2022-08-04,國際油價周三（3日）重挫4%，因美國數據顯示上周原油和汽油庫存意外激增，以及石油輸出國組織與盟國（OPEC+）表示將把石油增產目標小幅提高每日10萬桶，油價加速下跌。 西德州原油價格報每桶90美元左...,https://udn.com/news/story/6811/6510949
0,0,0,3272,裴洛西離台後發聲明：中國無法阻止世界領袖訪台,2022-08-04,美國眾議院議長裴洛西（Nancy Pelosi，或譯裴洛西）旋風訪台19小時後，於3日傍晚搭機前往南韓，並於離台後在眾院議長網站發表聲明，強調「中國無法阻止世界各地的領袖造訪台灣」。裴洛西在聲明中說...,https://udn.com/news/story/122972/6510950
1,1,1,3273,中國軍事恫嚇 美參院外委會主席呼籲與台灣同在,2022-08-04,美國參議院外交委員會主席梅南德茲投書紐約時報，稱許眾議院議長裴洛西訪台是正確之舉。他說，美國有和台灣人民同在的道義責任，應與台灣合作更新軍備，嚇阻北京武力犯台。梅南德茲（Bob Menendez）寫...,https://udn.com/news/story/122972/6510935
0,1,1,3274,圖解新聞／陸制裁燒到文旦、白帶魚 砂石不來衝擊不大,2022-08-04,聯合報每天推出「圖解新聞」，希望藉由圖像設計幫助讀者理解生硬內容。這次的圖表帶你看裴洛西訪台效應。美眾院議長裴洛西率團訪台，引發中國大陸強烈抗議，軍事演習之外，經濟制裁行動一波波。除了宣布禁止我國柑...,https://udn.com/news/story/122946/6510823
0,1,1,3275,英學者：北京對裴洛西訪台反應過度 武嚇不應容忍,2022-08-04,美國眾議院議長裴洛西訪問台灣，中共文攻武嚇引發區域緊張及各國關注。英國智庫專家多認為台海不致爆發全面衝突；有學者指出，北京應被提醒，不可企圖透過軍事威嚇單方面改寫台美互動規則。英國智庫「地緣戰略理事...,https://udn.com/news/story/122972/6510900
1,1,1,3276,陸大規模軍演「封鎖」台灣 影響幾何？,2022-08-04,佩洛西（Nancy Pelosi，也譯&amp;#8220;裴洛西&amp;#8221;）是25年來對台灣進行訪問的美國最高級別政治人物。她的這次訪問讓本已緊張的台海關系更加劍拔弩張。據中國官媒報道...,https://udn.com/news/story/10930/6510470
1,1,1,3277,台海風波日緊 美國會延後審查「台灣政策法」,2022-08-04,美國聯邦參議院外交委員會原定3日下午審查由委員會主席梅南德茲（Bob Menendez）領銜提案的「台灣政策法案」（Taiwan Policy Act of 2022），不過由於參院院會共識優先處理...,https://udn.com/news/story/6813/6510891
0,0,0,3278,人權觀察組織呼籲聯合國 調查中國在新疆虐待情況,2022-08-04,人權觀察（Human Rights Watch）今天表示，該組織希望聯合國人權理事會（UN Human Rights Council）對中國被控在新疆地區的虐待情況展開調查。法新社報導，聯合國人權事...,https://udn.com/news/story/6809/6510872
0,1,1,3279,英外相批中激烈回應裴洛西訪台 外委會成員籲挺台,2022-08-04,美國眾議院議長裴洛西2至3日訪問台灣，中共文攻武嚇並宣布4日起在台灣周邊多處實施軍演。英國外交大臣特拉斯對中國的激烈回應表示不贊同，並呼籲中方緩和衝突情勢。國會外交委員會成員、國會議員組織「中國研究...,https://udn.com/news/story/122972/6510873
0,1,1,3280,共軍升高威脅 拜登與國安團隊討論印太局勢,2022-08-04,美國聯邦眾議院議長裴洛西訪台，引發北京不滿，在台海周遭大規模演習，升高區域緊張。美國總統拜登今天上午與國安團隊通話，討論印太局勢。裴洛西（Nancy Pelosi）台北時間2日晚間率團訪台，北京連日...,https://udn.com/news/story/6813/6510879
0,1,1,3281,裴洛西訪台情勢緊繃 美參院外委會延審台灣法案,2022-08-04,美國參議院外委會原訂今天審理「台灣政策法案」，但稍早以主席須參與院會事宜為由，決定延期。由於眾議院議長裴洛西剛結束訪台，正值情勢緊繃，延期時間點引起想像空間。參議院外委會原訂下午審理由民主黨籍主席梅...,https://udn.com/news/story/122972/6510855
0,0,0,3282,數據反駁衰退 道瓊那指大漲 本周跌幅盡消,2022-08-04,美股3日反彈，收復本周跌幅，交易員歡迎優於預期的經濟數據，因減緩了衰退無可避免的想法。道瓊工業平均指數上漲416.33點或1.29%至3萬2812.5點。史坦普500指數上漲63.98點或1.56%...,https://udn.com/news/story/6811/6510875
0,1,1,3283,新聞眼／除鼓吹愛國消費 具體政策在哪,2022-08-04,美眾院議長裴洛西（Nancy Pelosi，或譯裴洛西）訪台，中國大陸展開文攻武嚇，讓大陸網民無不沸騰，甚至還有福建網友討論「到底會不會『那啥』（指打仗）」；反觀台灣，蔡政府的回應不但制式且避重就輕...,https://udn.com/news/story/122946/6510698
0,0,0,3284,陸下禁令／白帶魚影響最大 柚農叫苦,2022-08-04,中國大陸宣布禁止我國柑橘類、冰鮮白帶魚及冷凍竹筴魚進口，農委會昨表示，總影響產值約七至八億元，其中影響最大的是白帶魚，且影響範圍遍及全台，另首當其衝的是即將進入中秋銷售旺季的文旦柚。農委會也說，除了...,https://udn.com/news/story/122946/6510694
0,1,1,3285,學者：防陸停掉ECFA,2022-08-04,美眾院議長裴洛西（Nancy Pelosi，或譯裴洛西）率團訪台，引發中國大陸強烈抗議，軍事演習之外，經濟制裁行動一波波。儘管官方輕描淡寫，但學者專家認為，目前陸方祭出的經濟制裁措施只是開端，後續恐...,https://udn.com/news/story/122946/6510690
0,1,1,3286,新聞幕後／低調噤聲 我避免被扣挑釁帽子,2022-08-04,美國聯邦眾議院議長裴洛西（Nancy Pelosi，或譯裴洛西）結束旋風訪台行程，台海緊張局勢升高，外界關注民進黨政府兩岸政策是否修正。黨政人士表示，蔡總統以「四個堅持」為主軸的兩岸政策主軸未有動搖...,https://udn.com/news/story/122944/6510792
0,1,1,3287,白宮：陸反應符預期 盼衝突不升級,2022-08-04,北京宣布一系列軍事行動反擊美國眾院議長裴洛西訪台，白宮國安會戰略溝通協調官柯比二日表示，中國大陸的反應令人擔憂，但都在預期之中。他說。裴洛西此行並未侵犯中方主權或違反美國的一個中國政策，拜登政府希望...,https://udn.com/news/story/122944/6510787
1,1,1,3288,美中關係難修復 華府學者：台恐成為美中衝突犧牲品,2022-08-04,美國眾院議長裴洛西（Nancy Pelosi，或譯裴洛西）二日訪台引發國際密切關注，華府學者分析，這恐讓台灣成為美中衝突的犧牲品，實屬不必要的風險，也可能導致美中關係無法修復；另有學者稱裴洛西此行意...,https://udn.com/news/story/122944/6510791
0,1,1,3289,大陸祭出連環拳／「商攻」擴大報復範圍,2022-08-04,美國眾議院議長裴洛西訪台，大陸對台重拳報復接二連三，繼1日對台灣食品業禁止進口後，昨（3）日擴大「商攻」，大陸商務部停止對台灣出口天然砂、海關總署暫停進口台灣柑橘類水果、冰鮮白帶魚、冷凍竹筴魚。大陸...,https://udn.com/news/story/122946/6510729
0,0,0,3290,獨派聲援 統派如影隨形抗議,2022-08-04,美國眾議院議長裴洛西（Nancy Pelosi，或譯裴洛西）昨天行程滿檔，統派團體如影隨形抗議，也有獨派團體迎接聲援，警政署出動兩千名警力高規格維護安全，警政署長黃明昭也到場坐鎮，未發生重大脫序。昨...,https://udn.com/news/story/122944/6510742
0,1,1,3291,白宮：中國沒理由將裴洛西訪台變成危機,2022-08-04,美國眾議院議長裴洛西（Nancy Pelosi）造訪台灣，引發中國宣布在台灣周邊舉行軍演。白宮今天指出，中國沒有理由將裴洛西訪台一事變成危機。白宮新聞秘書尚皮耶（Karine Jean-Pierre...,https://udn.com/news/story/6813/6510850
0,0,0,3292,科技．人文聯合講座／大學也要導入良善治理，重塑文化,2022-08-04,「是不是該把我們的協會改成公司了？」不少非營利組織的朋友問我。他們希望設立公司，導入商業運作提升效能，以獲利來支持長期發展，提升影響力。也有許多企業主希望我提建議，他們想把ESG導入經營，融入社會使...,https://udn.com/news/story/7339/6510696
0,1,1,3293,楊金龍穩匯市 請全民放心,2022-08-04,美國眾議院議長裴洛西來台，挑動兩岸關係敏感神經，對於中國大陸今（4）日起將對台祭出包括軍演在內的一系列制裁行動，是否會對國內匯市造成衝擊，中央銀行總裁楊金龍昨日信心喊話，請全民「放心」，至於台灣外匯...,https://udn.com/news/story/7238/6510588
1,1,1,3294,美中毀互信 兩岸更緊張,2022-08-04,美國眾議院議長裴洛西（Nancy Pelosi，或譯裴洛西）在各方關注下，終於來到台灣，並與蔡英文總統會談，大陸也採取強烈的反制作為，對於美中台關係產生明顯衝擊。裴洛西在抵台後發表聲明，強調此行的目...,https://udn.com/news/story/7339/6510701
0,1,1,3295,蔡總統宴裴洛西 晶片法案上餐桌,2022-08-04,美國眾議院議長裴洛西（Nancy Pelosi，或譯裴洛西）旋風訪台，蔡英文總統昨天中午在台北賓館設宴接待，台積電創辦人張忠謀、董事長劉德音及和碩副董事長程建中都是座上賓。蔡總統透過臉書表示，她邀請...,https://udn.com/news/story/122944/6510738
1,1,1,3296,裴洛西：不要武力加諸台灣,2022-08-04,美國聯邦眾議院議長裴洛西（Nancy Pelosi，或譯裴洛西）昨天拜會立法院，並與朝野四黨團會談，對於立法院副院長蔡其昌稱呼「台灣的朋友」，裴洛西說，「對我來說是很大的讚美」。裴洛西與蔡英文總統昨...,https://udn.com/news/story/122944/6510741
1,1,1,3297,侯友宜：台海安全不容挑釁,2022-08-04,美國眾議院議長裴洛西訪台，兩岸關係緊繃。國民黨主席朱立倫表示，兩岸需要交流，不要對抗、交惡；新北市長侯友宜說，中華民國是主權獨立國家，大家愛好和平、努力維護和平，捍衛中華民國是誓死不變的決心、保護人...,https://udn.com/news/story/122682/6510743
0,1,1,3298,科技三大咖出席午宴 有玄機,2022-08-04,蔡總統昨（3）日在總統府接見美國眾議院議長裴洛西（Nancy Pelosi）訪問團後，並在台北賓館設午宴招待，除裴洛西一行人，包括台積電（2330）創辦人張忠謀伉儷、台積電董事長劉德音及和碩副董事長...,https://udn.com/news/story/122944/6510669
0,1,1,3299,裴洛西強渡關山 八二三砲戰翻版,2022-08-04,二日美國眾院議長裴洛西專機降落我松山機場後，新華社隨即公布八月四日至七日針對台灣的環島軍演圖；這一舉動將對台灣帶來長遠的影響，並不會因為裴洛西的離開而結束。六十多年前，中國發動八二三砲戰，毛澤東在信...,https://udn.com/news/story/7339/6510706
0,0,0,3300,王毅：美國部分政客 是麻煩製造者,2022-08-04,據央視新聞報導，大陸國務委員兼外長王毅三日在柬埔寨出席東協外長會受訪時表示，美國眾議院議長裴洛西訪台是「徹頭徹尾鬧劇」，痛斥美國打著民主幌子，侵犯中國主權的勾當。大陸國台辦針對裴洛西訪台事件昨七度發...,https://udn.com/news/story/7331/6510788
0,1,1,3301,陸禁運天然砂 建商壓力大,2022-08-04,陸營建材料恐禁運，建商壓力暴增。大陸商務部昨（3）日宣布暫停對台出口天然砂，對此，我營造、營建業者均指出，短線天然砂禁運影響不大，但產業對中國大陸原材料依賴程度大，若全面禁止進口，恐引爆台灣小建商倒...,https://udn.com/news/story/122946/6510647
0,0,0,3302,三類農漁產品 也被禁,2022-08-04,"繼調製食品後，中國大陸昨（3）日再宣布禁止台灣柑橘類水果和冰鮮白帶魚、凍竹莢魚輸入。財政部統計，去年這三項貨品出口陸港規模合計2,683萬美元，僅占總出口0.006%，規模相當小，對總出口影響不大。...",https://udn.com/news/story/122946/6510649
0,1,1,3303,演習封鎖海空大亂 政院急擬對策,2022-08-04,大陸解放軍今午十二時至七日十二時將在台灣周邊進行軍演，讓海空交通大亂。空運部分，由於演習區域包圍了台北飛航情報區，總計十八條國際航路受影響，交通部已協調改走日本、菲律賓的替代航路，國內航線則不受影響...,https://udn.com/news/story/10930/6510708
0,0,0,3304,白宮：拜登8月9日簽署晶片法案 促進對中國競爭力,2022-08-04,白宮今天表示，美國總統拜登將於下週二（8月9日）簽署「晶片法案」，這項法案意在補貼美國半導體產業，並且促進美國對中國的競爭力。白宮發表新聞聲明指出，拜登將於8月9日在白宮玫瑰花園（Rose Gard...,https://udn.com/news/story/6813/6510828
0,0,0,3305,談裴洛西訪台 加拿大外長籲中國緩和緊張局勢,2022-08-04,加拿大外交部長趙美蘭（Melanie Joly）今天表示，在美國眾議院議長裴洛西（Nancy Pelosi）本週造訪台灣後，加國極度憂心緊張局勢加劇，籲請中國緩和局勢。路透社報導，趙美蘭在加拿大蒙特...,https://udn.com/news/story/122972/6510833
0,1,1,3306,國家隊出手 股匯都挺住,2022-08-04,中國大陸近日宣布一連串對台經濟制裁並展開為期三天的軍事演習，在國家隊出手「維穩」下，台北股市昨天終場收紅小漲廿九點，指數收在一萬四七七七點，但成交量來到今年新低的一七四八億元。新台幣兌美元匯率也由貶...,https://udn.com/news/story/7238/6510740
0,0,0,3307,先進設計軟體 將禁賣大陸 美晶片新禁令 波及全球,2022-08-04,美國據傳將再祭出新的出口限制措施，除了限制晶片製造設備，還將管控設計新一代高階晶片所需的特定設計軟體出口至中國大陸。但專家警告，這些限制措施或許有助阻止大陸在半導體製造方面的進展，但也將擾亂脆弱的全...,https://udn.com/news/story/7240/6510752
0,0,0,3308,黃志芳／通膨加衰退 超級企業家的機會,2022-08-04,通膨像一隻怪獸。兩年前各國政府為了因應COVID疫情大撒錢，一位華爾街的朋友告訴我，大家的錢要變薄了，因為二○○八金融海嘯時各國撒錢救的是銀行，這次則是直接發錢給人民消費，而且這次量化寬鬆的規模是上...,https://udn.com/news/story/121739/6510746
0,0,0,3309,當代繪畫獎4得獎作 中信園區添亮點,2022-08-04,民眾來到南港的中國信託金融園區，別忘了停下腳步，欣賞「中國信託當代繪畫獎」四件台灣當代繪畫作品。該獎的首獎、優選共四件作品，由中國信託文教基金會典藏、中國信託銀行借展，即起於中信園區公共空間及辦公區...,https://udn.com/news/story/7266/6510674
0,0,0,3310,美擬禁晶片設計軟體輸陸,2022-08-04,美國據傳打算再祭出新的出口限制措施，除了限制晶片製造設備外，還將管控設計新一代高階晶片所需的特定設計軟體輸出給中國大陸。但專家警告，這些限制措施或許有助阻止中國大陸在半導體製造方面的進展，但也將擾亂...,https://udn.com/news/story/6811/6510596
0,0,0,3311,晶片法過關後…韓廠重新評估對陸布局,2022-08-04,美國晶片法過關後，三星電子和SK海力士開始重新評估對中國大陸的投資，可見華府鼓勵全球主要半導體業者布局由大陸轉移美國正發揮效果，不過，美國晶片製造若要指望能趕上亞洲同業，勢必還有長路要走。美國國會上...,https://udn.com/news/story/6811/6510640
0,1,1,3312,北京灰色戰術 台美新挑戰,2022-08-04,美國眾院議長裴洛西訪台儘管引發地緣政治緊張升溫，但對全球金融市場的衝擊目前看來已減退。然而，中國大陸已祭出各類經貿制裁，甚至宣布裴洛西離開台灣隔天，將在台灣周遭海域進行軍演。投資策略師和基金經理人憂...,https://udn.com/news/story/6811/6510653
0,0,0,3313,星巴克表現優於預期,2022-08-04,星巴克上季（止於7月31日的年度第3季）營收為81.5億美元，每股盈餘由一年前的97美分降到79美分，營業利潤率降到15.9%，都優於市場預期。客單價成長6%，但交易筆數減少3%，代表較高的價格彌補...,https://udn.com/news/story/6811/6510620
1,1,1,3314,日憂陸軍演 尹錫悅不見裴洛西,2022-08-04,美國聯邦眾議院議長裴洛西訪台，各國媒體皆以顯著篇幅密集報導，許多分析家認為，裴洛西此行刺激美中緊張加劇，可能引發第四次台海危機，且各國更須重視對美與對陸關係的平衡拿捏。中國大陸因此事件將在台灣周邊舉...,https://udn.com/news/story/122972/6510789
0,1,1,3315,東協外長會議 聚焦裴洛西訪台,2022-08-04,美國聯邦眾議院議長裴洛西（Nancy Pelosi，或譯裴洛西）旋風訪台引發北京當局強烈反彈，東協三日在柬埔寨首都金邊舉行外長會議，呼籲各方自制，以穩定台海局勢。法新社報導，東協外長會議原本重點是緬...,https://udn.com/news/story/6809/6510552
1,1,1,3316,東協關切兩岸情勢 新加坡盼美中克制避免升高緊張,2022-08-04,美國聯邦眾議院議長裴洛西率團訪台，牽動美中台情勢。新加坡外交部今晚表示，東協外長會議關切兩岸情勢，強調美中關係穩定對區域和平至關重要，呼籲美中克制、避免升高緊張情勢。新加坡外交部晚間發布新聞稿表示，...,https://udn.com/news/story/6809/6510572
0,0,0,3317,大陸可再生能源發電 穩步擴大,2022-08-04,中國大陸國家能源局2日召開第三季網上記者會，大陸國家能源局新能源和可再生能源司副司長王大鵬表示，可再生能源發展持續向好，可再生能源裝機規模穩步擴大。中新社報導，今年上半年，中國大陸可再生能源發電新增...,https://udn.com/news/story/7333/6510621
0,0,0,3318,清潔能源體系 福建加速建構,2022-08-04,8月2日，中國大陸自主三代核電華龍一號批量化工程—中核集團漳州核電2號機組第3台蒸汽發生器吊裝就位。至此，漳州核電2號機組三台蒸發器5天內全部吊裝就位。中新社報導，福建省發展和改革委員會主任孟芊受訪...,https://udn.com/news/story/7333/6510695
1,1,1,3319,解放軍鎖台軍演之際 G7外長聯合聲明關切台海,2022-08-04,七大工業國集團（G7）外交部長與歐盟外交政策高級代表3日發布聯合聲明，關切解放軍針對台灣的威脅行動，呼籲各方冷靜行事，避免誤解。聯合聲明強調對維持以規則為基礎的國際秩序，和台灣海峽和平穩定的承諾。聯...,https://udn.com/news/story/10930/6510817
0,0,0,3320,世界500強企業 陸企營收超越美,2022-08-04,「財富」（FORTUNE）雜誌3日發表2022年的「世界500強企業」排行榜。美國零售商沃爾瑪連續9年成為全球最大公司。其中，大陸上榜企業的營收占500家上榜企業總營收的31%，首次超過美國。美國上...,https://udn.com/news/story/7333/6510613
0,0,0,3321,服務業 嗅出回暖跡象,2022-08-04,大陸服務業景氣嗅出回暖跡象，財新3日公布7月中國通用服務業經營活動指數（服務業PMI）為55.5，較6月上升1.0個百分點，已是連續第二個月位於擴張區間，且創下2021年5月以來新高。分析認為隨著防...,https://udn.com/news/story/7333/6510639
1,0,1,3322,陸資產管理規模 達131.16兆,2022-08-04,財富管理機構新湖財富旗下植信投資研究院3日發布「中國財富管理行業發展報告（2021-2022）」稱，截至2021年底，按照銀行理財、信託、證券資管、公募基金、私募基金、保險和第三方財富管理全口徑計算...,https://udn.com/news/story/7333/6510704
1,1,1,3323,共軍今午起軍演 陳其邁開應變會議：確保社會正常運作,2022-08-04,美國眾議院議長裴洛西訪台，牽動美中台敏感神經，中國對台灣祭出制裁手段，除暫停進口多項農水產、食品，解放軍將在今天中午起，連續72小時在台灣周圍進行軍演，其中高雄外海演訓區離陸地不到20公里。高雄市長...,https://udn.com/news/story/10930/6510814
0,0,0,3324,徑山點茶 因電視劇夢華錄知名,2022-08-04,中國大陸熱播古裝劇「夢華錄」中，女主角「趙盼兒」的一手「徑山點茶」，在觀眾心中留下深刻印象。劇中被盛贊「入口無澀，清香悠遠」的徑山茶，正產自浙江省杭州市徑山鎮。劇中的點茶技藝，在此歷經多年傳承創新。...,https://udn.com/news/story/7332/6510634
0,0,0,3325,陸氣溫提升速率 高於全球平均,2022-08-04,中國大陸氣象局氣候變化中心3日發布的「中國氣候變化藍皮書（2022）」顯示，全球變暖趨勢仍在持續，中國大陸升溫速率高於同期全球平均水平，是全球氣候變化的敏感區。中新社報導，藍皮書顯示，全球變暖趨勢仍...,https://udn.com/news/story/7332/6510691
0,0,0,3326,網紅局長走出辦公室 勾引遊客到此一遊,2022-08-04,雪地中策馬狂奔的紅袍美女、高原上目光如炬的英挺俠客…，為了推廣地方文旅，官員們走出辦公室成為網紅，絞盡腦汁的在網上博眼球、攢粉絲。在好山好水的氣氛烘托下，只要能牽動遊客一個「好想去」的念頭，「網紅局...,https://udn.com/news/story/7332/6510765
1,1,1,3327,捐款就封殺 4台企被列台獨金主,2022-08-04,美國眾院議長裴洛西訪台，北京接連出手反制。中共昨宣布，將對「台獨頑固分子」採取刑事懲處措施，終身追責，同時宣布將懲戒「台獨頑固分子」關聯機構，點名兩個隸屬於外交部的台灣民主基金會和國際合作發展基金會...,https://udn.com/news/story/7331/6510737
0,0,0,3328,大陸下達金融業限薪令,2022-08-04,日前一起大陸券商員工「曬薪」事件引爆輿論漩渦，也刺激監管部門神經。大陸財政部近日發布《關於進一步加強國有金融企業財務管理的通知》，對國有金融企業薪酬制度做出新管理規定，除要求加大向一線員工、基層員工...,https://udn.com/news/story/7333/6510709
0,0,0,3329,陸投行貴族…中金平均年薪518萬,2022-08-04,大陸一線券商投行普遍都有「好薪情」。從上市券商2021年年報來看，中金公司拔頭籌，成為唯一人均薪酬超過人民幣百萬機構，達到人民幣116.42萬元（約新台幣518萬元），相比2020年，這家素有「投行...,https://udn.com/news/story/7333/6510713
