relsub,relsum,rel,index,title,date,summary,link
0,0,0,2203,《理性的非理性》沉沒成本效應：好市多為何總是人滿為患？,2022-08-08,文／鄭毓煌、蘇丹任何事物都有兩面性，沉沒成本效應也並非一無是處。在深入了解沉沒成本效應之後，企業也可以巧妙利用它來「黏」住顧客。 在美國零售業中，好市多排名第二，僅次於沃爾瑪。雖然好市多沒有沃爾瑪大...,https://reading.udn.com/read/story/122749/6512580
1,1,1,2204,兩艘中國海警船出現釣魚台海域 逼近日本漁船,2022-08-08,日本海上保安廳第11管區今天表示，昨晚至今天凌晨，在釣魚台海域有兩艘中國海警局的船隻相繼入侵「領海」。日本放送協會（NHK）報導，日本第11管區海上保安本部表示，昨晚約11時30分（台灣時間10時3...,https://udn.com/news/story/6809/6520389
0,1,1,2205,央視刪除歌曲推薦文　蔡依林微博一夜狂掉30萬粉絲數,2022-08-08,美國眾議院議長裴洛西（Nancy Pelosi）訪台，引發中國不滿，網友們更是關注有哪些台灣藝人沒有轉發央視「只有一個中國」的貼文，沒有轉發表態者都被視為該封殺的對象，蔡依林的微博近日粉絲數掉了30...,https://stars.udn.com/star/story/10088/6520384
1,1,1,2206,美媒：美印將於中印邊境軍演 中國反應受矚,2022-08-08,根據美國有線電視網CNN週六（8月6日）的報導，美國將與印度在距離中印有爭議的邊境不到100公裡之處舉行聯合軍演。一位了解情況的印度陸軍高級軍官向CNN表示，這次軍演將在10月中旬，於印度北阿坎德邦...,https://udn.com/news/story/6809/6520372
1,1,1,2207,分析共軍演習 日本前海將：攻打台灣非易事,2022-08-08,中共解放軍在台灣周邊實施軍事演習，日本退役海將香田洋二分析，雖共軍聲稱「封鎖台灣」，但如果美軍有部署，共軍不可能輕易封鎖台灣，要攻打台灣並非易事。因不滿美國聯邦眾議院議長裴洛西訪台，共軍於4至7日在...,https://udn.com/news/story/10930/6520376
1,1,1,2208,陸國防部：陸取消三項中美軍事交往 美需負全責,2022-08-08,中美關係緊張，中方美國眾議長裴洛西（此前譯波洛西）訪台宣佈八項反制措施，其中包括取消中美軍事交往三項措施。大陸國防部發言人吳謙今天就此表示，中方有關反制措施是對美台挑釁的必要警示，對國家主權和安全的...,https://udn.com/news/story/122972/6520364
0,0,0,2209,全球最賣卻難逃虧損 豐田集團利潤暴跌42%,2022-08-08,"儘管在全球上半年汽車銷售統計之中，豐田集團以513萬7,811輛的銷售數據狠甩福斯集團的400萬輛，成為2022年上半年表現最亮眼的汽車集團。但這樣的銷售依然檔不住成本上升和供應鏈問題，也使得豐田集...",https://autos.udn.com/autos/story/7826/6520366
1,0,1,2210,中國軍演台灣人竟無感？CNN記者來台超訝異：逛街吃飯照舊,2022-08-08,美國眾議院議長裴洛西（Nancy Pelosi）訪台引發國際關注，中國解放軍也隨即宣布在台灣周邊進行演習導致局勢升級，美國CNN記者埃西格（Blake Essig）從日本被調往台灣支援，卻意外見到台...,https://udn.com/news/story/6809/6520353
0,0,0,2211,網球／「台日組合」聖荷西居亞 詹皓晴多倫多拚復仇,2022-08-08,在聖荷西女網賽打進睽違一年半的決賽，我國女網好手詹皓晴今天和日本搭擋青山修子雖沒能笑擁金盃，以5：7、0：6不敵中國大陸組合徐一璠／楊釗煊，但轉戰多倫多馬上有機會復仇。詹皓晴前一度打進決賽是要回溯到...,https://udn.com/news/story/7005/6520349
1,1,1,2212,台大兩官網遭駭「只有一個中國」 學務處網頁竟變截圖,2022-08-08,美國眾議院議長裴洛西訪台後，台灣多個政府網站遭駭客攻擊，沒想到台灣大學昨晚也淪陷，不僅教務處網頁被換上斗大的「世界上只有一個中國」標語，就連研發處也中鏢，深夜傳出學務處官網竟變成一張截圖，完全點不進...,https://udn.com/news/story/6928/6520350
0,0,0,2213,港交所ETF獲納入互聯互通 開啟跨境投資新篇章,2022-08-08,香港交易所表示，ETF已正式於7月4日納入互聯互通！香港及國際投資者現在可以透過滬深港通，直接投資在內地上市的合資格ETF，靈活管理中國大陸市場配置；同時，內地投資者可運用ETF這項具成本效益、透明...,https://udn.com/news/story/7252/6520334
0,0,0,2214,照片看歷史／貢獻台灣98年！ 馬偕博士家族1968年決定回加拿大定居,2022-08-08,1968年8月8日，加拿大籍傳教士偕叡理（馬偕）博士的家族下午搭機飛回加拿大定居，結束馬偕家族在台98年的傳教生活。200多位來自北部地區的基督教長老會教友和青年學生們在台北國際機場上，歡送在中國傳...,https://udn.com/news/story/7314/6520335
0,0,0,2215,永豐投顧：等待法說會揭露展望 再逢低介入,2022-08-08,台股外面臨政治敏感環境，內有PC產業鏈面臨庫存調整，股價尚有修正壓力，台股雖大漲攀登萬五整數關卡，但永豐投顧說，不宜追高，尤其在個股第3季展望強弱有別，可等待法說會公司揭露展望後，再行逢低介入，預估...,https://udn.com/news/story/7251/6520333
0,0,0,2216,第七屆《WHATs NEXT》未來科技產業高峰會 9月7日舉行,2022-08-08,為了探討台灣半導體與新興科技產業的發展新契機，第七屆《WHATs NEXT》未來科技產業高峰會，將於9月7日在香格里拉台北遠東國際大飯店香格里拉宴會廳舉辦。這屆峰會由國家發展委員會擔任指導單位，陽明...,https://udn.com/news/story/7240/6520331
1,1,1,2217,台股早盤一度跌逾百點 台積電開盤下跌6元,2022-08-08,"台股今(8)日開盤下跌63.83點，開盤指數14,972.21點，早盤一度跌逾百點，最低來到14,908點；台積電（2330）開盤下跌6元，開盤價510元。群益投顧說，大盤指數收復短期均線，突破萬五...",https://udn.com/news/story/7251/6520330
0,0,0,2218,網球／聖荷西女網賽不敵中國組合 詹皓晴屈居女雙亞軍,2022-08-08,台灣網球雙打好手詹皓晴與日本女將青山修子今天聖荷西女網賽女雙決賽，從首盤盤中起連丟10局，最終以5比7、0比6不敵中國組合徐一璠與楊釗煊，屈居亞軍。詹皓晴與日本女將青山修子自今年3月邁阿密網賽開始合...,https://udn.com/news/story/7005/6520284
0,0,0,2219,"美參院通過拜登旗艦經濟法案 3,700億美元衝刺乾淨能源",2022-08-08,美國參議院在歷經馬拉松式挑燈夜戰的投票後，7日終於通過美國總統拜登的旗艦經濟法案，將對深具獲利能力的大型公司加稅，並支出數千億美元於降低碳排放的各種計畫，也象徵拜登和民主黨在關鍵的11月期中選舉登場...,https://udn.com/news/story/6813/6520289
0,0,0,2220,OnePlus 10T登場！沒有靜音鍵、支援150W有線快充,2022-08-08,一加 (OnePlus)稍早宣布針對中國以外市場推出新款OnePlus 10T，基本上沿用上半年在中國市場推出的一加10 Pro外型設計，但也將系列機種過往搭載的靜音撥鍵取消，導致新機僅能透過軟體介...,https://tech.udn.com/tech/story/123151/6518971
1,1,1,2221,影／國史館稱中華民國由北京政府繼承 藍批民進黨中共同路人,2022-08-08,針對國史館臉書貼文，聲稱「聯合國與國際社會都認定中華民國已經由北京政府代表、繼承」、以及台灣維持現狀是自願成為中國大陸的一部分等。國民黨文傳會副主委兼黨史館主任林家興嚴正質疑，所謂「中華民國由大陸當...,https://udn.com/news/story/6656/6520280
0,1,1,2222,【專家之眼】台灣有事美日置身事外 中共將變本加厲,2022-08-08,美國聯邦眾議院議長裴洛西三日離開台北轉往首爾後，中共解放軍四日中午就對台灣發動全面封鎖式的海空聯合軍演。經常對台灣提出安全保證的美國以及高調表示「台灣有事，日本有事」的日本，都擺出一副事不關己的態度...,https://udn.com/news/story/122972/6520275
0,0,0,2223,高雄冰店憑什麼全台第一？文博會開幕揭密吃冰文化,2022-08-08,走進2022台灣文博會的「寶島冰菓室」，你可以聽到1982年的「小美冰淇淋廣告歌」、吧噗叫賣聲；欣賞台灣最老冰店「龍都」熬煮紅豆、綠豆的老鍋，還可和台南莉莉冰果室等全台冰店即時連線。再到一旁的「島嶼...,https://reading.udn.com/read/story/122750/6513160
0,0,0,2224,8/8【早晨財經速解讀】中信金 元大金 永豐金七月獲利出爐 台股量縮盤整能突破?7月非農遠超預期 市場慌了 聯準會9月升三碼? ,2022-08-08,中信金控、永豐金控7月獲利均呈現雙位數成長，元大金也僅小退，四家5日公布獲利金控，中信金以前七月累計每股稅後純益1.53元暫居第一，次為元大金的1.17元。中信金7月稅後純益55.93億元、年增50...,https://udn.com/news/story/7251/6520263
0,0,0,2225,54萬人民幣存大陸銀行難匯回 婆婆轉匯媳婦戶頭她不還,2022-08-08,羅姓婦人先夫在匯豐（中國）上海貴都大飯店支行留遺產，因大陸管制外匯，沒法將整筆款項匯回台灣。曾姓媳婦告知可透過她的帳戶匯回，婆媳4年多前同赴上海處理，錢轉進媳婦戶頭後，媳婦卻不交錢。羅婦多次催促，媳...,https://udn.com/news/story/7321/6520256
0,1,1,2226,本周開盤前 五件國際事不可不知,2022-08-08,美股標普500指數和那斯達克指數上周五（5日）小幅收跌，因就業報告意外強勁，緩解美國經濟衰退的疑慮，卻也一併為聯準會（Fed）下一次開會大幅升息清除路障。費半指數上周五跌0.9%，但台積電ADR逆勢...,https://udn.com/news/story/6811/6520254
1,1,1,2227,美副國務卿訪太平洋島國 會紐西蘭防長關切台海,2022-08-08,美國副國務卿雪蔓率團訪問太平洋島國，她今天在索羅門群島會晤紐西蘭防長。中國近日在台灣周圍軍演引發國際關注，兩人在會中特別關切中共行徑，重申台海和平穩定重要性。中國近來積極拉攏太平洋地區各島國，今年4...,https://udn.com/news/story/6809/6520238
1,1,1,2228,國際周報／中共軍演後台灣該擔心2件事 美國用軍火販換回女籃球星,2022-08-08,"看點1：美國眾院議長裴洛西訪台掀起波瀾，中國大陸不僅實施經濟報復，還包圍台灣進行實彈射擊軍演，共機頻飛越台海中線，恐怕也會讓北京奪取台海中線的定義權。

看點2：美國聯準會似乎沒打算停下升息腳步，不...",https://udn.com/news/story/6809/6517892
0,1,1,2229,大陸營收拖累 餐飲業靠台灣救業績,2022-08-08,中國大陸對疫情嚴格控制也衝擊經濟活動，布局兩岸餐飲業者業績呈現兩樣情，只能重點發展過去認為相對較小、但現今重要性大幅上升的台灣市場，用新品牌搶不同價位客群。餐飲龍頭王品第二季台灣業績創七年新高，但受...,https://udn.com/news/story/7241/6520063
0,0,0,2230,陳松興／全球陷入停滯性通膨的可能性日增,2022-08-08,國際貨幣基金會（ＩＭＦ）七月底發布的「世界經濟展望」上調二○二二年和二○二三年的全球通膨預測至百分之八點三和百分之五點七，這是ＩＭＦ自二○二一年元月以來連續第七次上調。為抑制通膨，美國聯邦公開市場委...,https://udn.com/news/story/121739/6520067
0,0,0,2231,美導彈測量船 沖繩海域偵察,2022-08-08,據大陸智庫「南海戰略態勢感知」消息，美國「霍華德．洛倫岑」號導彈測量船（Howard O. Lorenzen，T-AGM-25）三日從日本橫須賀港出發，於七日到達沖繩附近海域，推測已進入偵察陣位。公...,https://udn.com/news/story/10930/6520140
0,1,1,2232,王毅稱160多國支持中方,2022-08-08,繼拒絕會晤日本外相、批評蔡英文總統後，中國大陸國務委員兼外長王毅六日應約與伊朗外長阿卜杜拉希揚通電話，王毅批美國眾議院議長裴洛西訪台是侵犯中國主權，並強調中國願與伊朗一道，共同反對單邊主義和霸凌行徑...,https://udn.com/news/story/10930/6520144
1,1,1,2233,經濟日報社論／兩岸對峙 全球斷鏈風險升高,2022-08-08,"近期中共在台海舉行軍演，不但海運路線受影響，空運航班也必須繞路甚至取消，是1996年以來台海對峙最嚴峻的時刻。過去十年來，兩岸貿易額從1,600億美元上升至3,283億美元，不論從出口比重、貿易順差...",https://udn.com/news/story/7338/6520012
0,0,0,2234,聯合報黑白集／陳時中與盧沙野,2022-08-08,陳時中應後悔辭衛福部長，少了防疫中心的舞台，曝光度驟減。但他趁裴洛西旋風發揮了一下民族大義，說「只要有心捍衛國家，就不會受欺負」。話說得沒錯，但捍衛國家，也不必刻意去招惹禍端吧？阿中的話似在暗指，主...,https://udn.com/news/story/7338/6520108
1,1,1,2235,台成美抗中工具 加深兩岸仇恨值,2022-08-08,兩岸仇恨值愈高，民進黨的選票愈高，早已是執政黨操盤造勢的最佳利器。果然，裴洛西一走，大陸方面的反制措施接踵而至。商懲武嚇，大陸不僅暫停關鍵原物料天然砂出口台灣，更祭出多項農產品暫停輸陸的禁令；兩岸兵...,https://udn.com/news/story/7339/6520110
0,1,1,2236,「雙贏」幻象背後的仇恨危機,2022-08-08,伴隨裴洛西的來訪及共軍的軍事演訓，此間正沉浸於一種以捍衛民主為基調的喜慶氣氛，對岸亦陶醉於雖遠必誅的國族狂歡。姑不論兩岸受眾接觸到的信息真偽如何，從社會心理的角度而言，雙方皆以為自己既得到了大義名分...,https://udn.com/news/story/7339/6520107
0,1,1,2237,周行一／台灣仍是友善供應鏈成員嗎？,2022-08-08,美國眾議院議長裴洛西女士於八月二日訪台，十九小時後於八月三日離台，緊接著中共於八月四日開始環繞台灣海域，在六個區塊中軍演，演習範圍全部在台灣海峽中線以東，某些部分位於台灣領海以內。八月五日彭博資訊報...,https://udn.com/news/story/7340/6520102
1,1,1,2238,陸媒：台海軍演將常態化,2022-08-08,共軍持續在台灣周邊軍演，中國大陸官媒央視表示，共軍將「常態化」在海峽中線以東進行演習，顯示台海緊張情勢仍無降溫跡象。大陸列出此次共軍的十個突破，並透過官媒宣稱南京艦曾侵入我國領海，遭我國防部否認。專...,https://udn.com/news/story/10930/6520043
1,1,1,2239,紐時：中共軍演對外秀肌肉 對內安撫民眾,2022-08-08,共軍針對台灣的軍事演習7日進入第四天，從向台灣附近海域的導彈射擊，到共軍戰機和軍艦越過海峽中線，都是中國大陸官媒的報導重點和社群媒體的熱議話題。紐約時報分析，中方軍演的姿態是針對國內外，對外是要展示...,https://udn.com/news/story/10930/6520044
1,1,1,2240,聯合報社論／共軍演習過後，台海新現狀更凶險,2022-08-08,美國眾議院議長裴洛西訪台，其實沒給台灣帶來外交突破，因為廿五年前美國眾院議長金瑞契即曾訪台。但裴洛西走後，共軍藉演習對台灣進行威嚇，飛彈射過台灣上空，共機在海峽中線恣意穿梭，兩岸現狀、地緣政治板塊及...,https://udn.com/news/story/7338/6520105
0,1,1,2241,台股可望震盪盤堅,2022-08-08,台股上周在中國大陸對台實施封鎖軍演下，行情震盪盤堅，單周小漲35點，周線連五紅。展望後市，法人認為，台股在本周公布的美國消費者物價指數（CPI）可望自高峰下滑，配合國安基金、金管會「禁空令」等國家隊...,https://udn.com/news/story/7251/6520011
0,1,1,2242,2友邦訪台 蘇揆嗆對岸別秀肌肉,2022-08-08,針對中共連日軍演，行政院長蘇貞昌昨天呼籲中國政府不要仗著軍事力量，到處秀肌肉妨害地區和平，另針對行政院召開資安會議，公家機關場域擴大禁用中國製資通訊產品一事，他表示，外敵當前，用各種假訊破壞國人團結...,https://udn.com/news/story/10930/6520126
1,1,1,2243,台海逐漸消失的兩條線,2022-08-08,不滿美國眾院議長裴洛西訪台，中共解放軍在台灣周邊海空域展開軍事演習。中共公告之六個軍演區，分別位於苗栗西北部外海、基隆市北部、東北部海域、花蓮東部太平洋海域、屏東縣南部海域，以及高雄市西南部海域。依...,https://udn.com/news/story/7339/6519995
0,1,1,2244,陶醉在挺台話術 忘風險控管,2022-08-08,美國眾議院議長裴洛西結束訪台離去，接著是中共軍演。這情況讓筆者聯想到牛頓第三定律，反作用定律，即有作用必有反作用，大小相等方向相反；但套用在國與國的對抗行動上，有作用必有反作用，方向相反，但反應的方...,https://udn.com/news/story/7339/6519996
0,1,1,2245,科技．人文聯合講座／陸不合作，重創美國氣候領導地位,2022-08-08,針對美國眾院議長裴洛西訪問台灣，中國外交部八月五日宣布對美採取八點反制措施：其中包括停止雙方軍事磋商、對話；暫停非法移民遣返、刑事司法協助，打擊跨國犯罪等合作。但是最後有一項，暫停中美氣候變化商談，...,https://udn.com/news/story/7339/6519998
0,1,1,2246,外媒：亞洲政治風險已增加,2022-08-08,美國眾院議長裴洛西訪台，觸發解放軍對台灣展開「封島」軍演，成為外媒關注的焦點。在中共軍演期間，台灣民眾生活如常，台股和美股雖有反應但未失控，華爾街日報報導，市場沒有反映這次軍演的真正意義，因為它已標...,https://udn.com/news/story/10930/6520120
1,1,1,2247,政府：難確定中共停止軍演 農產品被禁恐只是開端,2022-08-08,美國眾議院議長裴洛西訪台，引起中國大陸大動作反制，昨天軍演進入第四天。政府人士指出，中共昨天宣布「繼續對台周邊海空域進行實戰化聯合演訓」，除了消耗我方作戰成本，也有安定中國內部民意的意味；至於中共是...,https://udn.com/news/story/10930/6520114
0,1,1,2248,iPhone 14傳中印同步生產,2022-08-08,美中衝突升高，市場傳出，蘋果預定今年9月發表的iPhone 14新機，將首度在中國大陸與印度兩地同步生產，印度製造仍以鴻海（2317）集團為最重要夥伴，凸顯地緣政治衝擊下，蘋果擴大非中國大陸iPho...,https://udn.com/news/story/7240/6520068
0,0,0,2249,陸上半年輕工商品零售額 逾3.3兆人民幣,2022-08-08,大陸工業和信息化部6日發布的數據顯示，上半年，輕工十類商品零售額3兆3480億元（人民幣，下同），同比增長2.1%。其中，生活必需類產品表現較好，糧油食品類、飲料類、菸酒類商品零售類值同比分別增長9...,https://udn.com/news/story/7333/6520154
0,0,0,2250,陸首條雙流制鐵路通車,2022-08-08,重慶市郊鐵路跳磴至江津線（江跳線）於6日下午正式通車，是中國大陸首條應用雙流制車輛的線路，也是重慶首條市郊鐵路。中新社報導，「盼了好久，終於盼到通車。」重慶江津人王楊說，江跳線為他節約了出行成本、時...,https://udn.com/news/story/7332/6520172
1,1,1,2251,菲律賓憂台海危機 研商撤僑計畫,2022-08-08,共軍在台海周邊軍演之際，美國國務卿布林肯六日造訪菲律賓會晤菲國總統馬可仕。布林肯除強調美菲聯盟重要性，還保證菲國若在南海受攻擊，將援引「美菲共同防禦條約」協防。菲國媒體報導，在台灣的菲國僑民社群憂心...,https://udn.com/news/story/10930/6520134
0,0,0,2252,全球不到3500隻瀕危大白鯊 誰端牠上餐桌？,2022-08-08,無論是瀕危的大白鯊，還是已被宣告滅絕的長江白鱘，當珍稀水生動物加速減少，有人與物種滅絕的速度賽跑，能救一隻是一隻；也有人無視法令，反而建構非法鏈條圖利，能賣一隻是一隻。近日，百萬粉絲博主「提子」烹煮...,https://udn.com/news/story/7332/6520167
1,1,1,2253,台灣海峽中線以東 陸稱軍演常態化,2022-08-08,中國大陸昨中午結束此波台海實彈演習，大陸官媒中央電視台列出本次軍演的十個突破，報導稱今後共軍飛機船艦會常態化在海峽中線以東進行訓練。陸指不存在海峽中線在此次共軍軍演前，美方就研判中共會進一步推動台灣...,https://udn.com/news/story/10930/6520180
0,0,0,2254,如果1970年決定「救魚」…長江白鱘能逃過滅絕命運？,2022-08-08,百萬網紅吃播國際瀕危野生動物大白鯊引來輿論撻伐，以及對珍稀生物保育的重視。不少網民想起日前被國際自然保育聯盟（IUCN）正式宣告滅絕的「中國淡水魚之王」長江白鱘。長江白鱘以其滅絕提醒人類，對於珍稀水...,https://udn.com/news/story/7332/6520168
0,0,0,2255,新疆新梅採摘 果品遠銷東南亞,2022-08-08,眼下，中國新梅重要產區——新疆喀什地區伽師縣新梅陸續成熟進入採摘季。由於品質好、耐儲存，吸引全大陸多地經銷商前來收購，部分產品還將出口東南亞國家。中新社報導，河南省水果批發商朱東晴一周前趕到伽師縣，...,https://udn.com/news/story/7333/6519991
1,1,1,2256,FT：美中經濟脫鉤 沒那麼快,2022-08-08,共軍上周在台灣周圍發動大規模軍事演習後，分析家都認為美中經濟關係將加速脫鉤，但英國金融時報（FT）專欄作者劉易士（Leo Lewis）認為，美中經濟脫鉤的速度不會有人們所想的那麼快。支持美中將快速脫...,https://udn.com/news/story/6811/6520015
0,1,1,2257,薛曼訪索羅門 籲各國對抗暴政,2022-08-08,美國副國務卿薛曼為參加第二次世界大戰瓜達卡納島戰役八十周年紀念活動，訪問索羅門群島，她七日向太平洋島國示警，要各國與渴望擁有權力的暴力政權進行新一波的奮戰。法新社報導，隨著共軍在台灣周遭進行軍事演習...,https://udn.com/news/story/6809/6520186
1,1,1,2258,美印10月將聯合軍演,2022-08-08,在美中關係緊張之際，據美媒CNN報導，十月，美軍和印度都將在接近中印爭議邊境處，進行高海拔作戰訓練，引發關注。值得注意的是，在消息傳出後，大陸官媒「央視軍事」昨也在官方微博上，貼出近日共軍西藏軍區在...,https://udn.com/news/story/6809/6520187
1,1,1,2259,南韓外長今訪陸 台海議題受關注,2022-08-08,南韓外長朴振八日起將訪問中國大陸三天，與大陸國務委員兼外長王毅會談，外界關注雙方是否會談及台海問題、晶片供應鏈合作及薩德反飛彈系統等敏感議題。韓聯社報導，在美中圍繞台海問題緊張局勢進一步升級情況下，...,https://udn.com/news/story/6809/6520184
0,1,1,2260,華爾街日報：亞洲政治風險重塑,2022-08-08,美國聯邦眾議院議長裴洛西訪台，觸發共軍對台灣展開「封島」軍演，促使金融市場劇烈震盪，但幾天後就回穩。華爾街日報（WSJ）分析，裴洛西訪台象徵美中關係與兩岸戰略環境的重大轉折點，已重塑亞洲的政治風險，...,https://udn.com/news/story/122972/6520023
0,0,0,2261,電子業庫存風暴／電腦 年底才會改善,2022-08-08,PC品牌廠在經過兩年疫情紅利後，由於先前零組件長短料問題加上市況反轉速度太快，導致今年累積大量庫存，以台灣品牌廠來看，目前華碩（2357）庫存水位相較宏碁高，不過，兩大品牌廠預計，庫存水位要到今年底...,https://udn.com/news/story/7240/6519943
0,0,0,2262,歐亞搶購天然氣 助漲行情,2022-08-08,為了幫過冬做準備，歐洲與亞洲國家正更激烈搶購天然氣，這可能帶動液化天然氣（LNG）價格進一步飆漲，加劇生活成本危機。英國金融時報（FT）報導，全球第二大天然氣進口國日本及第三大進口國南韓，正設法提前...,https://udn.com/news/story/6811/6520013
0,0,0,2263,可成抱現金 香港股東質疑,2022-08-08,英國金融時報6日引述知情人士報導，蘋果的手機機殼供應商可成科技（2474）正受到香港投資業者亞皆老街管理有限公司（Argyle Street Management）的挑戰，要求這家台廠改善治理，並將...,https://udn.com/news/story/7333/6520020
0,0,0,2264,陸7月出口增18％ 超預期,2022-08-08,大陸海關總署昨（7）日公布進出口數據顯示，以美元計算，7月出口金額年增18％，進口年增2.3％，分別較6月擴大0.1、1.3個百分點，7月出口並創下今年以來的最快增長速度。由於進口數據偏低，但出口穩...,https://udn.com/news/story/7333/6519945
0,0,0,2265,大陸外匯存底反轉 小幅回升,2022-08-08,"大陸7月外匯存底出現轉折走高，今年上半年大陸外匯存底規模整體呈現小幅下降趨勢，上半年共計下降1,789億美元，大陸國家外匯管理局昨（7）日公布7月外匯存底規模3兆1,041億美元，較6月增加328億...",https://udn.com/news/story/7333/6519955
