title,date,summary,link,content
中美關係的清單與護欄,2022-07-17,　7月9日，中國外交部長王毅和美國國務卿布林肯在印尼G20外長會議結束後舉行會晤，王毅向美方提出4項清單，布林肯則認為中美應建立護欄。近期中美軍事、外交、經濟領域高階官員共有5次頻繁互動，這是拜登政府執政以來前所未有，可謂是中美關係的互動新模式，亦即清單與護欄的動態互動與關係修正。,https://www.chinatimes.com/newspapers/20220717000381-260109,7月9日，中國外交部長王毅和美國國務卿布林肯在印尼G20外長會議結束後舉行會晤，王毅向美方提出4項清單，布林肯則認為中美應建立護欄。近期中美軍事、外交、經濟領域高階官員共有5次頻繁互動，這是拜登政府執政以來前所未有，可謂是中美關係的互動新模式，亦即清單與護欄的動態互動與關係修正。早在去年7月，美國常務副國務卿雪蔓和中國外交部副部長謝鋒的天津會談，謝鋒即向雪蔓提出兩份清單，一份是要求美國糾正對於中國的錯誤政策和言行，另一份則是中國關切的重點個案清單。「謝鋒清單」是要求美國停止打壓中國企業與個人，以及要求美國保護中國公民和機構在美的合法權益。這次的「王毅清單」則是更進一步提高訴求內容，包含4項清單項目，既包括在去年「謝鋒清單」，再加上新的兩份清單：中方重點關切的美涉華法案清單，以及包括中美8個領域的合作清單。至於美國對中國的清單呢？其實就是美國行政部門採取的「制裁清單」與「實體清單」，特別川普與拜登持續在貿易戰、科技戰、人權戰等層面，提出制裁中國與遏制中國的各類清單。川普政府開始大幅使用制裁清單，包含2018年制裁中國購買俄羅斯軍事裝備、2019年制裁中國企業參與解放軍研究、2019年制裁違反美國制裁伊朗令的中國企業；2019年川普簽署行政命令宣布進入國家緊急狀態，禁止華為等中國通訊企業；2019年宣布中國企業因違反美國的新疆政策，列入美國管制實體清單。拜登政府上台後持續加碼制裁中國企業與個人，2020年因香港問題與人權議題，美國制裁中國官員與個人；2020年8月，美國商務部宣布將中國交通建設5家下屬企業列入美國出口管制實體清單；2021年4月，美國商務部以破壞美國軍事現代化為由將7個中國超級計算機實體列入實體清單；2022年2月，美國商務部宣布，將33家中國企業與實體列入出口管制「未經驗證清單」。顯見中美清單大有不同，中國清單是糾正錯誤、要求改善，在雙邊關係上畫紅線，不應越界，類似防禦性作為，但帶有可能反制的警告意味。美國的清單則是制裁、遏制中國的科技、軍事、人權，明顯是攻擊性壓制中國的發展與挑戰。至於中美間的護欄是一種避險，亦即避免誤判、防止衝突發生，雙方藉以緩和緊繃的關係。但中美兩國對於護欄有不同認知與解讀，美國將高層互動溝通視為主要護欄，而中國則將信守雙邊關係承諾視為有意義的護欄。近期美國連續主動邀約中國高層互動，除維繫護欄外，主要應該是美國嚴重通膨經濟問題，造成拜登支持率下降，因此希望與北京互動讓關係穩定。至於中國大陸對於中美之間的護欄，明確回應就是中美三個聯合公報，顯然將護欄視為一種保證，特別是針對美國的對台政策，視為中美關係避免走向衝突的核心議題。此外，王毅這次提出的「中美8個領域合作清單」，在氣候變化、公共衛生、糧食安全、能源安全、半島穩定等諸多領域，中美有可能提出一些具體合作方案，透過部門對話與合作，則也是中方提出的護欄。在當前國際與美國內部形勢下，中美雙方都有改善關係的意願，但是，布林肯先後提出「競爭、合作、對抗」和「投資─結盟─競爭」的對中關係三分法論述，護欄與合作只是避免衝突，關係緩和只是權宜，未來中美關係仍會在清單與護欄交錯中，維持競爭與對抗的主軸。（作者為前國安會副秘書長）
英國前首相布萊爾：籲西方國家起身對抗中國,2022-07-17,英國前首相布萊爾（Tony Blair）當地時間16日在迪奇利基金會（Ditchley Foundation）活動的年度演講中表示，西方主導政治和經濟的時代即將結束，並鼓吹西方國家團結起來，發展一貫的策略來應對中國崛起為「世界第二超級大國」。,https://www.chinatimes.com/realtimenews/20220717001282-260408,英國前首相布萊爾（Tony Blair）當地時間16日在迪奇利基金會（Ditchley Foundation）活動的年度演講中表示，西方主導政治和經濟的時代即將結束，並鼓吹西方國家團結起來，發展一貫的策略來應對中國崛起為「世界第二超級大國」。據英國《衛報》報導，布萊爾認為，西方對華政策應該是「實力加接觸」，西方應增加防衛預算以維持自身的軍事優勢，同時藉由與開發中國家建立關係以擴大自己的「軟實力」。另外，西方國家應盡快停止國內政治的「瘋狂」，讓理性和戰略重新歸位。布萊爾表示，中國已在許多科技領域追上美國，且中國國家主席習近平毫不掩飾他要把台灣納入北京統治的野心。同時，俄國總統普丁對烏克蘭「野蠻與錯誤」的侵略行為，將使中俄兩國在現有的國際秩序中，很難被世界主要國家所接受。布萊爾說，北京要競爭的不只是權力，還針對西方的體制與治理、生活方式，西方因此需要加強捍衛自身的體制與價值觀。「本世紀最大的地緣政治挑戰將來自中國，而非俄羅斯」，他說，「我們將迎來西方政治和經濟在主導地位上的終結。世界將至少是兩極的，甚至是多極的。這將是現代史上東方首次與西方平起平坐。」
亞洲盃男籃》林庭謙單場30分 陸媒讚：驚出中國隊冷汗,2022-07-17,中華隊16日在亞洲盃男籃的兩岸大戰落敗，在對手的身高與體能優勢下，中華隊林庭謙仍砍下全場最高30分。林庭謙的勇猛獲得大陸媒體稱讚：「林庭謙是CBA聯賽2020年的探花，過去兩個賽季都在CBA天津隊效力，經過兩年的成長，林庭謙已經蛻變成為了CBA非常出色的後衛。」,https://www.chinatimes.com/realtimenews/20220717001597-260403,中華隊16日在亞洲盃男籃的兩岸大戰落敗，在對手的身高與體能優勢下，中華隊林庭謙仍砍下全場最高30分。林庭謙的勇猛獲得大陸媒體稱讚：「林庭謙是CBA聯賽2020年的探花，過去兩個賽季都在CBA天津隊效力，經過兩年的成長，林庭謙已經蛻變成為了CBA非常出色的後衛。」這篇在陸媒《新浪體育》的文章還提到：「林庭謙的高效表現給中國男籃製造了不小的麻煩。」「驚出中國男籃冷汗。」大陸球迷也留言稱讚：林庭謙大心臟、投籃準是他的特點。也有球迷指出中國隊調度失當，被林庭謙打爆了廣東隊的組合，也就是胡明軒與徐杰。胡徐兩人聯手拿下23分表現不差，但是林庭謙17投10中、外線8投3中，攻下30分、5助攻、2抄截，球員效率+29是全場最高。中國隊效率最佳的是+22的趙睿，他攻下15分、4籃板、6助攻、3抄截。中國隊最後95比80獲勝，不過中華隊下半場一度追到3分差距，打完前3節已到極限，末節就難以再拉近差距。中華隊最後一球也是林庭謙在最後半分鐘投進（三分球），他打到終場前22秒才被換下。事實上中華隊能打進今年亞洲盃會內賽也是多虧林庭謙，他去年8月在資格賽表現優異，包括最後20秒在對手包夾下射進關鍵中距離，擊退關島才取得門票。
華爾街高管：投資撤離中國 回流強化美經濟,2022-07-17,　洛克菲勒資本管理公司執行長弗萊明表示，由於地緣政治緊張加劇和北京嚴格清零的限制，金融機構對中國的擴張越來越謹慎。在資本投資水平的回調，將促進美國半導體等製造業，此舉將加強美國經濟。北京大學經濟學院教授曹和平則指出，整個業界低估了這次疫情對上海造成的影響，大眾對經濟的預期也已遭到傷害。,https://www.chinatimes.com/newspapers/20220717000534-260303,洛克菲勒資本管理公司執行長弗萊明表示，由於地緣政治緊張加劇和北京嚴格清零的限制，金融機構對中國的擴張越來越謹慎。在資本投資水平的回調，將促進美國半導體等製造業，此舉將加強美國經濟。北京大學經濟學院教授曹和平則指出，整個業界低估了這次疫情對上海造成的影響，大眾對經濟的預期也已遭到傷害。弗萊明接受美媒訪問時說：「在資本投資水平和成長戰略的積極性方面，將會更加謹慎。」他預計這種回調，將促進美國半導體等精密產品的製造，此舉將加強美國經濟。不過，同時也可能刺激已高漲的通貨膨脹率。弗萊明稱，過去美國主要金融公司，都試圖在亞洲市場建立業務，但現在無論是金融還是貿易方面，都準備撤回國內市場。大陸第2季經濟成長率陡降至0.4％，上半年GDP年成長2.5％。曹和平指出，確實低於預期。主要原因之一是整個業界低估這次疫情肆虐對上海的影響，低估了長三角和環渤海地區連帶受影響後對經濟的傷害。曹和平說，上海疫情一出現，在封控、動態清零的過程中物流被中斷。物流一中斷，工廠出貨就停了，出貨一停就會導致停工停產，這些傷害都是實實在在的。一是傷害生產，二是傷害消費，這是之前沒遇過的情況。被問到疫情對經濟的影響似乎變得更「常態」，曹和平稱，大眾對經濟的預期確實遭到傷害。如最近爆發的河南村鎮銀行事件，就是人們對小銀行信心不足造成的擠兌。他強調，目前還來得及在政策上加強支持力度，呼籲整個社會共度艱難時刻，保護大眾對經濟的預期，尤其要加強對年輕人的支持。現在的就業形勢，年輕人是最難的。對於目前消費信心不足，曹和平建議向民眾發消費券，一人2萬人民幣。補貼消費者比補貼企業更划算。對於大陸全年成長目標5.5％，曹和平坦言，如果要達到該目標，下半年成長就要到9％，這顯然不現實。他預期下半年增速達6％有可能，所以全年增速目標調整到4％至4.5％，是較合理的預期。中國前財長朱光耀16日在北京一論壇上表示，當前世界面臨二次大戰結束以來最嚴重的系統性危機，全球經濟衰退，供應鏈受嚴重衝擊，並出現全球債務危機。目前應保持中國經濟穩定向前發展，盡快使中國經濟成長回到潛在的生產力水平，即是5％至6％成長。《環球時報》前總編輯胡錫進則稱，基本面不是可以一直吃下去的老本，公眾對基本面的闡述已有點累了，中國須用下半年的高成長證明上半年經濟低迷是臨時的。
上海張文宏團隊警示：酷熱中暑風險太高 執行防疫勿穿防護服,2022-07-17,知名華山醫院張文宏教授團隊呼籲，近期熱浪席捲大半個中國，穿著白色防護服執行疫情防控的人工作時會大幅增加中暑風險，原則上配 N95口罩再加戴面屏防護，並執行手部衛生就可以，不應該再鼓勵或規定必須穿著被稱為「大白」的全身式防護服 。,https://www.chinatimes.com/realtimenews/20220717003040-260409,知名華山醫院張文宏教授團隊呼籲，近期熱浪席捲大半個中國，穿著白色防護服執行疫情防控的人工作時會大幅增加中暑風險，原則上配 N95口罩再加戴面屏防護，並執行手部衛生就可以，不應該再鼓勵或規定必須穿著被稱為「大白」的全身式防護服 。大陸復旦大學附屬醫院張文宏團隊在其微博公眾號@華山感染示警稱，近期天氣酷熱，穿著白色防護服執行疫情防控的人員如果繼續穿著醫用防護服，會大大增加中暑的風險。工作人員原則上只要「一級+」的防護措施應該就能足以防止被感染，近距離接觸時可以在N95口罩的基礎上戴面屏防護，而不應該再鼓勵或規定必須穿著「大白」。陸媒《快科技》在報導中指出，被汗水浸透的「大白」防護作用會大打折扣。公眾號@華山感染指出，「至於普通的防疫工作者（非採樣人員），尤其在炎熱夏天的戶外環境，我們推薦正確規範佩戴口罩，並注意手衛生就可。」此外，該文還醒，對於必須在炎熱的夏季工作的防疫人員，也應注意階段性休息與飲水，工作時間不應過長，如有中暑症狀應該及時暫停工作，轉移到陰涼通風的環境中補充水分。尤其是高於41°C的溫度幾乎都是異常和有害的。在高溫條件下，核心產生的代謝熱量必須轉移到皮膚，一環境溫度上升到35°C以上，防護服就不可能通過傳導、對流或輻射來散熱。此時若穿著防護服，全身汗液直接從身體上滴下，所有的散熱途徑都被阻止時，人體的溫度會急劇上升，進而導致中暑。如果發現不及時、處理不正確都可能導致不可逆轉的損傷，乃至死亡。報導說，醫學上根據發病機制和臨床表現不同，中暑通常分為熱痙攣、熱衰竭和熱射病。復旦大學中山醫院團隊對民眾示應稱，嚴重中暑是一種致命性急症，發病早期有大量冷汗，繼而無汗、呼吸淺快、脈搏細速、躁動不安、神志模糊、血壓下降，逐漸向昏迷伴四肢抽搐發展；嚴重者可產生腦水腫、肺水腫、心力衰竭等，甚至可能危及生命。「如果有人發生中暑，要立刻脫離高溫環境，迅速轉移至陰涼通風處。將中暑者平臥，頭部抬高，鬆解衣扣。而7月14日大陸江西省南昌就有醫護人員於因為穿著防護服在38℃的室外天氣下連續數天從事核酸檢測工作，導致重度中暑，也就是熱射病。報導指出，在發布的視頻中，罹患熱射病的護士躺在搶救室的病床上，四肢不停地抽，一位外科醫生認為，「這是癲癇發作症狀，說明她的腦部已經受到了熱損傷。這種病患，即使能夠搶救回來，病人的腦損傷也是不可逆的。」
經濟數據難看 陸統計局巧手美化圖表 網民被逗笑了,2022-07-18,日前大陸國家統計局發布2022第2季度經濟數據，由於各地面臨疫情採取嚴格封控措施，經濟數據難看已在各界預料之中。正式公布的第二季國內生產總值（GDP）數據仍較去年同期增長0.4%，差一點落入負成長，雖離目標有較大差距，但仍合乎外界預期。不過外界特別注意到，統計局面對難看的數字，特別在製作表格時下了點功夫略作美化，把網民們都逗笑了。,https://www.chinatimes.com/realtimenews/20220718004635-260409,日前大陸國家統計局發布2022第2季度經濟數據，由於各地面臨疫情採取嚴格封控措施，經濟數據難看已在各界預料之中。正式公布的第二季國內生產總值（GDP）數據仍較去年同期增長0.4%，差一點落入負成長，雖離目標有較大差距，但仍合乎外界預期。不過外界特別注意到，統計局面對難看的數字，特別在製作表格時下了點功夫略作美化，把網民們都逗笑了。大陸國家統計局發佈2022年第2季度和上半年國內生產總值初步核算結果顯示，二季度GDP總值562642億元，按不變價格計算同比增長0.4%，上半年同比增長2.5%。媒體分析稱，如果要按全年實現5.5%的經濟增長目標，下半年就要實現8%的增長，這顯然是個巨大的考驗。刊登在大陸網上一篇由署名「博士候」的作者指出，這個嚴峻的形勢關係到中國大陸上的每一個人，倒是統計局公布的一張圖，卻把作者逗笑了。文章說，統計局公布一張反映2021年1-4季度以及2022年1-2季度的國內生產總值增長速度圖（按季度與去年同期比較），乍看之下，雖然總體呈現下降趨勢，但是曲線還算平穩。然而，走勢平穩說明問題不大？如果再仔細觀察一下圖中的橫軸和縱軸就發現有點不尋常，文章指出，因為這圖不是以「0」為坐標原點，而是用的「-10」。這樣一來，即便2022年2季度的增長僅僅為0.4%，體現到這張圖上就會給人一種「超過0很多」的錯覺。作者說，「這操作就好像……星巴克的咖啡，您要中杯、大杯，還是超大杯呢？沒有小杯哦！親~」按照一般的畫法，應該是怎樣的呢？作者也自己用手繪了一張圖，看起來確實不太好看，第2季度GDP幾乎是趴在地上，看起來驚悚多了。有許多網民也藉此發表各種不同看法的。一位網民稱：「同樣的數據，是不是曲線陡然變得『驚悚』了不少呢？我們不便揣測原圖的作者為什麼要以-10為原點，但原圖確實給人一種『穩中稍降』的觀感。」另一位網民評論說：「上半年的大環境不好，我們每個人都清楚，大家也沒對統計數據報以多大的期待。這種掩耳盜鈴的套路，不用也罷。倒是下半年，為了全年5.5%的目標，政策上會為促經濟創造條件，我們作為勞動者，也會開足馬力，不僅為一個好的數據，更為好的生活。」還有許多網民回應是哈哈大笑，也有網民說：「做這張圖的人夠我學一輩子」、「從4.8降到0.4感覺沒降多少」、「以後跟領導匯報就這麼畫」。據國外學術網站指出，這篇文章在微博刊出不久後即遭到審查下架，理由是「內容違反相關法律規定」。不過文章還是有很大網站轉載，而且已廣為流傳。
廣西北海疫情突起 6天逾500例2000多名遊客滯留,2022-07-18,廣西北海是全大陸著名的旅遊城市，每年都有很多遊客慕名前來。但因為近日突發疫情升溫，目前仍有2000多名遊客滯留北海。截至7月17日24時，廣西本輪疫情已有本土確診病例68例、無症狀感染者495例。影響最嚴重的旅遊城市北海，現有本土確診病例68例、無症狀感染者464例。,https://www.chinatimes.com/realtimenews/20220718001342-260409,廣西北海是全大陸著名的旅遊城市，每年都有很多遊客慕名前來。但因為近日突發疫情升溫，目前仍有2000多名遊客滯留北海。截至7月17日24時，廣西本輪疫情已有本土確診病例68例、無症狀感染者495例。影響最嚴重的旅遊城市北海，現有本土確診病例68例、無症狀感染者464例。根據觀察者網報導，北海市是廣西重點僑鄉之一，是知名的大陸南方濱海旅遊城市。該市自14日起，全市A級旅遊景區暫停開放。而7月17日上午，北海市召開新冠肺炎疫情防控第五場新聞發佈會時表示，目前有2000多名遊客滯留北海。針對滯留遊客反映的問題，已成立旅遊服務專班進行保障工作，確保滯留遊客的訴求得到積極回應和穩妥處置。同時積極協調民航、鐵路、公路等客運企業，儘快落實旅客返程保障措施。回顧7月12日，廣西北海市海城區確診首例無症狀感染者。之後數日北海疫情突起。據廣西衛健委通報，7月17日全天廣西新增本土確診病例59例（均在北海市，其中海城區41例、銀海區12例、合浦縣5例、鐵山港區1例），含31例無症狀感染者轉為確診病例（均在北海市），無症狀感染者53例（北海市51例，其中海城區28例、銀海區13例、合浦縣8例、鐵山港區2例；南寧市賓陽縣1例；欽州市浦北縣1例）。而據北海市通報，該市「7·12疫情」首報病例感染病毒為奧密克戎BA.2.3，未發現與廣西本土和輸入病例同源性高的基因組序列，也未發現與國內其他省份病例同源性高的基因組序列。當前，北海疫情防控形勢嚴峻複雜，社區隱匿傳播風險較大，人員聚集及跨區域活動將增大疫情傳播風險。
F35為美中大戰準備 與兩款神隊友搭檔影片曝光,2022-07-18,F-35要和無人僚機搭檔了，洛克希德馬丁（Lockheed Martin）公開的影片顯示，美國空軍戰機將搭配神風自殺無人機，還有較先進的無人僚機。,https://www.chinatimes.com/realtimenews/20220718001531-260417,F-35要和無人僚機搭檔了，洛克希德馬丁（Lockheed Martin）公開的影片顯示，美國空軍戰機將搭配神風自殺無人機，還有較先進的無人僚機。據《防務新聞》（Defense News）和《歐亞時報》（The EurAsian Times）17日報導，洛馬旗下的「臭鼬工廠」（Skunk Works）透露，美國空軍最快在3年內就能飛這自殺無人機。英國法恩堡航空展（Farnborough Airshow）7月18-22日即將在倫敦登場，據「臭鼬工廠」副總裁兼總經理柯拉克（John Clark）說，自殺無人機的價格遠比較先進的無人機低，也能更快交付。由於美國空軍高層官員說，10年內美中可能爆發戰爭，洛馬希望這些自殺無人機能在萬一爆發衝突時派上用場。柯拉克說，他們真的在討論未來3—4年內，相關無人機能發揮戰力，這樣駐太平洋美軍萬一需要時，就能有工具可用。柯拉克說，至於較先進的無人機，則可能在2030年代開始亮相。它們戰力更強，包括每次執行任務，重返基地，以供下次重複使用的能力在內。按洛馬設想，這些無人機會返回根據空軍「敏捷戰鬥部署」（ACE）概念所建立的基地，其中包括更簡樸、分散，並在某些狀況下使用簡陋跑道的基地。長久以來，美國空軍一直致力要增加無人機的自主性和人工智慧（AI）性能。美國空軍部長肯達爾（Frank Kendall）不斷強調，他很希望1架如F-35，或是「下世代空優」（NGAD）等有人戰機能搭配多達5架無人機。他今年稍早說，把有人-無人戰機搭檔的概念化為現實，是他最優先的要務之一。柯拉克指出，隨著F-16等較老的戰機開始逐漸耗損，這些有人和無人機搭檔，將有助於美國空軍在未來10年間維持戰力。而按照洛馬設想，這些無人機將發揮分布式團隊的部分角色，它們各有協調的角色需要扮演，也要和載人戰機相輔相成。儘管柯拉克說，「臭鼬工廠」還沒準備要公開相關無人機的影像，但洛馬張貼的概念錄影卻顯示，這種分佈式團隊概念可能如何運作。動畫中展現了F-35和各式無人機群共飛，而其中1架外型很像B-21轟炸機。此外，在影片中，F-35和無人機蜂群編隊飛入激烈競爭的空域，其中有些無人機充當誘餌，趁其他無人機發揮電戰性能，以對付敵方防空系統時，吸引面對空飛彈攻擊。至於其他情資，監視和偵察無人機則辨識出隱藏的地對空砲台位置，並將這些數據回傳給載人的F-35。而另一組武裝無人機則由 F-35 飛行員指揮，向前進攻，並擊落敵機。
