title,date,summary,link,content
環太軍演期間 解放軍擴大繞台,2022-07-09,　中美對峙氣氛升高，台灣問題成為焦點。在美國聯邦參議員史考特（Rick Scott）8日率團訪台，以及以美國為主的環太平洋軍事演習期間，中共解放軍也在台灣周邊海空域進行多軍種聯合戰備警巡和實戰演練，大陸戰機8日並飛越海峽中線。兩強互相「秀肌肉」引發關注。,https://www.chinatimes.com/newspapers/20220709000224-260203,"中美近日針對台灣問題你來我往。美國國務卿布林肯（Antony Blinken）本週G20外長會議期間將與大陸外長王毅進行場邊會晤前夕，美國聯邦參議員史考特8日率團訪台，並獲總統蔡英文接見。路透報導，當日有數架大陸軍機自台灣海峽北端飛越海峽中線進行戰術任務，示威意味頗濃。綜合外媒8日報導，號稱史上最大規模的聯合軍演：2022年環太平洋軍事演習，正在美國夏威夷珍珠港進行。在美國主導下，本次軍演多達26國參加，日本和韓國都派出高規格軍艦參與，共計38艘船艦、4艘潛水艇、9支國家陸軍部隊、170架軍機，超過2.5萬人展開一個月以上的聯合訓練。報導指出，台灣雖未受邀參加本次軍演，但這次演習仍跟台灣息息相關。尤其美軍3月剛成立的「陸戰隊濱海團」首次亮相，兵力約2,000人，演習期間將進行跳島訓練，被視為美國針對大陸武力犯台的戰術應對。大陸央視報導，中共解放軍東部戰區新聞發言人施毅8日表示，近日解放軍東部戰區在台島周邊海空域組織多軍兵種聯合戰備警巡和實戰化演練。他指出，近來美方在台灣問題上動作不斷，給台獨分裂勢力撐腰打氣，只會擾亂台海和平、加劇地區緊張。另一方面，中共中央軍委委員、軍委聯合參謀部參謀長李作成，7日與美軍參謀首長聯席會議主席米利（Mark Milly）視訊通話。李作成表示，中國在事關國家核心利益的問題上，沒有任何妥協退讓餘地，要求美方停止美台軍事勾連，避免衝擊兩國關係和台海穩定，並強調大陸軍隊堅決捍衛國家主權和領土完整。"
兩岸看世界》法國人，千方百計辱美辱英,2022-07-09,,https://www.chinatimes.com/opinion/20220709000003-262106,"世界上很多臨近國家都有互相貶損嘲笑的「業餘愛好」，比如荷蘭和比利時，比如巴西和阿根廷，再比如摩洛哥和土耳其。但如果要選出一對這方面的「世界之最」，那肯定是英國和法國。這兩國的人，從領袖到平民互相嘲諷的段子如果總結起來甭說三天三夜，就是一年半載也理不完。後來法國人嫌不過癮，乾脆把美國人和哪怕說英語的人也全捎上了。今天我從法國的角度出發，挑一些歷史上，網路上與現實中我遇見的趣事跟大家分享，就當拋磚引玉吧。一、那些段子英法兩國的梁子可結了不止一天兩天了，遠到百年戰爭，近到買賣紛爭，那可是從血雨腥風到吃醋爭風，一刻都沒閒著。先講一個我大學時聽到的段子，說一個旅人到了一個地方，如果發現那裡的牛比姑娘長得好看，那甭問，他/她肯定是到了倫敦了。再來講講法國人的熱情好客，說一個英國人如果在法國問路，那他/她大概率會被告知兩條路——一是通往機場的路，二是通往海底隧道的路，總之，是一條能最快滾回英國的路。下面來說幾條法國「官方」的段子。法國歐洲事務部長娜塔莉•盧瓦索的小貓常為留在房間還是出去玩耍猶豫不決。於是，這位女部長決定把她的貓取名為「脫歐」。將法式美食視為驕傲的法國曾以總統級的最高禮遇埋汰過英國。2005年7月，法國總統席哈克在會晤俄總統普丁與德總理施羅德時毫無掩飾地嘲笑英國食物：「英國菜是世界上最糟糕的菜。英國對歐洲農業唯一的貢獻就是瘋牛病。廚藝差到這地步，咋可能辦得好奧運？！」這番評論引來了俄，德兩國領導人的哄堂大笑（他們笑的同時不害臊嗎？）。除了總統，法國民間也有人管英國人叫「半熟牛肉（Rosbif，烤牛肉的一種，通常是只把外皮烤熟，裡面還是粉嫩帶血的肉）」以嘲笑英國人不會做大餐，只會烤半生不熟的肉吃。英國食物被嘲笑至此，美國「美食」在法國人嘴裡就更不堪了。法國人一邊吃著麥當勞，肯德基，一邊大罵美國的快餐業對法國是「垃圾食品入侵」，「快餐文化入侵」。而創造這些食品的人則是一些用大紙杯子喝可樂，滿手油污啃漢堡的美國農民……法國歷史上也多次出現過反麥當勞運動。不光美國食物，美國時事也是法國人找樂子的焦點。當年重振美國經濟的第42任總統柯林頓跟白宮實習生萊溫斯基鬧出婚外情後，美國大小媒體一致對其口誅筆伐，眾議院還對其發起了彈劾。法國人隔岸吃瓜，看了個大樂子，臨了兒還不忘奚落一下全體美國人。當時有些法媒甚至破天荒地用英語標題嘲諷美國人——「Americans, grow up!/美國人，長大吧！」意思就是，像這種婚外戀在法國壓根兒就不叫事兒。因為這點屁事兒去彈劾一個把經濟搞得特好的總統，你們美國人真的是天真幼稚到家了，一點兒都不像成熟的成年人！川普在任期間，法國人的群嘲無比密集，尤其是當他新冠檢測呈陽性之後。法國網友們是怎樣留言的呢？「Enfin une bonne nouvelle（終於有好消息了）」，「Bonne chance au virus！（祝病毒好運！）」都屬於基本操作了，還有更毒舌的「Pauvre coronavirus！（可憐的新冠病毒！）」當然，法國人也沒有放過川普的死敵拜登。最新一個關於拜登的笑話是這樣的：法國人A：「我認為美國人被拜登洗腦了！」法國人B：「那是不可能的！」法國人A：「為什麼？」法國人B：「因為美國人沒腦」……二、現實中的實例現實中，法國人不但嘲笑英美人的食品，連泡個酒吧喝酒都看英美人不順眼。歐美的酒吧文化非常普及，無數人都喜歡在空暇時間去喜歡的酒吧喝上幾口兒。然而法國的酒吧文化與英美的不同，法國人更喜歡那種古樸的，精緻的，有氛圍的酒吧。這種酒吧通常很小，但是很有味道，能坐下來細細地品酒。而美國人則更喜歡空間大的酒吧，英國人喜歡鬧鬧騰騰的酒吧。有一次，我的法國朋友薩巴斯蒂安路過他家附近的一個小酒吧時正遇兩個美國遊客從裡面出來。只聽其中一人對另一人笑道：「That was a tiny little bar」，嘲笑法國酒吧侷促。薩巴斯蒂安聽罷當即非常反感，他甚至都不屑於說「你懂個屁！」之類的評語，而是直接搖搖頭，只冷冷地說了一個單詞——「American」……而英國人在法國泡吧就更令人討厭了。與法國人品酒細聊的安靜酒吧文化不同，英國人，尤其是部分年輕人，把在酒吧裡嘲笑陌生人，甚至找茬兒打架鬥毆當成了業餘運動。一位中國青年曾把自己的真實經歷發到了法國一個中文論壇上。他在尼斯旅行，晚上去了一個酒吧喝酒。進去沒多久就遇到兩個英音口音的青年用英語問他從哪兒來。他起初以為對方是表示友好，回答了「China」。結果對方答：「我聽說過香港，台灣，還真沒聽說過China」。中國青年回問他倆從哪來，對方回答「英格蘭」。他則以一句典型的法國句式回應了他們丫的：「我聽說蘇格蘭，威爾士，還真沒聽說過英格蘭」……那兩個英格蘭人聽後惱羞成怒要打人，中國青年也不甘示弱，後被酒吧內其他人勸開了。這樣的英國酒客並非少數，所以他們在法國人眼中有三大特質：1，酗酒；2，喝大量劣質酒；3，愛尋釁滋事他們怎麼能招法國人待見呢？終於，2016年法國歐洲杯上，一向以喝酒鬧事著稱的英格蘭球迷遭到了俄羅斯球迷群體性暴揍。新聞一出，法國全民可謂是喜大普奔，高興了好久。三、中國遊客不會法語咋辦現實生活中，如果你不會法語，那麼在法國生活確實會遇到很大的障礙。法國人認為英語是一個沒啥歷史的合成語言（合成了法語，拉丁語，日耳曼語），怎麼比得上優雅美麗，歷史悠久的法語？！很多法國人不是不會說英語，也不是聽不懂英語，而是就不跟你說英語。最簡單的，你去市政廳辦事或跟煤水電各種公司等打交道，不說法語的話那是啥都辦不成。那麼問題來了，不會法語且連英語也說不溜兒的中國遊客到了法國是否會遇到障礙與白眼？又該如何自處？擱十幾年前這可能是個問題，但現在完全不是問題。各大旅遊景點多有中文標識，各大百貨公司（老佛爺，巴黎春天及各大品牌專賣店等）都有會講中文的工作人員。如果你萬一還是遇到了就不跟你說英語的高傲服務員，好辦，你全程跟他/她說中文就可以了。絕大多數情況下，對方會尬笑著問一句：「Sir/Madam, could you please speak English?」（土浪漫）（本文來源：「環行星球」公眾號）"
中美參謀首長視訊 管控風險保持溝通,2022-07-09,　中共中央軍委聯合參謀部參謀長李作成7日與美軍參謀首長聯席會議主席密利視訊通話。李作成告訴密利，中方在事關國家核心利益問題上，沒有任何妥協退讓的餘地，呼籲「停止美台軍事勾連」，並稱中美兩軍應加強對話、管控風險。五角大廈則說，雙方強調美中雙方保持溝通對話的重要性。,https://www.chinatimes.com/newspapers/20220709000659-260303,中共中央軍委聯合參謀部參謀長李作成7日與美軍參謀首長聯席會議主席密利視訊通話。李作成告訴密利，中方在事關國家核心利益問題上，沒有任何妥協退讓的餘地，呼籲「停止美台軍事勾連」，並稱中美兩軍應加強對話、管控風險。五角大廈則說，雙方強調美中雙方保持溝通對話的重要性。據大陸國防部官網消息，李作成當面告訴密利，中國在事關國家核心利益問題上，沒有任何妥協退讓的餘地，如果有人肆意挑釁，必然遭到中國人民堅定的反制回擊。他重申，中方要求美方恪守一個中國原則和三個聯合公報規定，停止開歷史倒車，「停止美台軍事勾連」，避免衝擊中美關係和台海穩定。中國軍隊將堅決捍衛國家主權和領土完整。李作成指出，當前形勢下，中美兩軍要秉持相互尊重、客觀理性態度，進一步加強對話、管控風險、推進合作，而不是蓄意製造對抗、挑起事端、相互排斥。大陸國防部消息還稱，雙方認為應保持兩軍關係穩定發展、避免引發衝突對抗符合雙方共同利益，雙方可就此保持溝通。此外，雙方還就海空軍事安全、烏克蘭危機等交換意見。路透引述五角大廈發言人說法，指密利與李作成的視訊通話，討論了負責地管控彼此競爭和保持溝通管道暢通的必要性。該發言人還說：「密利將軍強調了解放軍就改善危機溝通及降低戰略風險進行實質對話的重要性」，還包括一系列區域和全球安全議題在內的有成果的討論。李作成另表示，大陸國家主席習近平強調，新時期中美相處應該相互尊重、和平共處、合作共贏。美國總統拜登多次做出「四不一無意」的積極表態，中方對此高度重視。只要堅持兩國元首戰略引領，落實兩國元首重要共識，中美完全可以共同發展、相互成就。在兩人通話之後，共軍東部戰區8日即宣布在台灣周邊海空域，組織多軍兵種聯合戰備警巡和實戰化演練。大陸外交部與國防部發言人同聲指出，該次演練是針對「美台勾連挑釁惡劣行徑」而來。東部戰區發言人施毅表示，近來美方在台灣問題上動作不斷，給台獨分裂勢力撐腰打氣，這完全是徒勞的，只會擾亂台海和平、加劇地區緊張。他重申，台灣是中國的一部分，戰區部隊時刻保持高度戒備，持續加強練兵備戰，堅決捍衛國家主權安全和地區和平穩定，堅決粉碎任何台獨圖謀。近期中美軍事角力不斷。一架美軍P-8A海神式反潛巡邏機（P-8 Poseidon）6月24日下午在「國際空域」飛越台灣海峽，表明對自由開放印太地區的承諾。此舉隨即引來大陸空軍的電子干擾與廣播驅離，雙方在台灣中線海域上空對峙20分鐘。此前，中美針對台灣海峽是否為「國際水域」唇槍舌戰，大陸外交部宣稱對台海擁有主權，美國國務院則稱美軍艦未來將繼續航行通過此「國際水域」。
王毅見布林肯 中美高級官員1個月5次頻繁互動,2022-07-09,大陸《環球時報》環球網9日報導，據中國外交部消息，經中美雙方商定，中國國務委員兼外長王毅將在出席二十國集團外長會期間同美國國務卿布林肯舉行會晤。這將是6月10日中美防長在「香會」期間會談後，中美高層之間的第五次互動。此前四次會談或通話中，「落實兩國元首共識」「四不一無意」「應約」「台灣」「烏克蘭危機」等成為中美通稿中高頻出現的詞彙。,https://www.chinatimes.com/realtimenews/20220709001914-260409,大陸《環球時報》環球網9日報導，據中國外交部消息，經中美雙方商定，中國國務委員兼外長王毅將在出席二十國集團外長會期間同美國國務卿布林肯舉行會晤。這將是6月10日中美防長在「香會」期間會談後，中美高層之間的第五次互動。此前四次會談或通話中，「落實兩國元首共識」「四不一無意」「應約」「台灣」「烏克蘭危機」等成為中美通稿中高頻出現的詞彙。分析人士普遍認為，9日中美外長會談中，「落實元首會晤」「台灣」「烏克蘭危機」等議題都會被再次提及。而對於此次會談的成果，他們則普遍持謹慎態度。《環時》報導，分析認為，中美高級別官員在不到一個月時間內頻繁互動十分罕見。大陸多名專家表示，這顯示出盡管中美矛盾非常尖銳，但不陷入戰略對抗和動盪是雙方的底線。而高頻出現的「台灣」「烏克蘭危機」等詞彙正是當前中美關係面臨的最大難點與挑戰。公開報導顯示，今年6月10日，大陸國務委員兼國防部長魏鳳和同美國國防部長奧斯汀在新加坡舉行的第19屆香格里拉對話會期間舉行會談；3天後的6月13日，中共中央政治局委員、中央外事工作委員會辦公室主任楊潔篪與美國總統國家安全顧問蘇利文在盧森堡舉行會晤；7月5日，中共中央政治局委員、國務院副總理、中美全面經濟對話中方牽頭人劉鶴應約與美財政部長葉倫視訊通話；緊接著，7月7日，中央軍委委員、軍委聯合參謀部參謀長李作成應約與美軍參聯會主席密利視訊通話。《環時》報導，閱讀上述中美會談或通話的中方通稿發現，4次互動中雙方都直接或間接地提到「落實好兩國元首達成的共識」。此外，在上述4篇通稿中，「台灣」出現過3次，美方承諾的「四不一無意」出現過兩次，「烏克蘭危機」出現過3次，其他表達「相互尊重」「保持溝通」等意思的詞彙也經常出現。《環時》報導，中國人民大學國家發展與戰略研究院研究員刁大明指出，最近一個月來，中美高層間的高頻互動其實都圍繞著同一個主線，即「落實兩國元首在今年3月達成的共識」，更具體說就是，加強接觸對話、減少誤解誤判、妥善管控分歧，「無論是台灣議題，還是美方承諾的『四不一無意』，本質上都是上述中美關係定位的延伸。」刁大明說，近期兩國間的密集互動顯示出，中美各層級間的溝通是順暢且坦誠深入的，旨在減少誤判，管控分歧。「尤其兩次軍方溝通格外值得關注，這對中美雙方確定『托底』機制，穩定雙邊關係有著積極意義。」中國國際問題研究院研究員楊希雨分析，除落實兩國元首共識外，促成中美高層在短期內頻繁互動的另一個原因是，盡管中美矛盾非常尖銳、複雜、難解決，但雙方有同一個底線，即避免陷入進一步動盪甚至戰略對抗。「用美國人的話說，這叫作『護欄』，用我們的話說，這叫作『妥善管控分歧』」，他表示，這是雙方的共同需求，並已就此展開實際行動。值得一提的是，中美高層的密集互動正值俄烏衝突牽動全球關注之際，而美國經濟自身在疫情之下也面臨較嚴重的結構性問題。刁大明稱，面對上述局面，華盛頓存在一定動力與動機加強同中國的溝通。「不過，如果美方真正希望解決問題，就應當以建設性而非汙蔑和施壓的態度，本著相互尊重、和平共處、合作共贏的原則來和中國溝通。在經貿等領域也是一樣，如果美方認識到溝通的重要性，就應調整加徵關稅等錯誤措施，而不是採取一邊說要取消關稅、一邊又威脅出口管制等兩面性的做法。」楊希雨則認為，「台灣」「烏克蘭危機」等成為近期中美互動中高頻出現的詞彙，恰恰折射出當下中美關係的最大難點與風險點，「從中方的國家利益出發，中美間最大的風險在於台灣議題的日益升溫；而對於美國來說，隨著華盛頓加大對俄烏衝突的介入，但又遲遲無法達成效果，他們認為應當進一步向中方施壓，盡管我們都知道他們的目標顯然無法達成。」楊希雨強調，這正顯示出中美關係的複雜性與棘手性，以及管控分歧在實踐中的難度。「考慮到中美關係的複雜性，一次會談或幾次會談無法產生立竿見影的效果。但我們希望這是一個持續積累的過程。」楊希雨說，中國一直歡迎同美國在各個層級展開交流以穩定雙邊關係，但重要的是，美國應採取具體行動，修正此前的錯誤政策，而不是僅僅重複口頭言辭。
籃球》中華隊害中國隊染疫？籃協聲明絕無隱匿疫情,2022-07-09,針對先前中國大陸媒體謠傳中華男籃在世界盃資格賽期間，造成中國隊球員染疫的消息，中華籃協9日發表嚴正聲明，強調中華男籃全程都有快篩陰性才能出賽，且無隱匿疫情情況，以下是籃協聲明，「有關台灣部分媒體未經查證即引用中國大陸媒體說法，質疑中華男籃傳染新冠病毒導致中國隊多人確診一事，本會特別提出嚴正聲明如下：,https://www.chinatimes.com/realtimenews/20220709001744-260403,針對先前中國大陸媒體謠傳中華男籃在世界盃資格賽期間，造成中國隊球員染疫的消息，中華籃協9日發表嚴正聲明，強調中華男籃全程都有快篩陰性才能出賽，且無隱匿疫情情況，以下是籃協聲明，「有關台灣部分媒體未經查證即引用中國大陸媒體說法，質疑中華男籃傳染新冠病毒導致中國隊多人確診一事，本會特別提出嚴正聲明如下：中華隊確診球員均依大會防疫規定在飯店房間隔離，並未外出，而中華隊隊職員於參賽期間每天均進行快篩檢測，檢測結果陰性才入場參加比賽，絕無隱匿疫情之情形。中華男籃隊本次會兵分兩路參加世界盃資格賽及亞洲盃，係因亞洲盃為亞運培訓參賽計畫之一，世界盃資格賽上階段沖繩賽事結束後，本會即已公告本階段賽事會以年輕優秀球員為主，後來亞運宣布延期後，經兩隊教練團協調將部分年輕球員改參加世界盃資格賽，累積國際賽經驗。中華隊在出發前檢測，阿提諾及劉駿霆呈現陽性無法出國參賽，在抵達澳洲墨爾本後，雖然澳洲政府防疫規定已鬆綁，大會規定如有身體不適狀況即須快篩，林正因出現不適症狀快篩陽性，全隊篩檢結果王子綱也呈陽性，立即通報FIBA醫療官員並將兩位球員留置在飯店房間隔離，中華隊全體人員也配合大會規定每日快篩，陰性者才可進入球場比賽，中華隊球員確診訊息大會也同步告知其他三支隊伍，用餐時間則安排在獨立空間用餐。比賽結束後直到離境前，中華隊並未與中國隊有任何接觸，為配合我國政府規定，在離澳前再次進行PCR檢測，確診球員由防護員留下陪同至隔離期滿後返台，其餘人員已在7月7日順利返抵國門，目前正在進行居家檢疫及自主防疫中。中華男籃隊自開訓以來即實施定期快篩，隨時掌握隊職員健康狀況，希望隊職員均能在安全、安心的狀態下順利完成比賽返回台灣，隱匿疫情散播病毒給其他國家球員的說法，要與事實不符，特此聲明與各界周知，也希望大家繼續為中華隊加油打氣，團結一心成為我們球員的最佳後盾。」
