title,date,summary,link,content
CNN爆 中國試圖在華府建塔竊情資,2022-07-24,　美英等西方國家近來大肆宣傳中國間諜及駭客行為。CNN於23日獨家報導，中國近年欲藉由建立公共設施項目，或便宜讓美國電信公司買入華為的設備，目的是在美國許多機敏設施附近蒐集訊號。這些地方除了軍事要地外，甚至擴及華府。對此，中國駐英國使館23日發表聲明表示，美英情報部門近來一再編造中國威脅論，惡意誹謗中國、粗暴干涉中國內政，我們對此堅決反對、予以強烈譴責。,https://www.chinatimes.com/newspapers/20220724000287-260108,美英等西方國家近來大肆宣傳中國間諜及駭客行為。CNN於23日獨家報導，中國近年欲藉由建立公共設施項目，或便宜讓美國電信公司買入華為的設備，目的是在美國許多機敏設施附近蒐集訊號。這些地方除了軍事要地外，甚至擴及華府。對此，中國駐英國使館23日發表聲明表示，美英情報部門近來一再編造中國威脅論，惡意誹謗中國、粗暴干涉中國內政，我們對此堅決反對、予以強烈譴責。CNN報導，中國政府在2017年提出斥資1億美元在華盛頓特區國家植物園建造華麗的中國花園計畫，包括寺廟、亭台樓閣和一座70英尺高的白塔，這曾令當地美國官員興奮不已，希望每年藉此吸引更多遊客。但據報導，這座白塔按設計將被戰略性地放置在華盛頓特區的最高點之一，距離美國國會大廈僅兩英里，是蒐集信號情報的理想場所。中國官員還想用裝在海關不能檢查的外交郵袋中的材料，來建造這座寶塔，美國聯邦官員在這項計畫施工開始前悄悄地扼殺了這個項目。報導稱，華為近年常向美國小型農村電信供應商出售幾乎無利可圖的廉價設備，而這些設備都被放置在美國中部軍事基地附近的信號塔上。FBI調查後確定，這些通過聯邦通信委員會（FCC）認證的設備可以識別和破壞美國國防部的通信頻譜，甚至影響到美軍對核武的指揮控制能力。美國聯邦調查局局長瑞伊（Christopher Wray）接受CNN獨訪時表示，FBI每12小時啟動一次新的中國反情報調查，這些調查項目約2000項。這還不算中國的網絡盜竊，中國的駭客計畫比其他所有主要國家的總和還要大，竊取美國個人和公司的數據，比所有國家的總和還要多。中國駐英使館23日對近日美英情報部門的言論發聲明表示，美英等少數國家任意對其他國家進行滲透、顛覆和侵略，在國際上製造對立對抗，給世界很多地方帶來混亂和禍害。孰是孰非，早有公論。敦促美英情報部門糾正錯誤，好好反思自身問題，停止誣蔑中國。針對英國商務部長夸騰（Kwasi Kwarteng）近日以《國家安全投資法》為由，禁止英國曼徹斯特大學向中企出售視覺感測技術智財權一事，中國駐英使館23日表示，維護國家安全要秉持公正、透明，不能採取歧視性做法。任何對國安審查的濫用，都會損害英國的投資環境和長遠利益。
旺報社評》從安倍身影找安全感非常愚昧,2022-07-24,民進黨17日召開全代會，會場中央是巨幅日本前首相安倍晉三的遺照，黨主席蔡英文呼籲莫忘「安倍的期許」，儼然奉安倍為守護台灣的精神導師，想取代日本自民黨成為「安倍主義」繼承人。,https://www.chinatimes.com/opinion/20220724002931-262102,民進黨17日召開全代會，會場中央是巨幅日本前首相安倍晉三的遺照，黨主席蔡英文呼籲莫忘「安倍的期許」，儼然奉安倍為守護台灣的精神導師，想取代日本自民黨成為「安倍主義」繼承人。安倍遇刺身亡，激起台灣對日本的關注，安倍被蔡政府形塑為台日友好的推手，並企圖以此證明「抗中」為台日共享印太戰略利益下的共同行動。安倍「台灣有事等同日本有事，即是美日同盟有事」的一席話，更被解讀成日本將在兩岸衝突時為台灣挺身而出。洞察安倍外交的權衡術台灣民意基金會的民調顯示，高達43.1%受訪者相信台海一旦有事日本會派兵協防台灣，遠高於相信美軍會參戰的34.5%。台灣人在安全上對日本自衛隊的期待高於美軍，反映台灣民間對美、日的心理距離，但此可解讀為台日友好氛圍下，國人昧於現實的對日一廂情願，缺乏對日本政經結構的客觀理解，此亦為台灣對日認識的弔詭，看似親近，實則陌生。殊不論日本囿於和平憲法，台海用兵於法無據，更不能簡單化「台灣有事」、「日本有事」及「美日同盟有事」三者間錯綜複雜的國際政治與律法解釋，視安倍的主張為日本「挺台」、「抗中」的直白表現，忽略日本在美、中對抗中的平衡。美國的日本專家葛林以「競爭而不惹禍」形容安倍的對中戰略，但此非安倍的個人智慧，而是日本與中國歷史交往中，總結出的外交智慧。「安倍外交」巧妙地使日本在美、中之間兩全其美，此亦為安倍身後倍受推崇之處，但「安倍經濟學」成效則相形失色。寬鬆貨幣、擴大財政支出及企業減稅不足以使日本經濟擺脫結構性衰退，卻帶來財政赤字惡化與貧富差距擴大的難解後遺症。2013年至2019年，安倍主政下，實際經濟成長率僅0.9%，與「七大工業國集團」（G7）平均經濟成長率1.6%差距不小，此窺知「安倍經濟學」推升日本經濟力有未逮，但卻債台高築。岸田文雄領導的日本是工業先進國中財政狀況最嚴峻的國家，政府的總體債務高達GDP的2.5倍。在「安倍經濟學」導引的財政貨幣政策下，日本政府擴大公共財政，日本央行為維持利率，購買不斷膨脹的國債，半數的日本國債由日銀持有，規模創新高，隨美國及歐盟先後升息，加速日圓走貶，為日本帶來輸入型通膨。日本經濟依賴中國漸深相較於2013年，日本生產進一步轉移到國外，聯合國貿易和發展會議（UNCTAD）的調查顯示，日本出口在全球出口總額占比自1998年的7.0%至2021年銳減至3.4%。因此，日圓貶值無助日本擴大出口，截至6月，日本已連續11個月出現貿易逆差。日本財務省公布2022年上半年貿易統計初值，貿易收支逆差達7.9241兆日圓，創1979年以來半年逆差新高。據料，日本下半年仍將難脫貿易逆差擴大之勢。然而，美國主導的「脫鉤中國」未撼動中國的世界工廠地位，中國出口占全球出口總額份額自1998年的3.3%大幅成長至2021年的15.1%。在日本經濟困頓之際，中日貿易持續成長，今年上半年，從中國進口大增16.9%。此消彼長，日本雖視中國為安全的最大威脅所在，但中國也是推動日本經濟成長的夥伴，兩者為「親密的競爭對手」，彼此依存。對於中國的兩面性，美國前國務卿季辛吉提醒，「不要與中國進行無休止的對抗」。在地緣政治問題上，需要「尼克森式的靈活性」以化解美國及中國之間、俄羅斯與歐洲其他國家之間的可能衝突。日本對中外交中深諳「尼克森式的靈活性」，以避免招致美國「越頂外交」的傷害，岸田對此了然於胸，在嚇阻與有原則的對中交往間維持平衡。台灣須洞察日本外交的權衡之術，而非昧於現實的在台日關係中取暖，放大安倍的挺台形象，尋找安全感。
新聞透視》對台政策變變變 拜登徒增兩岸震盪,2022-07-24,　美國總統拜登從藉訪日之機拋出「保台」論，到暗示不樂見眾議院議長裴洛西訪台，對台海議題釋出的訊息顯得前後不一，不但令外界忙於解讀、揣摩，也讓台灣的心情跟著七上八下，使台海兩岸與美中台三角關係再掀風波。,https://www.chinatimes.com/newspapers/20220724000289-260108,美國總統拜登從藉訪日之機拋出「保台」論，到暗示不樂見眾議院議長裴洛西訪台，對台海議題釋出的訊息顯得前後不一，不但令外界忙於解讀、揣摩，也讓台灣的心情跟著七上八下，使台海兩岸與美中台三角關係再掀風波。5月23日，拜登與日本首相岸田文雄於東京舉行峰會後，在回答記者提問時聲言，如果中國企圖武力犯台，美國願軍事介入以保衛台灣，並警告共機擾台之舉「正在玩火」。這是拜登迄今有關保台的最強烈措詞，外界因此關注美國對台海「戰略模糊」策略是否已轉向清晰。但是7月20日，拜登在被問到裴洛西訪台消息時卻說，「軍方認為現在這不是個好主意」。儘管裴洛西表示，拜登並未直接告訴她不要訪台，但她猜測「軍方可能擔心我的飛機被擊落之類」。美國《華爾街日報》22日一篇評論則直言，拜登脫稿演出的老毛病又犯了，徒增裴洛西訪台困難度。白宮國安顧問蘇利文22日出席「阿斯本安全論壇」時，重申美方對台「戰略模糊」政策不變，並試圖為拜登的一些訊息看似前後矛盾（contradictory）辯護。蘇利文坦承，「每一屆政府的台灣政策，……都有很多個、許多不同的說法」，但他稱這是模糊戰略的「創造性張力」，讓美國政府在數十年內能夠維持台海兩岸的和平與穩定。然而，拜登的最新訊息，已在兩岸再掀起風波。有美媒指出，拜登對裴洛西訪台表達疑慮，讓台灣感到「受傷」且困惑，甚至令美對台承諾遭受質疑。反之，中國官媒《環球時報》則宣稱，「中方的警告訊息收效（received），五角大廈反對裴洛西訪台。」美國企業研究所（AEI）外交與國防政策主任謝克（Kori Schake）說：「總統曾三次錯誤地表示美國有義務保衛台灣，悖離了一個中國政策的背景……如果我們做出某種政策性宣示，然後總統不以軍事力量支持，這可能會讓台灣人陷入一種可怕的境地。」
裴洛西訪台恐爆台海重大危機 美媒曝官員勸退內幕,2022-07-24,《華盛頓郵報》（The Washington Post）引述美國政府官員表示，拜登政府官員愈來愈擔心美國眾議院議長裴洛西（Nancy Pelosi）8月訪問台灣的計畫可能引發台海重大危機，包括白宮及一票國安官員已經向裴洛西及她的團隊彙報現在訪台的風險，官員們希望在不引發公眾騷動的情況下「勸退」裴洛西。,https://www.chinatimes.com/realtimenews/20220724000872-260408,"《華盛頓郵報》（The Washington Post）引述美國政府官員表示，拜登政府官員愈來愈擔心美國眾議院議長裴洛西（Nancy Pelosi）8月訪問台灣的計畫可能引發台海重大危機，包括白宮及一票國安官員已經向裴洛西及她的團隊彙報現在訪台的風險，官員們希望在不引發公眾騷動的情況下「勸退」裴洛西。《華盛頓郵報》23日指出，美國官員擔心，北京會將裴洛西訪台視為美國的刻意挑釁，一名匿名官員透露，國防部、軍方、情報官員已經解釋此行時間點伴隨的風險，向裴洛西彙報的高官還包括美軍參謀首長聯席會議主席密利（Mark Milley），「但所有人都理解，這是她的決定。」英國《金融時報》（Financial Times）上周報導裴洛西8月將率團訪問台灣，美國總統拜登隨後表示「軍方認為現在不是個好主意」，裴洛西隨後回應拜登，指出她並不主張台灣獨立，但是「我認為對台灣展現支持很重要」，她也補充說：「在台灣問題上，我們從沒有人說過我們支持獨立，那要由台灣來決定。」報導指出，兩個在健保、烏克蘭議題上都緊密合作的民主黨大咖如今出現分歧相當罕見，裴洛西的選區中有高達1／3選民為亞裔美國人，長久以來劍指中國大陸一直是她的主要政治標記。不過美國官員說，問題並不在於向北京屈服，「這不是與台灣站在一起的問題」，「問題在於整個地區都非常擔心會被許多人視為挑釁，並且引發中國用可能無法預期的方式回應。」官員也強調，美國政府不能告訴裴洛西該做什麼，「毫無疑問人們非常了解，現在、任何時候我們都必須尊重權力分立（Separation of powers）。」針對裴洛西傳出將訪台，大陸外交部發言人趙立堅上周警告美國後果自負。美國官員說，北京不太可能區分裴洛西及拜登，或了解到總統不能下令裴洛西不要出訪，北京只會將此行視為美國政府的挑釁。針對率團訪問台灣的報導，裴洛西辦公室並未證實，裴洛西本人也以安全為由，表示從不討論自己的出訪計畫，不過作為國會議長，裴洛西如果出訪，有可能會搭乘軍機。報導指出，如今美國政府官員正在謹慎行事，希望在不引發公眾騷動的狀況下「勸退」裴洛西，不過行政部門普遍擔心此行出訪可能引發的後果。華府智庫德國馬歇爾基金會（GMF）亞洲計畫主任葛來儀（Bonnie Glaser）指出，「政府內部的多數看法是，現在不是裴洛西訪問台灣的好時機」，「中國一直在以各種方式示意，將會對她的出訪做出強烈反應。」葛來儀說：「在美中關係上，我們處在愈來愈危險的時刻上，特別是台灣議題，雙邊都致力於在這個地區展現決心。」美國官員表示，大陸對裴洛西的訪問計畫傳遞了非常明確的訊息，並且公開做出具體的警告。針對美國政府無權下令裴洛西不訪問台灣的說法，北京官員並不買帳，一名大陸官員表示，「美方有能力阻止這群小丑在台灣表演」，「一次又一次，美國政府選擇了不這麼做。」<p dir=""ltr"" lang=""en"">The PRC is wrong in its belief that “The U.S. side has the ability to stop these clowns from performing in Taiwan,” or that the president can prevent Pelosi from visiting Taiwan. <a href=""https://t.co/f5t5AlANhc"">https://t.co/f5t5AlANhc</a>"
糧食危機 躍中美角力新戰場,2022-07-24,　俄烏戰爭僵局難解，全球糧食供應仍舊緊張，美國為此向糧食進口和儲備大國中國發難。美方官員近日接力批評中國在全球糧食危機期間，採取的囤糧行為，呼籲加大出口和釋放糧食儲備。中國則反批美國哄抬穀物價格「不負責任」。,https://www.chinatimes.com/newspapers/20220724000099-260203,"俄烏戰爭僵局難解，全球糧食供應仍舊緊張，美國為此向糧食進口和儲備大國中國發難。美方官員近日接力批評中國在全球糧食危機期間，採取的囤糧行為，呼籲加大出口和釋放糧食儲備。中國則反批美國哄抬穀物價格「不負責任」。糧食問題儼然中美角力新戰場。路透23日報導，針對全球糧食緊張問題，美國國務院制裁協調辦公室主任歐布萊恩（James O’Brien）表示，中國持續積極購買穀物，儘管全球高達數億人正面臨糧食短缺危機，中國糧食儲備卻不間斷。國際穀物理事會估計，截至2021/22年度末，中國的穀物庫存約3.234億噸，超過全球總量6.074億噸的一半，並遠高於世界第一大穀物出口國美國，美國穀物庫存預計為5,780萬噸。歐布萊恩指出，4月從烏克蘭運出的首批穀物中，約40％運往中國。他強調，美國將繼續督促俄羅斯，履行聯合國促成的恢復烏克蘭黑海穀物出口協議，並希望看到中國為因應全球糧食危機做出努力，向全球窮人提供更多穀物。美國農業部此前公布數據顯示，預計至2022年上半年，中國各項糧食儲備分別將占全球玉米的69％、大米60％和小麥51％，且過去十年間，中國糧食儲備累計增加約20個百分點。稍早前，美國國際開發署署長鮑爾（Samantha Power）18日表示，拒絕譴責俄羅斯入侵烏克蘭的國家恐將加速全球糧食危機，並點名中國囤貨化肥和糧食，呼籲其提供更多人道主義援助，並出口更多糧食和化肥。面對美方指責，中國駐美大使館發言人劉鵬宇表示，中國耕地面積不到世界的9％，全國人口卻占世界的五分之一，因此需要保持一定的糧食儲備。此外，中國為解決全球糧食安全問題做出積極貢獻，向開發中國家提供約3萬噸緊急人道主義糧食援助。他反批美國並未採取任何措施來減少該國用於能源的糧食消耗，甚至利用機會抬高穀物價格，謀取私利，極其不負責任。另據中國海關總署22日公布數據顯示，中國2022年上半年糧食進口量為7,978萬噸，年減5.4％。其中6月進口糧食為1,326萬噸，較5月減少265萬噸，年減約四分之一。分項來看，除了大米、高粱進口量大增，小麥、玉米、大麥和大豆等進口均呈不同程度下降。"
台灣問題 蘇利文：美國保持戰略模糊政策,2022-07-24,　白宮國家安全顧問蘇利文22日重申，美國的「一中政策」沒有改變，而在台灣問題上，他相信「模糊必須是戰略的特徵」。他還表示，美國將繼續提供更有利於應對潛在威脅的武器，幫助台灣發展「豪豬」戰略。,https://www.chinatimes.com/newspapers/20220724000274-260108,白宮國家安全顧問蘇利文22日重申，美國的「一中政策」沒有改變，而在台灣問題上，他相信「模糊必須是戰略的特徵」。他還表示，美國將繼續提供更有利於應對潛在威脅的武器，幫助台灣發展「豪豬」戰略。蘇利文在「阿斯本安全論壇」（Aspen Security Forum）上被問到，美國總統拜登曾三次在不同場合說過將「軍事保衛台灣」，這到底是「隨口一說」，還是代表對台政策改變？他回答說，美國對台政策始終如一。在台灣問題上， 美國將繼續保持「戰略模糊」政策。創造性張力 維持台海數十年和平蘇利文坦承，「每一屆政府的台灣政策，無論是聲明性的政策還是實際政策，都有很多個、許多不同的說法」，外界會質疑這些怎麼能融合在一起。但他稱這是模糊戰略的「創造性張力」，它讓美國多屆政府在數十年內能夠維持台海的和平與穩定，而「正如總統本人所說，我們的政策沒有改變」。「戰略模糊」係指，美國政府不明確表態是否協防台灣，這樣可以讓北京因為擔心美國出兵，而在攻台問題上三思而後行，同樣也可以讓台灣因為擔心美國不出兵，而在台獨等敏感問題上不會過於挑釁北京。蘇利文再解釋模糊戰略的優勢說，「這不僅在國際事務中如此，在人類生活的許多不同領域也是如此。我不會說這是前後不一致。……在非常複雜情況下，模糊必須是戰略的一個特徵。是的，從理念上來說，我捍衛這個概念。」萊斯：現非拋棄一中政策最好時機在蘇利文作此表示前，剛訪台歸來的美國前國防部長艾斯培在阿斯本論壇上再次表示，美國「一中政策」已經過時，呼籲應放棄「戰略模糊」。不過，前國務卿萊斯在論壇上說，現在並不是拋棄「一中政策」的最好時機， 因為這很久以來「很好地服務於我們的利益以及台灣的利益」。不對稱作戰 烏若勝有效嚇阻中國據美國之音報導，蘇利文還被問到，美國是否有能力在向烏克蘭提供武器的同時，也可以向台灣提供武器。他指出，烏、台的武器系統有一定重疊，但是因為歐洲的是陸戰，而台灣的潛在衝突是海戰，兩者所需武器並不盡相同，美國要做的是專注向台灣提供「最有用」武器，幫助台灣發展「豪豬」戰略。「豪豬」戰略係指，應讓台灣像隻長滿尖刺的豪豬，以防禦掠食者攻擊，該戰略也被稱為「不對稱作戰」。蘇利文對此又說：「美國歷屆政府，以及我們過去18個月中加快步伐所做的，就是努力確保在我們與台灣的國防和安全關係中，專注於發展那些在可預期的突發事件中最有用的功能，而不僅僅是依賴於已存在很長時間的系統。」蘇利文並認為，若西方能幫助贏得烏克蘭戰爭，對中國將會產生一定影響，儘管這未必能夠最終阻止中國攻台計畫。「我們在烏克蘭的部分目標就是，要展現必須能夠顯示出力量、韌性、持久力、判斷力和能力，因為這將對我們的能力，在其他地方有效嚇阻其他人產生一些影響。」防美中衝突升級 觸發新一輪冷戰他還表示，台灣也正在從烏克蘭戰爭中汲取經驗，包括學習如何進行公民動員和國土防禦，建立資訊戰能力，以及為可能與中國發生衝突的潛在突發事件做準備。蘇利文另被問到如何看待與中國競爭。他說，美國需要警惕與中國的衝突升級，觸發新一輪冷戰。而談到拜登政府上台前，中國曾表示，中國崛起和美國衰退是不可避免的，蘇利文則表示：「跟美國對賭不會有好結果。」
大陸領導人 全數接種國產疫苗,2022-07-24,　大陸國家衛健委副主任曾益新23日在國務院聯防聯控機制新聞發布會上表示，大陸現職的「黨和國家領導人」都已完成新冠疫苗接種，且接種的都是大陸國產疫苗。這也是大陸官方首次證實中共總書記習近平已經接種大陸國產疫苗。但近日大陸部分疫情也有升溫現象，統計22日新增722例本土個案，以甘肅與廣西為主。,https://www.chinatimes.com/newspapers/20220724000533-260303,大陸國家衛健委副主任曾益新23日在國務院聯防聯控機制新聞發布會上表示，大陸現職的「黨和國家領導人」都已完成新冠疫苗接種，且接種的都是大陸國產疫苗。這也是大陸官方首次證實中共總書記習近平已經接種大陸國產疫苗。但近日大陸部分疫情也有升溫現象，統計22日新增722例本土個案，以甘肅與廣西為主。據大陸央視引述解放軍總醫院第五醫學中心感染病醫學部主任、中國科學院院士王福生表示，儘管打過疫苗會有突破性感染，但強調「不能因為有突破性感染，就認為打了疫苗防不了感染，這是不科學的。」王福生說，疫苗對突破性感染的保護效果顯著，且出現突破性感染患者當中，絕大多數是無症狀的，僅少數是普通型，發生重症病例也較少。大陸所稱「黨和國家領導人」，包含中共中央政治局、國家機構與全國政協等的副國級以上官員，現職約有數十人，這當中自然也包含中共總書記習近平。這也是大陸官方首次證實習近平已打大陸國產疫苗。值得注意是，近日大陸部分地區疫情確有升溫跡象。大陸國家衛健委公告22日新增722例本土個案，大部分來自甘肅、廣西。其中單日329例、占比最高的甘肅，據甘肅省疾控中心主任醫師王旭霞表示，數據顯示本輪疫情已傳播至少5代，雖然傳播力開始下降，但目前還高於該省今年3月情形。在疫苗接種進度方面，統計至本月22日，全大陸累計接種新冠病毒疫苗34億1672.7萬劑次。第一劑次接種覆蓋率為92.1％，全程接種率（兩劑）為89.7％，加強免疫接種率（三劑）為71.7％。大陸中華預防醫學會常務副會長馮子健稱，國際上大規模使用中國製疫苗的國家也都未發現問題，顯示陸產疫苗非常安全。目前中國也有3款疫苗被世界衛生組織納入緊急使用清單，逾百國家批准中國產疫苗。
